sumber,tanggal,judul,content,author,url,created_at
republika,2025-08-16 18:13:15,"Beban Bunga Utang Rp600 Triliun, INDEF Sarankan Dialihkan untuk Pendidikan dan MBG","REPUBLIKA.CO.ID, JAKARTA -- Peneliti INDEF Riza Annisa Pujarama menyoroti postur RAPBN 2026 yang masih terbebani pembayaran bunga utang sangat besar. Menurutnya, dana Rp600 triliun untuk bunga utang bisa dialihkan untuk kebutuhan lebih produktif, khususnya pendidikan dan program prioritas Makan Bergizi Gratis (MBG).

""Kalau kita bisa menekan bunga utang, dana sebesar itu bisa lebih produktif untuk pendidikan dan program seperti MBG,"" tegas Riza dalam Diskusi Publik bertajuk Penerimaan Cekak, Program Unggulan Membengkak?: Tanggapan Atas Nota Keuangan RAPBN 2026 , Sabtu (1682025).

""Kalau kita bisa menekan bunga utang, dana sebesar itu bisa lebih produktif untuk pendidikan dan program seperti MBG,"" tegas Riza dalam Diskusi Publik bertajuk

Penerimaan Cekak, Program Unggulan Membengkak?: Tanggapan Atas Nota Keuangan RAPBN 2026

Dalam RAPBN 2026, belanja negara dirancang Rp3.786,5 triliun, naik 7,3 persen dari outlook 2025. Dari jumlah itu, alokasi pembayaran bunga utang mencapai Rp600 triliun atau sekitar 15 persen, meningkat dibanding Rp532,9 triliun tahun sebelumnya.

Dalam RAPBN 2026, belanja negara dirancang Rp3.786,5 triliun, naik 7,3 persen dari outlook 2025. Dari jumlah itu, alokasi pembayaran bunga utang mencapai Rp600 triliun atau sekitar 15 persen, meningkat dibanding Rp532,9 triliun tahun sebelumnya.

Riza menilai beban itu mengurangi ruang fiskal untuk menambah belanja produktif. Padahal, Presiden RI Prabowo Subianto menegaskan komitmen memperluas cakupan program MBG.

Riza menilai beban itu mengurangi ruang fiskal untuk menambah belanja produktif. Padahal, Presiden RI Prabowo Subianto menegaskan komitmen memperluas cakupan program MBG.

Dengan mengurangi beban utang, sebetulnya pemerintah bisa memperbesar manfaat langsung ke masyarakat, bukan hanya untuk bayar bunga,"" ujarnya.

Dengan mengurangi beban utang, sebetulnya pemerintah bisa memperbesar manfaat langsung ke masyarakat, bukan hanya untuk bayar bunga,"" ujarnya.

Menkeu Sri Mulyani Indrawati dalam Konferensi Pers RAPBN 2026 menjelaskan, pendapatan negara ditargetkan Rp3.147,7 triliun atau tumbuh 9,8 persen. Target itu didorong penerimaan pajak Rp2.357,7 triliun yang harus tumbuh 13,5 persen, kepabeanan dan cukai Rp334,3 triliun, serta PNBP Rp455 triliun yang justru turun 4,7 persen.

Menkeu Sri Mulyani Indrawati dalam Konferensi Pers RAPBN 2026 menjelaskan, pendapatan negara ditargetkan Rp3.147,7 triliun atau tumbuh 9,8 persen. Target itu didorong penerimaan pajak Rp2.357,7 triliun yang harus tumbuh 13,5 persen, kepabeanan dan cukai Rp334,3 triliun, serta PNBP Rp455 triliun yang justru turun 4,7 persen.

Belanja KementerianLembaga (KL) juga meningkat signifikan 17,5 persen menjadi Rp1.498,3 triliun, sementara belanja non-KL mencapai Rp1.638,2 triliun, naik 18 persen. Defisit APBN diperkirakan Rp638,8 triliun atau 3,5 persen PDB, dengan keseimbangan primer makin mendekati nol di angka Rp39,4 triliun.

Belanja KementerianLembaga (KL) juga meningkat signifikan 17,5 persen menjadi Rp1.498,3 triliun, sementara belanja non-KL mencapai Rp1.638,2 triliun, naik 18 persen. Defisit APBN diperkirakan Rp638,8 triliun atau 3,5 persen PDB, dengan keseimbangan primer makin mendekati nol di angka Rp39,4 triliun.

Agenda prioritas Presiden, ketahanan pangan, energi, pendidikan bermutu, kesehatan berkualitas, pembangunan desa koperasi, pertahanan semesta, dan percepatan investasi serta perdagangan global, itu semuanya sudah masuk di dalam APBN,"" jelas Menkeu.

Agenda prioritas Presiden, ketahanan pangan, energi, pendidikan bermutu, kesehatan berkualitas, pembangunan desa koperasi, pertahanan semesta, dan percepatan investasi serta perdagangan global, itu semuanya sudah masuk di dalam APBN,"" jelas Menkeu.

Sementara itu, Presiden Prabowo menyebut program MBG kini sudah menjangkau 20 juta masyarakat, termasuk anak sekolah, ibu hamil, dan ibu menyusui. ""Sekarang, kita telah mencapai kemajuan yang membanggakan, pagi ini saya mendapat laporan dari BGN sudah 20 juta anak-anak sekolah, anak belum sekolah, ibu hamil, dan ibu menyusui, sudah menerima makan bergizi gratis setiap hari,"" ujar Prabowo dalam Nota Keuangan 2026.

Sementara itu, Presiden Prabowo menyebut program MBG kini sudah menjangkau 20 juta masyarakat, termasuk anak sekolah, ibu hamil, dan ibu menyusui. ""Sekarang, kita telah mencapai kemajuan yang membanggakan, pagi ini saya mendapat laporan dari BGN sudah 20 juta anak-anak sekolah, anak belum sekolah, ibu hamil, dan ibu menyusui, sudah menerima makan bergizi gratis setiap hari,"" ujar Prabowo dalam Nota Keuangan 2026.

Prabowo menyebut program ini meningkatkan gizi anak sekaligus memperbaiki pendidikan. Hingga kini, ada 5.800 Satuan Pelayanan Pemenuhan Gizi (SPPG) di 38 provinsi. MBG juga membuka 290 ribu lapangan kerja baru di dapur penyedia makanan serta melibatkan 1 juta petani, nelayan, peternak, dan UMKM dalam rantai pasok. ""Dalam tujuh bulan, kita berhasil apa yang negara-negara lain butuh belasan tahun. Brazil, butuh 11 tahun untuk mencapai 40 juta MBG tiap hari,"" ujarnya.

Prabowo menyebut program ini meningkatkan gizi anak sekaligus memperbaiki pendidikan. Hingga kini, ada 5.800 Satuan Pelayanan Pemenuhan Gizi (SPPG) di 38 provinsi. MBG juga membuka 290 ribu lapangan kerja baru di dapur penyedia makanan serta melibatkan 1 juta petani, nelayan, peternak, dan UMKM dalam rantai pasok. ""Dalam tujuh bulan, kita berhasil apa yang negara-negara lain butuh belasan tahun. Brazil, butuh 11 tahun untuk mencapai 40 juta MBG tiap hari,"" ujarnya.

Ikuti Whatsapp Channel Republika",Gita Amanda,https://republika.co.id/berita//t13363423/beban-bunga-utang-rp600-triliun-indef-sarankan%c2%a0dialihkan-untuk%c2%a0pendidikan-dan-mbg,2026-02-02 20:23:02
republika,2025-08-16 07:05:12,"Anggaran Pendidikan pada 2026 Sebesar Rp 757,8 Triliun, Rp 335 Triliun untuk MBG","REPUBLIKA.CO.ID, JAKARTA Pemerintah Indonesia akan menggelontorkan sebanyak Rp 757,8 triliun untuk anggaran pendidikan pada 2026. Angka tersebut merupakan alokasi sebesar 20 persen dari anggaran belanja dalam RAPBN 2026 sebesar Rp 3.786,5 triliun.

Menteri Keuangan RI Sri Mulyani menjelaskan, angka tersebut dibagi dalam tiga pos. yakni untuk siswamahasiswa, untuk gurudosentenaga kependidikan, dan untuk sekolahkampus.

Anggaran yang diterima murid, siswa dan mahasiswa, Rp 401,5 triliun dalam bentuk, mulai dari beasiswa bidik misi, LPDP, pengiriman kartu Program Indonesia Pintar (PIP), dan Makan Bergizi Gratis (MBG), ujar Sri Mulyani dalam konferensi pers RAPBN dan Nota Keuangan Tahun Anggaran 2026 di Kantor Direktorat Jenderal Pajak, Jakarta, Jumat (1582025).

Perinciannya, anggaran yang dialokasikan untuk bidikmisiKIP kuliah sebesar Rp 17,2 triliun dan beasiswa LPDP Rp 25 triliun untuk 4.000 mahasiswa. Lalu PIP sebesar Rp 15,6 triliun dengan jumlah penerima manfaat sebanyak 21,1 juta siswa. Serta alokasi untuk MBG sebesar Rp 335 triliun untuk 82,9 juta orang dan untuk 30 ribu satuan pelayanan pemenuhan gizi (SPPG).

Untuk benefit diterima gurudosentenaga kependidikan yaitu Rp 178,7 triliun, lanjutnya.

Perinciannya, untuk tunjangan profesi guru (TPG) non pegawai negeri sipil (PNS) sebesar Rp 19,2 triliun untuk 754.747 guru. TPG ASND (ASN daerah) sebesar Rp 68,7 triliun dengan jumlah penerima manfaat 1,6 juta guru. Lalu alokasi untuk pengembangan profesional guruteacher professional development (TPD) non PNS sebesar Rp 3,2 triliun untuk 80.325 dosen, serta TPG PNS, TPD PNS, dan gaji pendidik ialan mencapai Rp 82,9 triliun.

Yang ketiga, sarana prasarana sekolah dan kampus sebanyak Rp 150 triliun, diantaranya rehabilitasi sekolah dalam hal ini sekolah rakyat ada anggarannya tahun depan mencapai Rp 24,9 triliun, ujar Sri Mulyani.

Anggaran hampir Rp 25 triliun tersebut meliputi alokasi untuk pembangunan barus di 200 lokasi sebesar Rp 20 triliun dan operasional di 200 lokasi sebesar Rp 4,9 triliun. Kemudian, bantuan operasional sekolah (BOS) dianggarkan Rp 64,3 triliun untuk 53,6 juta siswa, bantuan operasional penyelenggaraan (BOP) PAUD sebesar Rp 5,1 triliun untuk 7,7 juta siswa.

Sebanyak Rp 22,5 triliun dialokasikan untuk renovasi untuk 850 madrasah dan 11.686 sekolah. Lalu untuk Bantuan Operasional Perguruan Tinggi Negeri (BOPTN) dianggarkan sebanyak Rp 9,4 triliun untuk 201 PTNlembaga.

Mengenai sekolah unggulan, ada anggaran Rp 3 triliun. Pembangunan sekolah unggul Garuda ada di sembilan lokasi, ujarnya.

Ikuti Whatsapp Channel Republika",Mas Alamil Huda,https://republika.co.id/berita//t1288o487/anggaran-pendidikan-pada-2026-sebesar-rp-7578-triliun-rp-335-triliun-untuk-mbg,2026-02-02 20:23:04
republika,2025-08-16 11:07:52,Program MBG Dinilai Dukung Perputaran Ekonomi,"REPUBLIKA.CO.ID, JAKARTA Anggota Majelis Permusyawaratan Rakyat Republik Indonesia (MPR RI) Melchias Markus Mekeng menilai program Makan Bergizi Gratis (MBG) dan sekolah rakyat akan berdampak pada pertumbuhan ekonomi rakyat. Hal tersebut dikatakan Mekeng setelah mendengar pidato Prabowo tentang program MBG dan Sekolah Rakyat di Sidang Tahunan MPR RI di gedung Parlemen, Jakarta Pusat, Jumat (158).

Pidato Presiden sangat luar biasa. Kinerja beliau sangat baik, dan saya yakin program-programnya yang merakyat, seperti Makan Bergizi Gratis (MBG) dan Sekolah Rakyat, akan mendorong pertumbuhan ekonomi kita,"" kata Mekeng.

Pidato Presiden sangat luar biasa. Kinerja beliau sangat baik, dan saya yakin program-programnya yang merakyat, seperti Makan Bergizi Gratis (MBG) dan Sekolah Rakyat, akan mendorong pertumbuhan ekonomi kita,"" kata Mekeng.

Melalui MBG, kebutuhan gizi masyarakat akan terpenuhi sekaligus roda ekonomi di bidang pertanian pun akan berputar karena harus memenuhi kebutuhan lauk makan bergizi.

Melalui MBG, kebutuhan gizi masyarakat akan terpenuhi sekaligus roda ekonomi di bidang pertanian pun akan berputar karena harus memenuhi kebutuhan lauk makan bergizi.

Sekolah rakyat sendiri juga diyakini dapat memutus mata rantai angka anak-anak yang tidak sekolah sehingga di masa depa mereka bisa mendapatkan pekerjaan layak dengan modal pendidikan.

Sekolah rakyat sendiri juga diyakini dapat memutus mata rantai angka anak-anak yang tidak sekolah sehingga di masa depa mereka bisa mendapatkan pekerjaan layak dengan modal pendidikan.

Mekeng melanjutkan, Prabowo juga dinilai berhasil menjaga keutuhan bangsa, menciptakan kedamaian, dan tegas terhadap pihak-pihak yang memanfaatkan kekayaan negara hanya untuk kepentingan diri sendiri.

Mekeng melanjutkan, Prabowo juga dinilai berhasil menjaga keutuhan bangsa, menciptakan kedamaian, dan tegas terhadap pihak-pihak yang memanfaatkan kekayaan negara hanya untuk kepentingan diri sendiri.

Terlebih, lanjut Mekeng, Prabowo dalam pidatonya menekankan Pasal 33 Undang-undang Dasar 1945 yang menekankan konsep perekonomian disusun sebagai usaha bersama berdasar atas asas kekeluargaan.

Terlebih, lanjut Mekeng, Prabowo dalam pidatonya menekankan Pasal 33 Undang-undang Dasar 1945 yang menekankan konsep perekonomian disusun sebagai usaha bersama berdasar atas asas kekeluargaan.

Cabang-cabang produksi yang penting bagi negara dan mempengaruhi hajat hidup orang banyak dikuasai oleh negara.

Cabang-cabang produksi yang penting bagi negara dan mempengaruhi hajat hidup orang banyak dikuasai oleh negara.

""Bumi dan air dan kekayaan alam yang terkandung di dalamnya dikuasai oleh negara dan dipergunakan untuk sebesar-besar kemakmuran rakyat,"" kata Mekeng.

""Bumi dan air dan kekayaan alam yang terkandung di dalamnya dikuasai oleh negara dan dipergunakan untuk sebesar-besar kemakmuran rakyat,"" kata Mekeng.

Kini tugas dirinya dan seluruh anggota legislatif lainnya yakni mengawasi kinerja Prabowo guna memastikan seluruh program-program kerakyatan berjalan.

Kini tugas dirinya dan seluruh anggota legislatif lainnya yakni mengawasi kinerja Prabowo guna memastikan seluruh program-program kerakyatan berjalan.

Dengan pengawasan yang ketat, Mekeng yakin program pemerintah akan berjalan dengan maksimal dan memberikan dampak baik bagi masyarakat.

Dengan pengawasan yang ketat, Mekeng yakin program pemerintah akan berjalan dengan maksimal dan memberikan dampak baik bagi masyarakat.

Ikuti Whatsapp Channel Republika",Satria K Yudha,https://republika.co.id/berita//t12jh4416/program-mbg-dinilai-dukung-perputaran-ekonomi,2026-02-02 20:23:05
republika,2025-08-16 06:50:33,"Rayakan HUT RI, PT Sumber Bumi Putera Adakan MBG di Sekolah","REPUBLIKA.CO.ID, JAKARTA -- Halaman Sekolah Dasar Negeri 5 Molawe tak seperti biasanya. Suara tawa anak-anak bercampur aroma nasi hangat, sayur segar, dan lauk bergizi yang tersaji di meja panjang.

Kegiatan itu ternyata dalan rangka menyambut Hari Ulang Tahun Kemerdekaan Indonesia ke-80, PT Sumber Bumi Putera (SBP) mengadakan program Makan Bergizi Gratis (MBG) bagi ratusan siswa. SBP ialah perusahaan tambang nikel yang beroperasi di Desa Puusuli, Kecamatan Andowia, Konawe Utara.

Kegiatan ini menjadi bagian dari Pengembangan dan Pemberdayaan Masyarakat (PPM) yang rutin digelar perusahaan. PT SBP sekaligus mengaitkan langkah ini dengan agenda nasional mendukung program unggulan Presiden Prabowo Subianto dan Wakil Presiden Gibran Rakabuming Raka mewujudkan makan bergizi gratis (MBG) untuk anak sekolah.

Kegiatan ini adalah kali kedua. Sebelumnya juga kami lakukan di sekolah-sekolah lingkar tambang. Ini bentuk komitmen PT SBP memenuhi kewajiban dan tanggung jawab sosial terhadap masyarakat sekaligus mendukung penuh program makan bergizi gratis pemerintah, kata Humas PT SBP, Sumadil dalam keterangannya pada Jumat (1582025).

Tak hanya MBG, Kepala Teknik Tambang PT SBP, Sudriyanto, menyebut rangkaian PPM perusahaan akan berlanjut usai peringatan 17 Agustus. Diantaranya pemeriksaan kesehatan dan gizi gratis bagi masyarakat lingkar tambang, serta program pemberangkatan umrah untuk warga sekitar yang akan dilaksanakan 18 Agustus mendatang.

Semua ini bagian dari upaya kami meningkatkan kesejahteraan dan kesehatan masyarakat di wilayah lingkar tambang PT SBP, ujarnya.

Dukungan datang pula dari pihak sekolah. Kepala SD Negeri 5 Molawe, Ida Rohani menyebut kegiatan ini sangat bermanfaat untuk pertumbuhan anak-anak.

""Mereka lebih bersemangat belajar ketika kebutuhan gizinya terpenuhi. Saya kira Presiden Prabowo akan sangat senang jika program seperti ini diikuti perusahaan-perusahaan lain, terutama di sektor tambang, kata Ida.

Tercatat, PT SBP melaksanakan program PPM setiap tiga bulan. Namun, suasana HUT RI ke-80 tahun ini memberi warna tersendiri, ketika perayaan kemerdekaan dipadukan dengan aksi nyata perusahaan untuk kesehatan generasi muda di lingkar tambang.

Ikuti Whatsapp Channel Republika",Erdy Nasrul,https://republika.co.id/berita//t127k9451/rayakan-hut-ri-pt-sumber-bumi-putera-adakan-mbg-di-sekolah,2026-02-02 20:23:09
republika,2025-08-15 20:57:56,Anggaran MBG Naik Jadi Rp335 Triliun pada 2026,"REPUBLIKA.CO.ID, JAKARTA -- Anggaran Makan Bergizi Gratis akan naik pada 2026. Presiden Prabowo Subianto saat menyampaikan pidatonya mengenai Rancangan Undang-Undang (RUU) tentang APBN Tahun Anggaran 2026 beserta Nota Keuangan menyebut pemerintah menganggarkan Rp335 triliun untuk membiayai program Makan Bergizi Gratis (MBG) dalam RAPBN Tahun 2026.

Saat berpidato di hadapan para wakil rakyat pada Sidang Paripurna Pembukaan Masa Persidangan I DPR Tahun Sidang 2025-2026 di Gedung Nusantara, Kompleks Parlemen, Jakarta, Jumat (1582025), Presiden Prabowo menjelaskan dana APBN itu digunakan untuk membiayai makan bergizi gratis yang disalurkan kepada 82,9 juta penerima pada tahun 2026.

""Ke depan, program ini akan efektif memberi manfaat lebih luas dan optimal bagi masyarakat. MBG meningkatkan kualitas gizi anak-anak kita, kualitas SDM masa depan Indonesia, dan juga memberdayakan UMKM dan ekonomi lokal yang akan tumbuh semakin kuat, menciptakan ratusan ribu lapangan kerja baru, dan memberdayakan jutaan petani, nelayan, peternak, dan pelaku-pelaku UMKM. Alokasi anggaran untuk MBG tahun 2026 kita alokasikan sebesar Rp335 triliun,"" kata Kepala Negara.

MBG, yang diluncurkan pada 6 Januari 2025, ditargetkan diterima oleh 82,9 juta pada akhir 2025. Per hari ini, Presiden Prabowo menyebut MBG telah diterima oleh 20 juta penerima manfaat yang terdiri atas anak-anak sekolah, anak-anak balita, ibu-ibu hamil, dan ibu-ibu menyusui di 38 provinsi.

""Kita bangun generasi unggul, anak-anak kita melalui makan bergizi gratis. Generasi unggul lahir dari tubuh yang sehat, dengan gizi terpenuhi. Kita hilangkan stunting dalam waktu yang secepat-cepatnya. Program Makan Bergizi Gratis telah dilaksanakan di seluruh provinsi,"" ujar Presiden.

Dalam RAPBN 2026, Presiden menekankan anggaran dialokasikan utamanya untuk membiayai delapan agenda prioritas pemerintah, diantaranya bidang ketahanan pangan, ketahanan energi, program makan bergizi gratis (MBG), peningkatan kualitas pendidikan, kesehatan, perekonomian rakyat, pertahanan rakyat semesta, dan percepatan investasi.

Secara rinci, anggaran negara mengalami kenaikan 2,48 persen dari produk domestik bruto (PDB) atau sekira Rp638,8 triliun.

APBN 2026 akan defisit 2,48 persen dari GDP, ini adalah penurunan defisit kalau kita lihat dibandingkan tahun 2025 outlook yaitu 2,78 persen, ujar Menteri Keuangan RI Sri Mulyani dalam konferensi pers RAPBN dan Nota Keuangan Tahun Anggaran 2026 di Kantor Direktorat Jenderal Pajak, Jakarta, Jumat (1582025).

Sri Mulyani menjelaskan, pendapatan negara pada 2026 ditargetkan mencapai hingga Rp3.147,7 triliun. Angka tersebut naik 9,8 persen dari tahun sebelumnya dengan outlook sebesar Rp2.865,5 triliun.

Presiden Prabowo Subianto - (republikaprayogi)

Presiden Prabowo Subianto - (republikaprayogi)

Ikuti Whatsapp Channel Republika",Lida Puspaningtyas,https://republika.co.id/berita//t11g4k502/anggaran-mbg-naik-jadi-rp335-triliun-pada-2026,2026-02-02 20:23:09
republika,2025-08-15 20:37:27,"Belanja Negara Naik pada 2026, untuk MBG, Kopdes, Investasi, hingga Perdagangan Global","REPUBLIKA.CO.ID, JAKARTA -- Pemerintah menargetkan defisit anggaran pada Rancangan Anggaran Pendapatan dan Belanja Negara (RAPBN) 2026 sebesar 2,48 persen terhadap produk domestik bruto (PDB) seiring pendapatan negara yang ditargetkan tumbuh 9,8 persen dari outlook APBN 2025.

""RAPBN 2026 kalau kita lihat posturnya, pendapatan negara secara headline tumbuhnya 9,8 persen mencapai Rp3.147,7 triliun,"" kata Menteri Keuangan Sri Mulyani Indrawati dalam Konferensi Pers RAPBN dan Nota Keuangan 2026 di Jakarta, Jumat (1582025).

Pertumbuhan itu didorong oleh penerimaan pajak yang dibidik tumbuh 13,5 persen menjadi Rp2.357,7 triliun. Sedangkan, penerimaan kepabeanan dan cukai ditargetkan tumbuh 7,7 persen menjadi Rp33,43 triliun.

Dengan demikian, penerimaan perpajakan pada RAPBN 2026 ditetapkan sebesar Rp2.692 triliun atau tumbuh 12,8 persen. Sementara itu, penerimaan negara bukan pajak (PNBP) ditargetkan sebesar Rp455 triliun atau terkoreksi 4,7 persen dari outlook 2025.

""Karena PNBP sekarang permanen tidak lagi mendapatkan dividen,"" jelasnya.

Untuk belanja negara, ditargetkan sebesar Rp3.786,5 triliun atau tumbuh 7,3 persen dari outlook 2025.

Belanja pemerintah pusat (BPP) ditetapkan sebesar Rp3.136,5 triliun atau tumbuh 17,8 persen, yang terdiri dari belanja kementerianlembaga (KL) sebesar Rp1.498,3 triliun atau tumbuh 17,5 persen dan belanja non-KL Rp1.638,2 triliun atau tumbuh 18 persen.

Menurut Sri Mulyani, kenaikan itu disebabkan oleh belanja 8 program prioritas Presiden Prabowo Subianto, yaitu ketahanan pangan; ketahanan energi; makan bergizi gratis (MBG); pendidikan; kesehatan; pembangunan desa, koperasi, dan UMKM; pertahanan semesta; serta percepatan investasi dan perdagangan global.

""MBG saja naik Rp330 triliun. Jadi, memang kenaikan belanja untuk beberapa prioritas pemerintah cukup besar,"" ujarnya.

Berbeda dengan BPP, yang tumbuh, anggaran transfer ke daerah (TKD) turun sebesar 24,8 persen menjadi Rp650 triliun. Dalam paparannya, dijelaskan bahwa TKD mengalami perubahan yang dinamis menyelaraskan kebijakan fiskal nasional dan mendorong kemandirian fiskal daerah.

Dengan besaran pendapatan dan belanja negara, defisit RAPBN 2026 mencapai Rp636,8 triliun atau 2,48 persen PDB. Pembiayaan anggaran ditetapkan dengan nominal yang sama, yang akan dicapai dengan mengendalikan rasio utang dan mendorong efektivitas pembiayaan investasi.

Adapun keseimbangan primer diproyeksikan defisit 64,2 persen atau Rp39,4 triliun. Keseimbangan primer mencerminkan kemampuan negara mengelola utang.

Dengan surplus keseimbangan primer, maka kondisi fiskal dapat dikatakan masih cukup memadai untuk mengelola pendapatan, belanja, dan utang.

""Keseimbangan primer kami harapkan makin mendekati nol atau balance ,"" tambah Sri Mulyani.

Menkeu memastikan seluruh program prioritas sudah masuk dalam perhitungan RAPBN 2026, kecuali yang dilakukan oleh BPI Danantara secara terpisah.

""Oleh karena itu, kami akan terus menjaga agar APBN tetap bisa sehat,"" tuturnya.

Ikuti Whatsapp Channel Republika",Lida Puspaningtyas,https://republika.co.id/berita//t11f6f502/belanja-negara-naik-pada-2026-untuk-mbg-kopdes-investasi-hingga-perdagangan-global,2026-02-02 20:23:12
republika,2025-08-15 14:56:28,"Prabowo Pamer Ekonomi Tumbuh 5,12 Persen, Soroti Kinerja Investasi","REPUBLIKA.CO.ID, JAKARTA Presiden RI Prabowo Subianto memamerkan capaian pertumbuhan ekonomi nasional sebesar 5,12 persen pada kuartal II 2025. Di hadapan anggota DPR, MPR, dan DPD, Prabowo menegaskan bahwa ekonomi Indonesia tetap kuat di tengah ketidakpastian global.

""Perekonomian tumbuh di angka 5,12 persen. Para pakar yakin bahwa ekonomi kita akan semakin menguat di saat-saat yang akan datang,"" ujar Prabowo dalam pidato kenegaraannya di Sidang Tahunan MPR RI di Kompleks Parlemen, Senayan, Jakarta, Jumat (1582025).

Pertumbuhan ini diklaim menjadi bukti ketahanan ekonomi nasional di tengah ancaman geopolitik, perang tarif, dan perlambatan global. Berdasarkan data Badan Pusat Statistik (BPS), nilai produk domestik bruto (PDB) Indonesia pada kuartal II mencapai Rp 5.947 triliun secara tahunan ( year-on-year yoy).

Pemerintah mencatat realisasi investasi sebesar Rp 942 triliun selama semester I 2025. Angka ini tumbuh 13,6 persen dibandingkan periode yang sama tahun lalu, sekaligus telah memenuhi target dalam APBN 2025 meskipun tahun anggaran belum berakhir.

""Investasi mampu menyerap tenaga kerja sebanyak 1,2 juta orang,"" ucapnya.

Dalam paparan pidatonya, Prabowo juga menilai capaian tersebut merupakan hasil dari kerja keras BGN selama pelaksanaan program. Ia kemudian membandingkan capaian tersebut dengan program serupa di negara lain, seperti Brasil.

""Dalam tujuh bulan, kita berhasil apa yang negara-negara lain butuh belasan tahun. Saya telah jumpa dengan Presiden Brasil, dan mantan Presiden Brasil. Brasil butuh 11 tahun untuk mencapai 40 juta MBG tiap hari,"" ungkapnya.

Prabowo menuturkan, dengan capaian tersebut semestinya diakui bahwa bangsa Indonesia memiliki kemampuan mewujudkan cita-cita tersebut. Ia menekankan perlunya manajemen yang lebih baik ke depan.

""Begitu banyak masalah manajemen yang harus kita hadapi agar program ini berjalan baik. Pembangunan fisik kita bangun, pengelolaan rantai pasok, pelatihan manajer dan pelaksana,"" katanya.

Prabowo menambahkan, MBG bukan semata program sosial, melainkan pondasi untuk menciptakan generasi yang sehat, cerdas, dan produktif. ""PBB mengatakan bahwa MBG adalah investasi terbaik yang bisa dilakukan oleh sebuah bangsa,"" tegasnya.

Ikuti Whatsapp Channel Republika",Ahmad Fikri Noor,https://republika.co.id/berita//t10ze4490/prabowo-pamer-ekonomi-tumbuh-512-persen-soroti-kinerja-investasi,2026-02-02 20:23:14
