sumber,tanggal,judul,content,author,url,created_at
republika,2025-09-16 18:46:19,Kemenag Tarik Surat Kontroversi Orang Tua Soal Risiko Pelaksanaan MBG di MTs 2 Brebes,"REPUBLIKA.CO.ID, SEMARANG -- Plt Kepala Bidang (Kabid) Pendidikan Madrasah Kanwil Kementerian Agama (Kemenag) Provinsi Jawa Tengah, Wahid Arbani, mengaku sudah menarik surat pernyataan untuk orang tua murid siswa yang diterbitkan Madrasah Tsanawiyah (MTs) Negeri 2 Brebes terkait pelaksanaan program Makan Bergizi Gratis (MBG) di sekolah tersebut. Dalam surat itu orang tua murid diminta menerima MBG dengan berbagai potensi risiko, termasuk kontaminasi makanan dan keracunan.

""Setelah dilakukan koordinasi dengan semua pihak, baik pihak MTs Negeri 2 Brebes maupun Kemenag Kabupaten Brebes, surat edaran tersebut telah ditarik dan dicabut,"" kata Wahid ketika diwawancara di kantornya, Selasa (1692025).

Dia menambahkan, Senin (1592025) lalu, sudah dilaksanakan rapat koordinasi yang melibatkan Kepala Badan Gizi Nasional (BGN) Kabupaten Brebes, perwakilan MTs Negeri 2 Brebes, dan kepala Satuan Pelayanan Pemenuhan Gizi (SPPG) terkait. ""Hasil pertemuan tersebut didapatkan titik temu atau kejelasan dari program MBG bahwa pertanyaan yang tidak bisa dijawab dengan jelas oleh pihak pengelola MBG telah dijawab dengan jelas oleh Kepala Badan Gizi Kabupaten Brebes bahwa Badan Gizi Nasional juga tidak lepas tangan ketika ada KLB (Kejadian Luar Biasa) dan akan tetap bertanggung jawab,"" ucap Wahid.

""Beliau (Kepala BGN Brebes) pun memastikan keamanan pangan, efisiensi, dan kualitas gizi yang disajikan sesuai dengan SOP. Dalam hal ini bekerja sama dengan Dinas Kesehatan Kabupaten Brebes dalam pengadaan pangan,"" tambah Wahid.

Sebuah surat pernyataan untuk orang tua murid dari siswa MTs Negeri 2 Brebes viral di media sosial. Dalam surat tersebut, orang tua murid diminta menerima program MBG dengan segala risiko yang berpotensi terjadi, termasuk kontaminasi makanan dan keracunan.

Berdasarkan surat pernyataan terkait yang diperoleh Republika , terdapat enam risiko yang harus ditanggung orang tua murid Mts Negeri 2 Brebes, yakni:

1. Terjadinya gangguan pencernaan (misalnya: sakit perut, diare, mual)

2. Reaksi alergi terhadap bahan makanan tertentu yang mungkin tidak teridentifikasi sebelumnya

3. Kontaminasi ringan terhadap makanan akibat faktor lingkungan atau distribusi

4. Ketidakcocokan makanan dengan kondisi kesehatan pribadi anak

5. Keracunan makanan yang disebabkan oleh faktor di luar kendali pihak sekolahpanitia (misalnya proses pengiriman atau kelalaian pihak ketiga)

6. Bersedia membayar ganti rugi sebesar Rp. 80.000,- jika tempat makan rusak atau hilang.

Pada bagian bawah surat pernyataan, terdapat dua kolom dengan pilihan ""Menerima Makan Bergizi Gratis"" dan ""Menolak Makan Bergizi Gratis"". Ada pula ruang untuk materai 10.000. Surat tersebut dirilis September 2025.

Ikuti Whatsapp Channel Republika",Karta Raharja Ucu,https://republika.co.id/berita//t2ojd7282/kemenag-tarik-surat-kontroversi-orang-tua-soal-risiko-pelaksanaan-mbg-di-mts-2-brebes,2026-02-02 20:20:55
republika,2025-09-16 15:54:33,"Orang Tua Murid MTs 2 Brebes Diminta Terima MBG dengan Potensi Risiko, Termasuk Keracunan","REPUBLIKA.CO.ID, SEMARANG -- Sebuah surat pernyataan untuk orang tua murid dari siswa Madrasah Tsanawiyah (MTs) Negeri 2 Brebes, Jawa Tengah (Jateng), viral di media sosial. Dalam surat tersebut, orang tua murid diminta menerima program Makan Bergizi Gratis (MBG) dengan segala risiko yang berpotensi terjadi, termasuk kontaminasi makanan dan keracunan.

Berdasarkan surat pernyataan terkait yang diperoleh Republika , terdapat enam risiko yang harus ditanggung orang tua murid Mts Negeri 2 Brebes, yakni:

1. Terjadinya gangguan pencernaan (misalnya: sakit perut, diare, mual)

2. Reaksi alergi terhadap bahan makanan tertentu yang mungkin tidak teridentifikasi sebelumnya

3. Kontaminasi ringan terhadap makanan akibat faktor lingkungan atau distribusi

4. Ketidakcocokan makanan dengan kondisi kesehatan pribadi anak

5. Keracunan makanan yang disebabkan oleh faktor di luar kendali pihak sekolahpanitia (misalnya proses pengiriman atau kelalaian pihak ketiga)

6. Bersedia membayar ganti rugi sebesar Rp. 80.000,- jika tempat makan rusak atau hilang

Pada bagian bawah surat pernyataan, terdapat dua kolom dengan pilihan ""Menerima Makan Bergizi Gratis"" dan ""Menolak Makan Bergizi Gratis"". Ada pula ruang untuk materai 10.000. Surat tersebut dirilis September 2025.

Plt Kepala Bidang (Kabid) Pendidikan Madrasah Kanwil Kementerian Agama (Kemenag) Provinsi Jateng, Wahid Arbani, mengonfirmasi adanya penerbitan surat pernyataan untuk orang tua murid oleh Mts Negeri 2 Brebes terkait MBG. Dia mengungkapkan, setelah surat tersebut beredar luas di media sosial, pihaknya segera melakukan koordinasi dan menggali kronologis dari pihak sekolah. Sebab dia mengeklaim, penerbitan surat tersebut tak melalui koordinasi dengan Kanwil Kemenag Jateng.

Wahid menjelaskan, pada Kamis (1192025), asisten lapangan (aslap) dari Satuan Pelayanan Pemenuhan Gizi (SPPG) menggelar pertemuan dengan perwakilan MTs Negeri 2 Brebes untuk membahas nota kesepahaman (MoU) antara SPPG dan sekolah tersebut. Dalam pertemuan itu, perwakilan MTs Negeri 2 Brebes menanyakan beberapa hal, antara lain soal penanganan murid dengan alergi dan tindak lanjut jika terjadi keracunan.

Merespons pertanyaan tersebut, aslap dari SPPG terkait kemudian menyodorkan sebuah contoh surat edaran untuk orang tua murid jika mereka hendak menerima atau menolak MBG. Aslap SPPG kemudian menyarankan pihak sekolah menerbitkan surat semacam itu. MTs Negeri 2 Brebes menerima usulan itu.

Pada Jumat (1292025), MTs Negeri 2 Brebes menerbitkan surat edaran yang akhirnya viral di media sosial. Ketika ditanya mengapa MTs Negeri 2 Brebes menerima usulan aslap SPPG untuk menerbitkan surat pernyataan tersebut, Wahid Arbani menduga pihak sekolah hanya mengambil langkah antisipatif.

""Kalau dikonfirmasi ke kami apakah menginstruksikan penerbitan surat tersebut, kami jawab, tidak ada,"" ujar Wahid ketika diwawancara di kantornya, Selasa (1692025).

Dia menekankan, alur komunikasi dan koordinasi memang perlu ditingkatkan. ""Mungkin (penerbitan surat pernyataan) itu bentuk dinamika dan antisipasi dari madrasah sifatnya,"" ujarnya.

Wahid juga menegaskan Kemenag mendukung sepenuhnya program MBG. ""Pada intinya jajaran Kantor Wilayah Kementerian Agama mendukung sepenuhnya program MBG,"" ucapnya.

Ikuti Whatsapp Channel Republika",Karta Raharja Ucu,https://republika.co.id/berita//t2obex282/orang-tua-murid-mts-2-brebes-diminta-terima-mbg-dengan-potensi-risiko-termasuk-keracunan,2026-02-02 20:20:56
republika,2025-09-16 14:42:21, Kemenag Brebes Cabut Surat Pernyataan untuk Orang Tua Soal Terima MBG dengan Beragam Risikonya,"REPUBLIKA.CO.ID, SEMARANG -- Plt Kepala Bidang (Kabid) Pendidikan Madrasah Kanwil Kementerian Agama (Kemenag) Provinsi Jawa Tengah, Wahid Arbani, mengungkapkan, pihak Kemenag setempat telah menarik surat pernyataan untuk orang tua murid siswa yang diterbitkan Madrasah Tsanawiyah (MTs) Negeri 2 Brebes terkait pelaksanaan program Makan Bergizi Gratis (MBG) di sekolah tersebut. Dalam surat itu orang tua murid diminta menerima MBG dengan berbagai potensi risiko, termasuk kontaminasi makanan dan keracunan.

""Setelah dilakukan koordinasi dengan semua pihak, baik pihak MTs Negeri 2 Brebes maupun Kemenag Kabupaten Brebes, surat edaran tersebut telah ditarik dan dicabut,"" kata Wahid ketika diwawancara di kantornya, Selasa (1692025).

Dia menambahkan, pada Senin (1592025) lalu, sudah dilaksanakan rapat koordinasi yang melibatkan Kepala Badan Gizi Nasional (BGN) Kabupaten Brebes, perwakilan MTs Negeri 2 Brebes, dan kepala Satuan Pelayanan Pemenuhan Gizi (SPPG) terkait.

""Hasil pertemuan tersebut didapatkan titik temu atau kejelasan dari program MBG bahwa pertanyaan yang tidak bisa dijawab dengan jelas oleh pihak pengelola MBG telah dijawab dengan jelas oleh Kepala Badan Gizi Kabupaten Brebes bahwa Badan Gizi Nasional juga tidak lepas tangan ketika ada KLB (Kejadian Luar Biasa) dan akan tetap bertanggung jawab,"" ucap Wahid.

""Beliau (Kepala BGN Brebes) pun memastikan keamanan pangan, efisiensi, dan kualitas gizi yang disajikan sesuai dengan SOP. Dalam hal ini bekerja sama dengan Dinas Kesehatan Kabupaten Brebes dalam pengadaan pangan,"" tambah Wahid.

Sebuah surat pernyataan untuk orang tua murid dari siswa MTs Negeri 2 Brebes viral di media sosial. Dalam surat tersebut, orang tua murid diminta menerima program MBG dengan segala risiko yang berpotensi terjadi, termasuk kontaminasi makanan dan keracunan.

Berdasarkan surat pernyataan terkait yang diperoleh Republika , terdapat enam risiko yang harus ditanggung orang tua murid Mts Negeri 2 Brebes, yakni:

1. Terjadinya gangguan pencernaan (misalnya: sakit perut, diare, mual)

2. Reaksi alergi terhadap bahan makanan tertentu yang mungkin tidak teridentifikasi sebelumnya

3. Kontaminasi ringan terhadap makanan akibat faktor lingkungan atau distribusi

4. Ketidakcocokan makanan dengan kondisi kesehatan pribadi anak

5. Keracunan makanan yang disebabkan oleh faktor di luar kendali pihak sekolahpanitia (misalnya proses pengiriman atau kelalaian pihak ketiga)

6. Bersedia membayar ganti rugi sebesar Rp. 80.000,- jika tempat makan rusak atau hilang.

Ikuti Whatsapp Channel Republika",Teguh Firmansyah,https://republika.co.id/berita//t2o82l377/kemenag-brebes-cabut-surat-pernyataan-untuk-orang-tua-soal-terima-mbg-dengan-beragam-risikonya,2026-02-02 20:20:58
republika,2025-09-16 13:07:24,"Viral Orang Tua Murid MTs 2 Brebes Diminta Terima MBG dengan Potensi Risiko, Termasuk Keracunan","REPUBLIKA.CO.ID, SEMARANG -- Sebuah surat pernyataan untuk orang tua murid dari siswa Madrasah Tsanawiyah (MTs) Negeri 2 Brebes, Jawa Tengah (Jateng), viral di media sosial. Dalam surat tersebut, orang tua murid diminta menerima program Makan Bergizi Gratis (MBG) dengan segala risiko yang berpotensi terjadi, termasuk kontaminasi makanan dan keracunan.

Berdasarkan surat pernyataan terkait yang diperoleh Republika , terdapat enam risiko yang harus ditanggung orang tua murid Mts Negeri 2 Brebes, yakni:

1. Terjadinya gangguan pencernaan (misalnya: sakit perut, diare, mual)

2. Reaksi alergi terhadap bahan makanan tertentu yang mungkin tidak teridentifikasi sebelumnya

3. Kontaminasi ringan terhadap makanan akibat faktor lingkungan atau distribusi

4. Ketidakcocokan makanan dengan kondisi kesehatan pribadi anak

5. Keracunan makanan yang disebabkan oleh faktor di luar kendali pihak sekolahpanitia (misalnya proses pengiriman atau kelalaian pihak ketiga)

6. Bersedia membayar ganti rugi sebesar Rp. 80.000,- jika tempat makan rusak atau hilang

Distribusi makanan bergizi gratis (MBG) di salah satu sekolah di Jakarta. - (Mg159)

Distribusi makanan bergizi gratis (MBG) di salah satu sekolah di Jakarta. - (Mg159)

Pada bagian bawah surat pernyataan, terdapat dua kolom dengan pilihan ""Menerima Makan Bergizi Gratis"" dan ""Menolak Makan Bergizi Gratis"". Ada pula ruang untuk materai 10.000. Surat tersebut dirilis September 2025.

Plt Kepala Bidang (Kabid) Pendidikan Madrasah Kanwil Kementerian Agama (Kemenag) Provinsi Jateng, Wahid Arbani, mengonfirmasi adanya penerbitan surat pernyataan untuk orang tua murid oleh Mts Negeri 2 Brebes terkait MBG. Menurutnya, setelah surat tersebut beredar luas di media sosial, pihaknya segera melakukan koordinasi dan menggali kronologi dari pihak sekolah.

Wahid mengeklaim, penerbitan surat tersebut tak melalui koordinasi dengan Kanwil Kemenag Jateng. Kronologinya, pada Kamis (1192025), asisten lapangan (aslap) dari Satuan Pelayanan Pemenuhan Gizi (SPPG) menggelar pertemuan dengan perwakilan MTs Negeri 2 Brebes untuk membahas nota kesepahaman (MoU) antara SPPG dan sekolah tersebut.

Dalam pertemuan itu, perwakilan MTs Negeri 2 Brebes menanyakan beberapa hal, antara lain soal penanganan murid dengan alergi dan tindak lanjut jika terjadi keracunan. Merespons pertanyaan tersebut, aslap dari SPPG terkait kemudian menyodorkan sebuah contoh surat edaran untuk orang tua murid jika mereka hendak menerima atau menolak MBG.

Aslap SPPG kemudian menyarankan pihak sekolah menerbitkan surat semacam itu. MTs Negeri 2 Brebes menerima usulan itu.

Ikuti Whatsapp Channel Republika",Andri Saubani,https://republika.co.id/berita//t2o3oc409/viral-orang-tua-murid-mts-2-brebes-diminta-terima-mbg-dengan-potensi-risiko-termasuk-keracunan,2026-02-02 20:21:00
republika,2025-09-11 16:25:33,"Topang Program MBG, Pemkab Bandung Tabur Ribuan Benih Ikan","REPUBLIKA.CO.ID, BANDUNG - Pemerintah Kabupaten Bandung melalui Dinas Ketahanan Pangan dan Perikanan (Dispakan) mendukung program strategis nasional Presiden Prabowo Subianto, yaitu program Makan Bergizi Gratis (MBG) dan Koperasi DesaKelurahan Merah Putih (KDKMP).

Sebagai salah satu bentuk dukungan, Dispakan Kabupaten Bandung menebar sejumlah jenis ikan di Kolam Retensi Cieunteung Kelurahan Baleendah Kecamatan Baleendah Kabupaten Bandung, Kamis (1192025). Selain mendukung program strategis nasional, gerak cepat Dispakan Kabupaten Bandung ini selaras dengan program prioritas Bupati Bandung Dadang Supriatna.

Bupati Dadang Supriatna melalui Kepala Dispakan Kabupaten Bandung Uka Suska Puji Utama mengatakan, ikan yang ditebar mulai jenis ikan nilem ukuran 5-8 cm sebanyak 1.750 ekor, ikan tawes 3-5 cm sebanyak 1.750 ekor, ikan grasscarp ukuran 7-9 cm sebanyak 1.750 ekor. Ada pula ikan nila ukuran 5-8 cm sebanyak 2000 ekor dan ikan mas ukuran 5-8 cm sebanyak 2.000 ekor.

""Dengan demikian, penyebaran benih ikan memiliki peran penting dalam menjaga keseimbangan ekosistem perairan dan mendukung kegiatan ekonomi masyarakat,"" kata Uka Suska di sela-sela tebar benih ikan.

Uka Suska berharap dengan adanya tebar benih ikan ini, dapat mendukung optimalisasi operasional program MBG.

""Disaat panen ikan untuk kebutuhan program MBG, seperti ikan mas, lele, nila bisa dari kelompok masyarakat yang melaksanakan budidaya ikan tersebut. Maka secara otomatis dapat meningkatkan ekonomi masyarakat, khususnya dari kalangan pembudidaya ikan tersebut,"" kata dia.

Selain dengan program MBG, kata Uka Suska, pembudidaya ikan tersebut bisa disinergikan dengan Koperasi DesaKelurahan Merah Putih.

""Dengan harapan pemasaran ikan dari kelompok masyarakat pembudidaya ikan itu bisa dikerjasamakan dengan Koperasi DesaKelurahan Merah Putih,"" katanya.

Uka Suska mengatakan tujuan penyebaran benih ikan adalah untuk meningkatkan populasi ikan.

""Dengan menyebarkan benih ikan, populasi ikan dapat meningkat dan membantu menjaga keseimbangan ekosistem perairan,"" katanya.

Uka Suska mengatakan dengan mengembangkan industri perikanan, penyebaran benih ikan dapat membantu meningkatkan produksi ikan dan mendukung industri perikanan, baik untuk konsumsi lokal maupun ekspor.

""Menyebarkan ikan juga mengembalikan populasi ikan yang terancam: Penyebaran benih ikan dapat membantu mengembalikan populasi ikan yang terancam punah akibat overfishing , polusi, atau kerusakan habitat,"" kata dia.

Tujuan lainnya, kata Uka Suska untuk meningkatkan biodiversitas. Penyebaran benih ikan dapat membantu meningkatkan biodiversitas perairan dan menjaga keseimbangan ekosistem.

Selain itu untuk mendukung kegiatan rekreasi. Ia mengatakan, penyebaran benih ikan juga dapat mendukung kegiatan rekreasi seperti memancing, sehingga dapat meningkatkan pendapatan masyarakat sekitar.

Ikuti Whatsapp Channel Republika",Dwi Murdaningsih,https://republika.co.id/berita//t2f3il368/topang-program-mbg-pemkab-bandung-tabur-ribuan-benih-ikan,2026-02-02 20:21:02
republika,2025-09-11 16:11:22,Bappenas: Sertifikasi Halal untuk MBG Bagian Penguatan Sistem,"REPUBLIKA.CO.ID, JAKARTA -- Menteri Perencanaan Pembangunan Nasional (PPN)Kepala Badan Perencanaan Pembangunan Nasional (Bappenas) Rachmat Pambudy menyatakan sertifikasi halal untuk program Makan Bergizi Gratis (MBG) bagian dari penguatan sistem.

Pemerintah tidak hanya menjamin kualitas gizi, tetapi juga membangun kepercayaan masyarakat. Dengan sertifikasi halal, setiap proses penyediaan MBG dipastikan memenuhi standar halal dan tayyib, ujarnya dalam agenda penandatanganan Nota Kesepahaman tentang Sinergi Penyelenggaraan Jaminan Produk Halal dalam Program Pemenuhan Gizi Nasional antara Badan Penyelenggara Jaminan Produk Halal (BPJPH) dan Badan Gizi Nasional (BGN), dari keterangan resmi, di Jakarta, Rabu (1092025).

Dalam kesempatan tersebut, pemerintah memastikan program MBG tak hanya memenuhi kebutuhan gizi, tetapi juga menjamin pangan yang aman, sehat, halal, dan tayyib. Saat ini, tercatat 7.475 Satuan Pelayanan Pemenuhan Gizi (SPPG) yang menjadi bagian dari implementasi Program MBG.

Implementasi nota kesepahaman ini memastikan 7.475 dapur layanan memiliki penyelia halal tersertifikasi dan seluruh menu bersertifikat halal melalui mekanisme sertifikasi halal. Dengan begitu, layanan gizi yang diberikan bergizi, sehat, dan sesuai kebutuhan mayoritas masyarakat Indonesia.

Komitmen bersama ini dianggap menuntut integrasi dan kolaborasi seluruh kementerianlembaga agar standar halal diterapkan secara menyeluruh.

Presiden telah menetapkan Program MBG sebagai proyek strategis nasional nomor satu yang dikoordinasikan oleh Kementerian PPNBappenas. Hal ini menegaskan betapa pentingnya MBG dalam membangun sumber daya manusia unggul menuju Indonesia Emas 2045, ujar Rachmat Pambudy.

Kepala BGN Dadan Hindayana menyatakan bahwa pemenuhan gizi bukan hanya tentang ketersediaan makanan bergizi, tetapi harus memenuhi aspek kehalalan yang menjadi kebutuhan mayoritas masyarakat. Sinergi ini dinilai akan memperkuat kualitas gizi sekaligus memberi kepastian halal bagi layanan MBG.

Kepala BPJPH Ahmad Haikal Hasan turut menegaskan kerja sama antara pihaknya dengan BGN merupakan wujud amanat Undang-Undang (UU) Nomor 33 Tahun 2014 tentang Jaminan Produk Halal serta PP Nomor 42 Tahun 2024.

Selain melaksanakan amanat regulasi, nota kesepahaman ini bukti komitmen pemerintah menempatkan aspek halal sebagai prioritas. Hal ini penting karena MBG melibatkan rantai pasok panjang, dari hulu hingga penyajian. Sertifikasi halal memastikan mutu, gizi, dan keamanan pangan tetap terjaga, kata dia pula.

Ikuti Whatsapp Channel Republika",Lida Puspaningtyas,https://republika.co.id/berita//t2f2uy502/bappenas-sertifikasi-halal-untuk-mbg-bagian-penguatan-sistem,2026-02-02 20:21:03
republika,2025-09-11 11:19:01,Huruf China di Tutup Nampan MBG dan Reaksi Wali Kelas Soal Kehalalan Food Tray yang Diragukan,"REPUBLIKA.CO.ID, JAKARTA Adanya laporan food tray atau nampan Makan Bergizi Gratis (MBG) impor yang diduga tidak halal karena mengandung minyak babi masih terus didalami oleh Badan Pemeriksa Obat dan Makanan (BPOM). Sementara uji lab masih berjalan, program unggulan pemerintah itu pun terus bergulir.

Adanya laporan food tray atau nampan Makan Bergizi Gratis (MBG) impor yang diduga tidak halal karena mengandung minyak babi masih terus didalami oleh Badan Pemeriksa Obat dan Makanan (BPOM). Sementara uji lab masih berjalan, program unggulan pemerintah itu pun terus bergulir.

Berdasarkan pantauan Republika di SMP Negeri 265 Jakarta, Tebet, Jakarta Selatan, Rabu (1092025), masih banyak pelajar yang menikmati MBG. Meski belum mengetahui darimana food tray tersebut berasal, Republika menyaksikan ada kata bertuliskan huruf China pada setiap tutup nampan MBG yang didistribusikan ke sekolah tersebut.

Berdasarkan pantauan Republika di SMP Negeri 265 Jakarta, Tebet, Jakarta Selatan, Rabu (1092025), masih banyak pelajar yang menikmati MBG. Meski belum mengetahui darimana food tray tersebut berasal, Republika menyaksikan ada kata bertuliskan huruf China pada setiap tutup nampan MBG yang didistribusikan ke sekolah tersebut.

Sebelumnya, Ikatan Pelajar Nahdlatul Ulama (IPNU) menduga produk nampan makanan yang diimpor dari China untuk program MBG tidak halal. Sehubungan dengan itu, IPNU menunggu hasil uji laboratorium untuk memastikan kehalalan food tray impor.

Sebelumnya, Ikatan Pelajar Nahdlatul Ulama (IPNU) menduga produk nampan makanan yang diimpor dari China untuk program MBG tidak halal. Sehubungan dengan itu, IPNU menunggu hasil uji laboratorium untuk memastikan kehalalan food tray impor.

Ketua Umum Ikatan Pelajar Nahdlatul Ulama (IPNU), Muhammad Agil Nuruz Zaman mengatakan, yang jelas temuan khusus pada food tray untuk MBG perlu didalami dan diteliti lebih lanjut.""Kalau halal produknya (seperti food tray maka), bahan-bahannya (saat proses pembuatan food tray ) perlu kita teliti lebih dalam lagi,"" kata Agil kepada Republika di Kemenag, Jakarta, Senin (2582025).

Program MBG di salah satu sekolah di Jakarta - (Mg159)

Program MBG di salah satu sekolah di Jakarta - (Mg159)

Ikuti Whatsapp Channel Republika",A.Syalaby Ichsan,https://republika.co.id/berita//t2epbp483/huruf-china-di-tutup-nampan-mbg-dan-reaksi-wali-kelas-soal-kehalalan-food-tray-yang-diragukan,2026-02-02 20:21:05
republika,2025-09-11 10:23:36,Pelajar-Wali Murid Kaget Laporan Nampan MBG Diduga tak Halal: Kalau Terbukti Harus Diganti,"REPUBLIKA.CO.ID, JAKARTA Terkuaknya isu kehalalan food tray atau nampan Makan Bergizi Gratis (MBG) membuat sejumlah siswa khawatir jika laporan ketidakhalalan food tray tersebut benar adanya. Padahal, mereka sudah menggunakan nampan tersebut sejak program MBG dirilis pada Januari 2025.

Azqila Amelia, siswa kelas 6 SD Negeri Kebon Baru 09, Tebet, Jakarta Selatan mengaku baru mengetahui isu ini. Sebagai pelajar yang setiap hari mengonsumsi MBG, Qila merasa terkejut belum ada kejelasan mengenai kehalalan food tray. Kaget sih, karena nggak tahu, jelas Qila kepada Republika , Rabu (1092025).

Hal serupa juga dirasakan Nanda Kautsar Maulida. Siswa kelas sembilan sekaligus Ketua OSIS SMP Negeri 265 Jakarta, Tebet, Jakarta Selatan tersebut mengaku terkejut mendengar isu ini. Hanya saja, dia menilai program MBG sudah telanjur berjalan.

Kalau digeneral ya pasti shock lah. Tapi mungkin karena memang awalnya nggak tahu, ya udah , mau gimana lagi, kan ? ungkap Nanda kepada Republika , Rabu (1092025).

Selama isu ini mencuat, dia menceritakan, banyak siswa yang juga merasa was-was. Sebagai pelajar SMP, dia mengungkapkan, banyak temannya yang juga cukup kritis seputar kejelasan halal tidaknya food tray untuk MBG.Dia juga berharap agar dapat dikonfirmasi terlebih dahulu kejelasan halal atau tidaknya food tray.

Wali murid SDN 09 Kebon Baru Tebet, Neng Entin

Wali murid SDN 09 Kebon Baru Tebet, Neng Entin

Wali murid SDN 09 Kebon Baru Tebet, Neng Entin

Neng Etin, salah satu wali murid dari siswa SD Negeri Kebon Baru 09, Tebet, Jakarta Selatan mengaku khawatir akan isu kehalalan nampan MBG tersebut meski anaknya seringkali merasa senang mendapat makan gratis. Sebagai seorang Muslimah, dia merasa kehalalan suatu makanan dan wadahnya amat penting.

Ya, jujur sih sebetulnya saya agak khawatir juga ya. Kita kan karena kita Muslim ya. Kita kan agak ngeri juga gitu, ungkap Neng kepada Republika.

Ikuti Whatsapp Channel Republika",A.Syalaby Ichsan,https://republika.co.id/berita//t2emrc483/pelajar-wali-murid-kaget-laporan-nampan-mbg-diduga-tak-halal-kalau-terbukti-harus-diganti,2026-02-02 20:21:07
