sumber,tanggal,judul,content,author,url,created_at
republika,2025-06-26 15:08:51,"MBG Dibagikan Saat Libur Sekolah: Emak-Emak Repot, Minta Diganti Duit Saja","REPUBLIKA.CO.ID, JAKARTA -- Badan Gizi Nasional (BGN) tetap akan mendistribusikan makan bergizi gratis (MBG) pada musim libur sekolah. Namun, pendistribusian itu akan disesuaikan dengan keinginan sekolah dan orang tua siswa.

Republika mencoba menghimpun respons para orang tua terkait pembagian MBG pada momen libur sekolah. Tidak setiap orang tua menyambut baik MBG tetap dibagikan saat anaknya libur sekolah.

""Repot. Suruh ambil ke sekolah lagi,"" kata salah satu orang tua siswa di kawasan Depok, Jawa Barat, kepada Republika, Kamis (2662025).

Karena itu, ia lebih memilih pembagian MBG tidak dilakukan pada momen libur sekolah. Apalagi, anaknya tidak selalu suka menu MBG yang disediakan.

Menurut dia, pembagian MBG pada momen libur sekolah bakal mubazir jika dipaksakan. Mengingat, kecil kemungkinan orang tua siswa akan datang ke sekolah untuk mengambil makanan saat momen liburan.

""Aturan diganti duit aja ya, biar emaknya yang ngasih makanan bergizi. Walaupun makan sama tempe tahu juga udah ada gizinya,"" kata ibu dari siswa yang masih duduk di kelas 5 sekolah dasar itu.

Ia menambahkan, sekolah tempat anaknya belajar juga tidak memberikan informasi pembagian MBG pada momen liburan. Ia pun mengaku tidak masalah tidak mendapatkan MBG saat liburan.

Salah satu orang tua lainnya mengaku pembagian MBG di sekolah anaknya tetap berjalan saat momen liburan. Namun, menu yang dibagikan bukan bukan nasi dan lauk pauk seperti biasanya, melainkan makanan kemasan, susu, dan buah.

""Tetep jalan. Udah sepakat. Makanannya snack, roti, susu, buah,"" kata dia.

Menurut dia, selama momen liburan, MBG akan dibagikan dua kali dalam sepekan, yaitu setiap Senin dan Rabu. Pada hari itu, orang tua harus datang ke sekolah.

""Seminggu dua kali dibagi. Senin sama rabu. Orang tua dateng ke sekolah (buat ambil makanan),"" ujar orang tua yang anaknya masih duduk di bangku SD itu.

Ia mengaku senang karena MBG tetap dibagikan selama momen liburan. Pasalnya, itu cukup membantu orang tua untuk mengurangi uang jajan anak.

""Saya mah ikut aja, namanya juga gratis. Selama ini juga enak aja. Emang kadang ada yang gak doyan, namanya anak-anak, tapi sebagai yang nerima, senang aja,"" ujar dia.

Republika juga menghubungi sejumlah SPPG di Jakarta. Namun, hingga berita ini dibuat belum ada respons dari mereka terkait menu yang akan dibagikan saat libur sekolah.

Sebelumnya, Kepala BGN Dadan Hindayana mengatakan, pihaknya telah meminta seluruh kepala satuan pelayanan pemenuhan gizi (SPPG) untuk mendata sekolah yang tetap ingin mendapatkan MBG saat musim liburan. Menurut dia, pendistribusian MBG itu akan disesuaikan dengan kesediaan pihak sekolah mengumpulkan para siswa saat libur.

""Untuk anak sekolah, kepala SPPG diminta cek apakah anak sekolah bersedia datang ke sekolah atau tidak. Jika bersedia, berapa kali dalam seminggu,"" kata dia saat dikonfirmasi Republika, Selasa (2462025).

Ia mengatakan, para siswa yang datang ke sekolah saat momen libur itu akan mendapat makanan segar dan dibekali maksimal untuk dua hari. Menu yang dibagikan nantinya adalah makanan siap konsumsi, seperti telur, buah, susu, kacang, dan roti atau kue kering fortifikasi.

Namun, pendistribusian itu akan disesuaikan dengan kesediaan para siswa dan pihak sekolah. Apabila para siswa dan sekolah tidak bersedia datang saat momen libur, MBG tidak akan dibagikan.

""Jika anak sekolah tidak bersedia, maka MBG tidak dilaksanakan selama libur,"" ujar Dadan.

Sementara itu, program MBG untuk ibu hamil, ibu menyusui, dan anak balita, tetap akan berjalan normal. Pasalnya, para penerima manfaat itu tidak terganggu libur sekolah.

Berdasarkan data BGN per 22 Juni 2025, total SPPG yang telah beroperasi berjumlah 1.837 unit SPPG di hampir seluruh provinsi di Indonesia. Sementara itu, penerima manfaat yang telah dijangkau mencapai 5.208.339 orang, mulai dari balita, siswa dari PAUD hingga SMA, santri, peserta PKBM, ibu hamil, dan ibu menyusui, serta penerima manfaat dari seminari.

Ikuti Whatsapp Channel Republika",Andri Saubani,https://republika.co.id/berita//sygemr409/mbg-dibagikan-saat-libur-sekolah-emak-emak-repot-minta-diganti-duit-saja,2026-02-02 20:24:26
republika,2025-06-25 20:30:37,Mendes Yandri Minta Kades Melek Teknologi Genjot Ketahanan Pangan,"REPUBLIKA.CO.ID, JAKARTA -- Menteri Desa dan Pembangunan Daerah Tertinggal (Mendes PDT) Yandri Susanto mengajak kepala desa (kades) di Indonesia untuk lebih melek teknologi, sehingga bisa meningkatkan produksi hasil bumi sekaligus menyukseskan ketahanan pangan.

""Jika nantinya penerima manfaat sudah jutaan maka butuh bahan baku yang banyak, kata Mendes Yandri dalam pernyataan tertulis di Jakarta pada Rabu.

Temukan lebih banyak Konsultasi Hukum Siber Peralatan Fotografi Jurnalistik Berita Indonesia

Temukan lebih banyak Konsultasi Hukum Siber Peralatan Fotografi Jurnalistik Berita Indonesia

Temukan lebih banyak Konsultasi Hukum Siber Peralatan Fotografi Jurnalistik Berita Indonesia

Peralatan Fotografi Jurnalistik

Peralatan Fotografi Jurnalistik

Ia mengatakan, melek teknologi para kades tersebut nantinya berkaitan pula dengan program Makan Bergizi Gratis karena program tersebut tentu akan membutuhkan bahan baku yang banyak.

Lewat MBG ini, ia berharap desa-desa menjadi pelaku utama untuk menyediakan bahan baku, seperti cabai, sayur, dan telur.

Ada siklus ekonomi dari program ini. Olehnya, kita perlu mulai menata desa tematik yang nantinya jadi pemasok utama untuk 83 juta penerima manfaat, imbuhnya.

Apalagi, lanjut Mendes Yandri, ada Koperasi Desa Merah Putih yang merupakan ide besar Presiden Prabowo Subianto.

""Melalui Kopdes Merah Putih kita memotong tengkulak dan memastikan pelayanan kepada masyarakat desa semakin dekat,"" kata Mendes Yandri.

Ia juga menegaskan jika kades tidak perlu takut lagi untuk menggunakan Dana Desa karena ada program Jaksa Garda Desa.

Lewat Jaksa Garda Desa, Mendes Yandri mengajak kades, BPD, dan pendamping desa untuk berkolaborasi bersama Kejaksaan Agung dalam membangun desa.

Pada kesempatan yang sama, Jaksa Agung Muda Intelijen (Jamintel) Reda Manthovani mengatakan harapannya pada program pemberdayaan lahan yang melalui pola tanam tersebut bisa meningkatkan kesejahteraan masyarakat.

Reda berharap jaksa mengawal dan membimbing kepala desa saat mengelola Dana Desa agar berjalan sesuai dengan peruntukannya.

Saya harapkan kepada para jaksa untuk menindaklanjuti program kerja sama ini, kata Reda.

Sebagai informasi, keduanya melakukan penandatanganan Nota Kesepahaman Tentang Pemberdayaan Lahan dan Badan Usaha Milik Desa melalui Pola Tanam serta Program Jaksa Garda Desa.

Ikuti Whatsapp Channel Republika",Erdy Nasrul,https://republika.co.id/berita//syeyv1451/mendes-yandri-minta-kades-melek-teknologi-genjot-ketahanan-pangan,2026-02-02 20:24:28
republika,2025-06-24 19:25:09,"Menghadap Prabowo di Istana, Ketum PBNU Benarkan Bahas MBG","REPUBLIKA.CO.ID, JAKARTA -- Presiden Prabowo Subianto menerima Ketua Umum Pengurus Besar Nahdlatul Ulama (PBNU) KH Yahya Cholil Staquf alias Gus Yahya dalam sebuah pertemuan di Istana Merdeka, Jakarta Pusat pada Selasa (2462025). Pertemuan tersebut membahas penguatan sinergi antara PBNU dan pemerintah, termasuk pelaksanaan sejumlah program strategis nasional yang melibatkan partisipasi aktif organisasi masyarakat keagamaan.

Gus Yahya menyampaikan, pihaknya telah melaporkan perkembangan berbagai nota kesepahaman (MoU) yang selama ini telah dijalin antara PBNU dan kementerian maupun badan-badan pemerintah. ""MoU-MoU dengan berbagai kementerian dan badan pemerintah itu yang kami laporkan,"" ujarnya kepada awak media usai pertemuan.

Salah satu pembahasan adalah percepatan pelaksanaan program Makan Bergizi Gratis (MBG), yang merupakan salah satu program prioritas pemerintah di bidang pemenuhan gizi dan ketahanan pangan bagi masyarakat. Menurut Gus Yahya, PBNU telah mulai menjalankan program tersebut di sejumlah titik dan saat ini sedang dalam tahap akselerasi pengembangan.

""Soal MBG, kami sudah jalan di sejumlah titik dan sekarang sedang sangat progresif untuk akselerasi, untuk pengembangannya, mudah-mudahan bisa berjalan lebih lancar karena kami diberi target oleh BGN misalnya harus bisa mengelola seribu titik misalnya seperti itu. Ini pekerjaan besar sekali buat NU sehingga kami perlu koordinasi yang lebih intensif, kolaborasi yang lebih intensif,"" ungkap Gus Yahya.

Selain MBG, PBNU juga menyampaikan perkembangan pelaksanaan berbagai program sosial kemasyarakatan, seperti Gerakan Keluarga Maslahat NU yang melibatkan kerja sama lintas kementerian. Program-program tersebut diarahkan untuk meningkatkan kesejahteraan umat secara menyeluruh.

""Ada banyak hal yang lain yang juga merupakan kerja sama NU dengan pemerintah seperti untuk Gerakan Keluarga Maslahat NU yang kami mengerjakan sejumlah program dari berbagai macam kementerian tadi sudah kami laporkan dan Pak Presiden mendukung penuh,"" ucap Gus Yahya.

Ikuti Whatsapp Channel Republika",Erik Purnama Putra,https://republika.co.id/berita//syd15x484/menghadap-prabowo-di-istana-ketum-pbnu-benarkan-bahas-mbg,2026-02-02 20:24:30
republika,2025-06-24 17:11:47,HIPPI Soroti Sejumlah Catatan Perbaikan untuk Program MBG,"REPUBLIKA.CO.ID, JAKARTA Himpunan Pengusaha Pribumi Indonesia (HIPPI) Jakarta Selatan menyatakan dukungannya terhadap pelaksanaan Program Makan Bergizi Gratis (MBG) yang digagas Presiden Prabowo Subianto sebagai bagian dari upaya mencetak generasi Indonesia Emas 2045. Namun, HIPPI menilai sejumlah aspek teknis di lapangan perlu segera diperbaiki agar program ini tepat sasaran, berkelanjutan, dan optimal dalam memberi manfaat.

Dukungan kami bukan sekadar pada visinya, tetapi juga pada pelaksanaannya agar program MBG benar-benar bermanfaat bagi anak-anak Indonesia. Kami ingin memperkuat fondasi pelaksanaan, bukan sekadar mengkritisi, ujar Ketua Umum DPC HIPPI Jakarta Selatan, Azka Aufary Ramli, dikutip dari siaran pers, Selasa (2462025).

Salah satu sorotan utama HIPPI adalah soal rasa makanan yang kerap kurang sesuai dengan selera anak-anak di berbagai daerah, meskipun secara gizi sudah memenuhi standar. Banyak laporan dari daerah, makanan yang disajikan memang bergizi, namun sering tersisa karena rasanya kurang cocok. Ini tentu berdampak pada efektivitas penyerapan gizi dan berpotensi menimbulkan pemborosan anggaran, kata Azka.

HIPPI mendorong Badan Gizi Nasional (BGN) untuk menyusun pedoman rasa yang mempertimbangkan kekayaan kuliner lokal. Makanan sehat tidak harus hambar. Menu-menu tradisional seperti ikan kuah kuning Maluku, coto Makassar, atau sayur asem Jawa Barat bisa diolah agar anak-anak makan dengan lahap, ujar Azka.

Dari sisi teknis pengolahan, HIPPI menilai perlunya standarisasi metode memasak di dapur-dapur MBG. Menurut Kepala Badan Otonom FB HIPPI Jakarta Selatan, Regan Yapwito, perbedaan teknik masak bisa memengaruhi kandungan gizi dan cita rasa.

Tanpa standar yang jelas, bisa terjadi ketimpangan hasil antar dapur. Diperlukan pelatihan teknis, manual pengolahan yang terstandardisasi, namun tetap mengakomodasi kearifan lokal, ujar Regan.

Selain itu, HIPPI juga menggarisbawahi pentingnya penerapan standar keamanan pangan berbasis HACCP (Hazard Analysis Critical Control Point) dalam setiap tahapan produksi, pengemasan, hingga distribusi makanan. Memberi makan anak-anak Indonesia adalah tugas mulia, tapi memastikan keamanannya adalah tanggung jawab yang tak bisa dikompromikan, kata Azka.

HIPPI juga mengusulkan pemanfaatan teknologi modern, seperti dapur pintar berbasis IoT, mesin autoclave, dan retort, guna menjaga kualitas makanan, memperpanjang masa simpan, dan meningkatkan efisiensi, terutama di daerah terpencil. Tak hanya itu, HIPPI mendorong pemerintah memberikan insentif bagi UMKM dan pelaku usaha di sektor inovasi pangan lokal agar bisa turut berkontribusi dalam mendukung keberhasilan program MBG.

Program ini bukan sekadar soal anggaran. Keberhasilannya ditentukan oleh perencanaan menu, metode pengolahan, pelibatan pelaku lokal, dan adaptasi pada selera masyarakat. Makanan bergizi harus enak, agar anak-anak makan dengan senang hati, kata Azka.

Ikuti Whatsapp Channel Republika",Indira Rezkisari,https://republika.co.id/berita//sycuzn328/hippi-soroti-sejumlah-catatan-perbaikan-untuk-program-mbg,2026-02-02 20:24:31
republika,2025-06-24 17:43:09,"MBG Tetap akan Didistribusikan Saat Libur Sekolah, Begini Penjelasan BGN","REPUBLIKA.CO.ID, JAKARTA -- Badan Gizi Nasional (BGN) menyatakan akan tetap mendistribusikan makan bergizi gratis (MBG) selama musim liburan sekolah. Namun, pendistribusian MBG akan dilakukan sesuai permintaan dari sekolah.

Kepala BGN Dadan Hindayana mengatakan, pihaknya telah meminta seluruh kepala satuan pelayanan pemenuhan gizi (SPPG) untuk mendata sekolah yang tetap ingin mendapatkan MBG saat musim liburan. Menurut dia, pendistribusian MBG itu akan disesuaikan dengan kesediaan pihak sekolah mengumpulkan para siswa saat libur.

""Untuk anak sekolah, kepala SPPG diminta cek apakah anak sekolah bersedia datang ke sekolah atau tidak. Jika bersedia, berapa kali dalam seminggu,"" kata dia saat dikonfirmasi Republika , Selasa (2462025).

Ia mengatakan, para siswa yang datang ke sekolah saat momen libur itu akan mendapat makanan segar dan dibekali maksimal untuk dua hari. Menu yang dibagikan nantinya adalah makanan siap konsumsi, seperti telur, buah, susu, kacang, dan roti atau kue kering fortifikasi.

Namun, pendistribusian itu akan disesuaikan dengan kesediaan para siswa dan pihak sekolah. Apabila para siswa dan sekolah tidak bersedia datang saat momen libur, MBG tidak akan dibagikan.

""Jika anak sekolah tidak bersedia, maka MBG tidak dilaksanakan selama libur,"" ujar Dadan.

Sementara itu, program MBG untuk ibu hamil, ibu menyusui, dan anak balita, tetap akan berjalan normal. Pasalnya, para penerima manfaat itu tidak terganggu libur sekolah.

Berdasarkan data BGN per 22 Juni 2025, total SPPG yang telah beroperasi berjumlah 1.837 unit SPPG di hampir seluruh provinsi di Indonesia. Sementara itu, penerima manfaat yang telah dijangkau mencapai 5.208.339 orang, mulai dari balita, siswa dari PAUD hingga SMA, santri, peserta PKBM, ibu hamil, dan ibu menyusui, serta penerima manfaat dari seminari.

Ikuti Whatsapp Channel Republika",Andri Saubani,https://republika.co.id/berita//sycwfx409/mbg-tetap-akan-didistribusikan-saat-libur-sekolah-begini-penjelasan-bgn,2026-02-02 20:24:31
republika,2025-06-24 15:27:29,"Mulai Musim Libur Sekolah, Sejumlah SPPG Distribusikan Makanan Kemasan untuk MBG","REPUBLIKA.CO.ID, JAKARTA -- Sejumlah satuan pelayanan pemenuhan gizi (SPPG) mendistribusikan menu yang tidak biasa dalam program makan bergizi gratis (MBG) sejak beberapa pekan terakhir. Makanan yang dibagikan kepada siswa lantaran kegiatan belajar dan mengajar di sekolah sudah tidak lagi efektif setelah pelaksanaan ujian pada awal Juni.

Republika mencoba mendatangi satu SPPG di wilayah Jakarta Selatan untuk melihat langsung jenis makanan yang dibagikan pada Selasa (2462025) siang. Namun, aktivitas di SPPG itu tampak sepi. Sejumlah wadah berbahan stainless yang biasa digunakan untuk tempat MBG juga terlihat tertumpuk di wilayah itu.

Di tempat itu, terdapat sejumlah petugas yang sedang berbincang. Namun, petugas itu enggan menjawab ketika ditanya perihal menu MBG yang diberikan kepada para siswa beberapa waktu terakhir. "" Enggak tahu, saya cuma bantu-bantu,"" kata salah seorang petugas di SPPG itu, Selasa.

Selepas dari tempat itu, Republika mencoba mencari SPPG lain yang berdekatan. Di SPPG kedua, sejumlah petugas tampak sedang sibuk melakukan pekerjaannya. Salah seorang petugas di SPPG itu mengatakan, menu MBG yang dibagikan kepada para siswa di sekolah dalam beberapa hari ke belakang tidak berupa nasi dan lauk pauk.

Menurut dia, menu makanan yang dibagikan adalah makanan kemasan, buah, dan susu. Hal itu dilakukan lantaran saat ini kegiatan pembelajaran siswa di sekolah sudah selesai menjelang pembagian rapor. ""Karena sudah tidak ada pembelajaran, dikasihnya snack ,"" kata dia.

Menurut dia, pihak sekolah dan siswa cukup antusias diberikan menu MBG berupa makanan kemasan. Bahkan, ada sejumlah sekolah yang minta makanan kemasan dibagikan secara rutin sepekan sekali ketika kegiatan pembelajaran sudah normal. ""Mereka maunya gitu. Bosen katanya nasi terus,"" ujar dia.

Ketika ditanya untuk menu MBG yang akan dibagikan pada pekan depan saat siswa mulai libur sekolah, ia tidak bisa menjawabnya. Ia menilai, belum ada perintah lebih lanjut terkait pembagian MBG ketika sekolah sedang libur. ""Kalau siswa libur, ya enggak dibagi,"" kata dia.

Republika mencoba mewawancara pengurus SPPG di tempat tersebut. Namun, pengurus SPPG itu tidak berkenan dimintai keterangan.

Sebelumnya, sejumlah sekolah di Ciputat, Tangerang Selatan (Tangsel), dilaporkan mendapatkan menu MBG berupa beras yang belum dimasak sejak awal Juni. SPPG Yayasan Mualaf Indonesia Timur (Yasmit) Ciputat Timur yang mendistribusikan MBG di kawasan itu beralasan menu itu dibagikan karena aktivitas siswa di sekolah sudah tidak optimal, sehingga akan mubazir jika dibagikan menu matang.

Ikuti Whatsapp Channel Republika",Mas Alamil Huda,https://republika.co.id/berita//sycq5t487/mulai-musim-libur-sekolah-sejumlah-sppg-distribusikan-makanan-kemasan-untuk-mbg,2026-02-02 20:24:33
republika,2025-06-23 14:56:19,"Buntut Pemberian Bahan Mentah di Tangsel, BGN Pikirkan Pemberian MBG Saat Libur Sekolah ","REPUBLIKA.CO.ID, JAKARTA -- Belasan sekolah di wilayah Tangerang Selatan (Tangsel) mendapat bahan mentah dalam program makan bergizi gratis (MBG) sejak awal Juni 2025. Bahan mentah itu didistribusikan oleh Satuan Pelayanan Pemenuhan Gizi (SPPG) Yayasan Mualaf Indonesia Timur (Yasmit) Ciputat Timur dengan alasan kegiatan belajar mengajar di sekolah sudah tidak efektif sejak awal Juni.

Staf Khusus Kepala Badan Gizi Nasional (BGN) Bidang Komunikasi, Redy Hendra Gunawan, mengatakan pemberian bahan mentah, berupa beras yang belum dimasak, dalam program MBG di Tangsel itu merupakan inisiatif SPPG yang bersangkutan. Pasalnya, hingga saat ini BGN masih belum membuat kebijakan terkait pemberian bahan mentah dalam program MBG.

""BGN belum buat kebijakan terkait dengan pemberian bahan makanan mentah. Hal ini terjadi di Tangerang, itu murni inisiatif kepala SPPG,"" kata dia saat konferensi pers yang dikutip Republika dari akun YouTube BGN, Senin (2362025).

Ia menambahkan, BGN juga belum menentukan kebijakan dalam pemberian MBG pada masa libur sekolah. Pihaknya baru akan menggelar rapat pekan ini untuk menentukan kebijakan yang akan diterapkan dalam pemberian MBG pada libur sekolah.

""Jadi hari ini, para siswa penerima manfaat itu sudah menjalani libur sekolah. Nah, itu kemudian kami akan coba desainkan,"" kata Redy.

Ikuti Whatsapp Channel Republika",Mas Alamil Huda,https://republika.co.id/berita//syau1v487/buntut-pemberian-bahan-mentah-di-tangsel-bgn-pikirkan-pemberian-mbg-saat-libur-sekolah,2026-02-02 20:24:36
republika,,Judul tidak ditemukan,"Gus Yahya: PBNU tak Terkait Kasus Kuota Haji Sabtu , 31 Jan 2026, 11:27 WIB",,https://republika.co.id/berita//sy74co526/apakabar-mbg-anak-kebutuhan-khusus,2026-02-02 20:24:38
republika,2025-06-23 21:02:13,Polda Jatim Bongkar Sindikat Manipulasi Data Pribadi Berkedok Bantuan MBG,"REPUBLIKA.CO.ID, SURABAYA -- Direktorat Siber Polda Jawa Timur mengungkap sindikat manipulasi data pribadi berkedok bantuan makanan bergizi melalui platform digital demi meraup keuntungan. Kabid Humas Polda Jatim Komisaris Besar Polisi Jules Abraham Abast menjelaskan kasus ini terungkap dari laporan yang diterima polisi pada 28 April 2025.

""Kami menetapkan satu orang tersangka utama berinisial TD dan menyita ratusan barang bukti,"" kata dia di Surabaya, Senin (2362025).

TD bersama rekannya berinisial K menipu warga dengan iming-iming bantuan makanan gratis bagi pemilik Nomor Pokok Wajib Pajak (NPWP). Alih-alih diarahkan ke kantor pajak, warga hanya diminta menyerahkan KTP, kartu keluarga, dan swafoto.

Setelah mendapatkan data, pelaku membuat NPWP elektronik, mendaftarkan SIM card, serta membuka rekening e-wallet secara daring. ""Nah, data-data ini kemudian digunakan tersangka untuk mendaftarkan akun toko online dalam program Shopee Affiliate tanpa sepengetahuan pemilik data, katanya.

Sebanyak 130 akun Shopee dibuat dengan identitas palsu dan digunakan untuk live streaming produk di toko online Kailasop di Kecamatan Prambon, Kabupaten Nganjuk. Tersangka mempekerjakan tujuh admin dengan sistem shift untuk menyiarkan promosi produk demi meraup komisi Shopee Affiliate antara 5 25 persen. Semua keuntungan masuk ke rekening e-wallet milik TD.

Barang bukti yang disita meliputi 105 unit ponsel Oppo, 82 ponsel khusus live streaming , 129 akun Shopee, 100 rekening e-wallet SiBank, 129 NPWP elektronik palsu, dan 129 foto KTP milik orang lain. Tersangka dijerat Pasal 51 ayat 1 jo Pasal 35 ayat 1 Undang-Undang ITE dan Pasal 67 ayat 3 jo Pasal 65 ayat 3 Undang-Undang Pelindungan Data Pribadi, dengan ancaman 12 tahun penjara danatau denda Rp12 miliar.

""Kasus ini menjadi peringatan keras bagi masyarakat untuk tidak sembarangan menyerahkan data pribadi kepada pihak tak dikenal, sekalipun dibungkus dengan tawaran bantuan sosial, ujarnya.

Ikuti Whatsapp Channel Republika",Karta Raharja Ucu,https://republika.co.id/berita//sybazp282/polda-jatim-bongkar-sindikat-manipulasi-data-pribadi-berkedok-bantuan-mbg,2026-02-02 20:24:38
republika,2025-06-20 14:45:23,"BGN Atur Skema Pembagian MBG saat Libur Sekolah, Ini Mekanismenya","REPUBLIKA.CO.ID, JAKARTA Kepala Badan Gizi Nasional (BGN), Dadan Hindayana, memaparkan skema penyaluran Makan Bergizi Gratis (MBG) bagi siswa selama masa libur sekolah. Pembagian bantuan gizi tersebut akan disesuaikan dengan kesiapan dan kesediaan masing-masing sekolah untuk tetap menjalankan program di tengah liburan.

Saat dihubungi di Jakarta, Jumat (2162025), Dadan menjelaskan bahwa kepala Satuan Pelayanan Pemenuhan Gizi (SPPG) akan terlebih dahulu mengonfirmasi kepada kepala sekolah terkait kesiapan siswa dan guru untuk hadir ke sekolah saat libur.

Temukan lebih banyak Perlengkapan sekolah Kelontong Lulusan IT Berita pendidikan Berita Indonesia Berita online berlangganan Konsultasi Hukum Siber Berita TNI Akses Arsip Berita Republika Berita bisnis

Temukan lebih banyak Perlengkapan sekolah Kelontong Lulusan IT Berita pendidikan Berita Indonesia Berita online berlangganan Konsultasi Hukum Siber Berita TNI Akses Arsip Berita Republika Berita bisnis

Kepala SPPG akan memeriksa apakah siswa dan guru bersedia datang ke sekolah. Jika bersedia, akan ditentukan berapa kali dalam seminggu mereka hadir. Ketika datang, siswa akan menerima makanan segar, ujarnya.

Sebaliknya, apabila siswa dan guru tidak bersedia hadir, maka MBG tidak akan disalurkan ke sekolah tersebut selama masa libur. Dadan menegaskan bahwa keputusan akhir akan berada di tangan Kepala SPPG di masing-masing wilayah, sesuai hasil koordinasi dan survei di lapangan.

Jika tidak ada yang bersedia hadir, maka MBG untuk anak sekolah tidak dilaksanakan, tegasnya.

Guna memperkuat koordinasi dan menjamin pelaksanaan yang adaptif, BGN menyelenggarakan rapat koordinasi nasional bersama 1.816 SPPG pada Jumat siang untuk menyampaikan petunjuk teknis (juknis) pembagian MBG saat libur sekolah.

Dadan menjelaskan, survei ke peserta didik dilakukan untuk mengetahui seberapa besar kemungkinan mereka datang ke sekolah demi menerima MBG. Hal ini penting untuk menyusun kebijakan yang relevan dan responsif terhadap kondisi nyata di lapangan.

Jika siswa bisa hadir, mereka akan menerima makanan segar (fresh food) dan dibekali makanan yang tahan lebih lama seperti telur, buah, atau susu untuk satu hingga dua hari ke depan, ungkapnya.

Namun, jika mayoritas siswa tidak dapat hadir selama masa liburan, maka program MBG akan difokuskan ke kelompok rentan lain seperti ibu hamil, ibu menyusui, dan anak balita.

Ini agar manfaat gizi tetap tersalurkan secara optimal, katanya.

BGN menegaskan bahwa seluruh kebijakan terkait MBG dibuat berdasarkan prinsip pemerataan gizi, efektivitas penyaluran, dan keberlanjutan manfaat. Tidak ada kebijakan sepihak tanpa landasan dari otoritas resmi.

Kami pastikan semua proses kebijakan mengedepankan kehati-hatian, akuntabilitas, dan efektivitas. Kami juga akan terus menyosialisasikan perkembangan kebijakan kepada publik secara transparan, pungkas Dadan.

Ikuti Whatsapp Channel Republika",Friska Yolandha,https://republika.co.id/berita//sy59jn370/bgn-atur-skema-pembagian-mbg-saat-libur-sekolah-ini-mekanismenya,2026-02-02 20:24:41
