sumber,tanggal,judul,content,author,url,created_at
republika,2025-09-24 14:57:43,"Puskesmas Cipongkor Mencekam, Siswa Menangis Diduga Keracunan MBG, Ambulans Bolak-balik Antar Pasien","REPUBLIKA.CO.ID, BANDUNG BARAT -- Suasana mencekam dan menegangkan tergambar di sekitar Puskesmas dan Kantor Kecamatan Cipongkor, Kabupaten Bandung Barat (KBB), Jawa Barat pada Rabu (2492025) siang.

Korban dugaan keracunan massal usai mengkonsumsi menu Makan Menu Bergizi Gratis (MBG) terus berdatangan.

Berdasarkan pantauan Republika , hingga pukul 13.30 WIB, siswa berbagai jenjang berdatangan untuk mendapat perawatan dari petugas medis.

Semua ruangan yang berada di sekitar Puskesmas dan Kantor Kecamatan Cipongkor sudah dipenuhi pasien korban dugaan keracunan.

Sementara itu mobil ambulans terus hilir mudik untuk membawa korban ke rumah sakit terdekat. Bahkan, satu ambulans harus membawa 1-3 pasien karena korban yang membutuhkan penanganan lebih lanjut di rumah sakit terus bertambah.

Ikuti Whatsapp Channel Republika",Teguh Firmansyah,https://republika.co.id/berita//t33247377/puskesmas-cipongkor-mencekam-siswa-menangis-diduga-keracunan-mbg-ambulans-bolak-balik-antar-pasien,2026-02-02 20:18:57
republika,2025-09-24 15:12:04,"Kasus Keracunan MBG di Jakarta Tiga Kali, Begini Tanggapan Pramono","REPUBLIKA.CO.ID, JAKARTA -- Kasus dugaan keracunan akibat program Makan Bergizi Gratis (MBG) tidak hanya terjadi di sejumlah daerah. Kasus itu juga dilaporkan beberapa kali terjadi di Provinsi DKI Jakarta.

Berdasarkan data Badan Gizi Nasional (BGN), setidaknya sudah ada tiga kasus dugaan keracunan yang terjadi di Ibu Kota. Dari tiga kasus itu, terdapat puluhan siswa yang mengalami gejala keracunan.

Gubernur DKI Jakarta Pramono Anung Wibowo tidak banyak memberikan tanggapan ihwal sejumlah kasus keracunan akibat MBG. DIa hanya bisa mendoakan agar kasus keracunan tidak terjadi di Jakarta. ""Nah untuk (keracunan akibat) MBG ya saya berdoa di Jakarta tidak terjadi,"" katanya di Balai Kota DKI, Jakarta Pusat, Rabu (2492025).

Ketika ditegaskan kembali kasus keracunan akibat MBG telah terjadi di Jakarta, Pramono tetap tak memberikan jawaban tegas. Mantan sekjen DPP PDIP itu tetap hanya bisa berdoa agar hal itu tidak terjadi. ""Tegasnya adalah mendoakan, semoga tidak ada yang keracunan,"" kata Pramono.

Berdasarkan data BGN, kasus keracunan akibat MBG terjadi di Satuan Pelayanan Pemenuhan Gizi (SPPG) Pancoran Kalibata, Jakarta Selatan pada 29 Agustus 2025. Akibat kejadian itu, terdapat tiga orang yang terdampak dan mengalami gejala ringan. Dari hasil uji laboratorium, MBG yang diberikan positif mengandung mikrobiologi.

Tak hanya itu, kasus dugaan keracunan juga kembali di SPPG Khusus Koja, Jakarta Utara, pada 8 September 2025. Akibatnya, terdapat 14 orang yang terdampak. Namun, hingga kini belum ada hasil uji laboratorium dari sampel makanan tersebut.

Terakhir, sebanyak tujuh orang siswa di SMAN 15 Jakarta dilaporkan mengalami gejala mual usai menyantap MBG pada Selasa (2392025). Tiga orang di antaranya sempat dilarikan ke rumah sakit untuk mendapatkan perawatan.

Ikuti Whatsapp Channel Republika",Erik Purnama Putra,https://republika.co.id/berita//t332s4484/kasus-keracunan-mbg-di-jakarta-tiga-kali-begini-tanggapan-pramono,2026-02-02 20:18:58
republika,2025-09-24 14:12:52,"Kasus Keracunan Terus Terjadi, Federasi Guru Usulkan Program MBG Dimoratorium","REPUBLIKA.CO.ID, JAKARTA -- Federasi Serikat Guru Indonesia (FSGI) meminta pemerintah melakukan moratorium atau penghentian sementara terhadap program Makan Bergizi Gratis (MBG). Mengingat, adanya siswa keracunan akibat program makanan gratis yang dibagikan ke sekolah itu masih terus terjadi.

Sekretaris Jenderal (Sekjen) FSGI Fahriza Marta Tanjung mengatakan, hingga saat ini sudah ada hampir 6.000 siswa yang mengalami gejala keracunan akibat menyantap MBG. Terbaru, kasus keracunan menonjol terjadi di wilayah Cipongkor, Kabupaten Bandung Barat, Jawa Barat, yang menyebabkan 364 siswa terdampak.

MBG harus segera dievaluasi total pemerintah dan selama proses evaluasi program MBG harus dimoratorium dahulu,"" kata dia melalui keterangannya kepada Republika , Rabu (2492025).

Menurut dia, kasus keracunan itu bakal terus terjadi apabila Badan Gizi Nasional (BGN) tidak melakukan evaluasi. Bahkan, kasus keracunan di tempat lain dinilai hanya tinggal menunggu waktu apabila evaluasi total tak dilakukan.

""Ini soal menunggu giliran keracunan saja setiap daerah karena memang program MBG ini lemah perencanaan dan pengawasannya , ujar Fahriza.

MBG dan Keracunan - (Republika)

MBG dan Keracunan - (Republika)

Ikuti Whatsapp Channel Republika",Mas Alamil Huda,https://republika.co.id/berita//t3301g487/kasus-keracunan-terus-terjadi-federasi-guru-usulkan-program-mbg-dimoratorium,2026-02-02 20:18:58
republika,2025-09-24 14:43:13,Banggar DPR Usulkan Tiga Skema Alternatif Program MBG,"REPUBLIKA.CO.ID, JAKARTA Ketua Badan Anggaran (Banggar) DPR RI Said Abdullah mengusulkan tiga skema alternatif pelaksanaan Program Makan Bergizi Gratis (MBG) menyusul maraknya kasus keracunan anak akibat menu program tersebut. Said menyampaikan, skema pertama yakni penyaluran anggaran MBG melalui Dana Alokasi Khusus (DAK) yang langsung disalurkan ke pemerintah daerah.

Skema kedua, lanjutnya, dapat dilakukan dengan menyalurkan bantuan MBG melalui Program Keluarga Harapan (PKH). Kalau PKH selama ini per bulan Rp300 ribu, kita tambahin Rp300 ribu. Tapi yang Rp300 ribu itu untuk MBG, ujarnya di Gedung DPR RI, Jakarta, Selasa (2392025).

Adapun skema ketiga, lokasi Satuan Pelayanan Pemenuhan Gizi (SPPG) didekatkan ke sekolah agar pengawasan lebih optimal.

Berdasarkan data Jaringan Pemantau Pendidikan Indonesia (JPPI), hingga pertengahan September 2025 tercatat 5.360 anak mengalami keracunan akibat program MBG.

Menanggapi kondisi itu, Said menilai pemerintah perlu segera melakukan evaluasi. Harus segera dilakukan deteksi oleh pemerintah di titik mana saja dan apa penyebabnya. Apakah karena rantai pasok dari SPPG ke sekolah terlalu panjang? Karena satu SPPG melayani 3.000 anak, apakah itu bisa diperpendek? katanya.

Meski demikian, ia menegaskan program MBG tidak perlu dihentikan. Lebih baik mari kita deteksi dulu letak masalahnya. Apakah karena jam 2 malam baru masak, sedangkan jam 12 siang sudah harus disajikan, berarti 14 jam sendiri. Sehingga perlu pola baru, atau skema diubah, setiap sekolah ada satu SPPG. Itu akan lebih menarik dan lebih mudah diawasi, ujarnya.

Sebelumnya, Menteri Keuangan (Menkeu) Purbaya Yudhi Sadewa membuka opsi pengalihan anggaran MBG apabila realisasi penyerapan masih rendah hingga akhir Oktober 2025.

Kalau di akhir Oktober kita bisa hitung dan kita antisipasi penyerapannya hanya sekian, ya kita ambil juga uangnya. Kita sebar ke tempat lain, atau untuk mengurangi defisit, atau untuk mengurangi utang. Jadi pada dasarnya enggak ada uang nganggur di kementerian yang di- earmark sampai akhir tahun, kata Purbaya.

Menurutnya, meski Presiden mendukung penuh pelaksanaan MBG, kondisi di lapangan tetap menentukan tingkat serapan anggaran. Karena itu, Kemenkeu akan membantu mempercepat penyerapan dengan memperkuat manajemen dan pengawasan.

MBG treatment -nya sama, kalau memang kita bisa lihat dan kita coba bantu termasuk mengirim manajemen dan segala macam, ujarnya.

Ikuti Whatsapp Channel Republika",Ahmad Fikri Noor,https://republika.co.id/berita//t331g1490/banggar-dpr-usulkan-tiga-skema-alternatif-program-mbg,2026-02-02 20:18:59
republika,2025-09-24 15:09:08,"Suasana Mencekam Keracunan MBG di KBB, Siswa Menangis Ambulans Bolak-balik Antar Pasien ke RS","REPUBLIKA.CO.ID, BANDUNG BARAT -- Suasana mencekam dan menegangkan tergambar di sekitar Puskesmas dan Kantor Kecamatan Cipongkor, Kabupaten Bandung Barat (KBB), Jawa Barat pada Rabu (2492025) siang. Korban dugaan keracunan massal usai mengkonsumsi menu Makan Menu Bergizi Gratis (MBG) terus berdatangan.

Berdasarkan pantauan Republika, hingga pukul 13.30 WIB, siswa berbagai jenjang berdatangan untuk mendapat perawatan dari petugas medis. Semua ruangan yang berada di sekitar Puskesmas dan Kantor Kecamatan Cipongkor sudah dipenuhi pasien korban dugaan keracunan.

Sementara itu mobil ambulans terus hilir mudik untuk membawa korban ke rumah sakit terdekat. Bahkan, satu ambulans harus membawa 1-3 pasien karena korban yang membutuhkan penanganan lebih lanjut di rumah sakit terus bertambah.

""Sampai saat ini mungkin sudah sekitar 220 yang datang. Jumlahnya terus bertambah,"" ujar Kepala Puskesmas Cipongkor, Yuyun Sarihotimah saat dikonfirmasi.

Yuyun mengatakan, semua ruangan yang ada di sekitar Puskesmas dan Kecamatan Cipongkor sudah penuh karena korban terus berdatangan. Pihaknya mengajukan tenda darurat untuk menampung para korban. ""Kami membutuhkan infus, oksigen, obat-obatan segera. Ini kondisinya cukup chaos karena datangnya hampir bersamaan. Petugas medis juga cukup kewalahan,"" katanya.

Ikuti Whatsapp Channel Republika",Arie Lukihardianti,https://republika.co.id/berita//t332n8512/suasana-mencekam-keracunan-mbg-di-kbb-siswa-menangis-ambulans-bolak-balik-antar-pasien-ke-rs,2026-02-02 20:19:00
republika,2025-09-24 13:11:10,"Keracunan Siswa Usai Makan MBG di Bandung Barat Meluas ke Dapur SPPG Lain, Korban Terus Bertambah","REPUBLIKA.CO.ID, BANDUNG BARAT -- Kasus keracunan usai mengkonsumsi menu Makan Bergizi Gratis (MBG) di wilayah Cipongkor, Kabupaten Bandung Barat (KBB), Jawa Barat meluas. Kali ini dialami siswa SMK Karya Perjuangan Cipongkor.

Para siswa mendadak mengalami gejala keracunan seperti mengeluhkan mual, sakit perut, muntah-muntah, hingga pusing, usai mengkonsumsi paket program MBG, pada Rabu (2492025) siang. Hingga pukul 12.15 WIB, ada sekitar 4 orang korban keracunan ditangani Puskemas Cipongkor.

""Betul sudah ada laporan muncul kasus keracunan imbas MBG lagi. Mereka adalah siswa SMK Karya Perjuangan. Kami baru tangani 4 orang,"" ujar Kepala Puskesmas Cipongkor, Yuyun Sarihotimah saat dikonfirmasi.

Menurutnya, jika kasus keracunan pertama berasal paket makanan produksi Satuan Pelayanan Pemenuhan Gizi (SPPG) Yayasan Rajib Putra Barokah dengan nama Dapur Makmur Jaya di Kampung Cipari, Desa Cijambu, Cipongkor. Kali ini justru dari dapur SPPG di Kampung Pasirsaji, Desa Sarinagen, Cipongkor. ""Untuk kasus baru ini berasal dari dapur berbeda. Karena dapur MBG ini masih beroperasi,"" kata dia.

Yuyun menjelaskan korban keracunan masih terus berdatangan. Pihaknya melakukan penanganan para korban di posko kesehatan di GOR Kecamatan Cipongkor dan IGD Poned Puskesmas. ""Kami telah mendirikan beberapa posko pelayanan untuk menampung dan menangani para korban. Korban masih terus berdatangan,"" katanya.

Ikuti Whatsapp Channel Republika",Arie Lukihardianti,https://republika.co.id/berita//t32x6m512/keracunan-siswa-usai-makan-mbg-di-bandung-barat-meluas-ke-dapur-sppg-lain-korban-terus-bertambah,2026-02-02 20:19:05
republika,2025-09-24 12:34:16,"Curhat Murid di Depok Soal Makanan MBG, Porsi Kurang Konsisten, Rasa Hambar Seperti di RS","REPUBLIKA.CO.ID, JAKARTA -- Pemerintah terus melakukan evaluasi terhadap pelaksanaan Makan Bergizi Gratis yang digelar secara nasional. Evaluasi itu termasuk soal menu dan higienitas panganan menyusul terjadinya sejumlah kasus keracunan massal di daerah.

Terkait menu, sejumlah murid menilai porsinya cukup, tapi kurang konsisten. Kemudian soal rasa terasa lebih hambar. Hal itu disampaikan oleh Bila, salah satu siswa Mts di Depok.

Temukan lebih banyak Berita nasional Berita pendidikan Pakaian Muslimah Modern Tiket Seminar Ekonomi Halal Peralatan Fotografi Jurnalistik Akses Arsip Berita Republika Layanan Berlangganan Berita Premium Analisis berita Al-Quran digital Pelatihan Penulisan Kolom Opini

Temukan lebih banyak Berita nasional Berita pendidikan Pakaian Muslimah Modern Tiket Seminar Ekonomi Halal Peralatan Fotografi Jurnalistik Akses Arsip Berita Republika Layanan Berlangganan Berita Premium Analisis berita Al-Quran digital Pelatihan Penulisan Kolom Opini

Peralatan Fotografi Jurnalistik

Peralatan Fotografi Jurnalistik

Layanan Berlangganan Berita Premium

Layanan Berlangganan Berita Premium

Pelatihan Penulisan Kolom Opini

Pelatihan Penulisan Kolom Opini

Murid dari kelas tujuh menilai rasa makanan MBG cenderung hambar dan porsi yang diberikan tidak konsisten.

Enak-enak aja sih, tapi porsinya kadang-kadang banyak, kadang-kadang dikit, terus rasanya hambar kaya makanan rumah sakit, ujarnya kepada Republika pada Selasa (2392025).

""Pengennya sih makanannya lebih berasa lagi rasanya gak kaya makanan rumah sakit, terus juga enaknya kalo masih anget. Dan kalo bisa porsinya bisa lebih banyak,"", ujar harapan Bila terhadap program MBG.

Ia juga menambahkan bahwa harapannya bisa diberi susu karena tidak selalu ada susu di dalam menunya.

Sementara itu Nisa, salah satu orang tua mengaku tetap membawakan bekal tambahan untuk anaknya karena khawatir makanan yang disediakan kurang layak konsumsi.

Iya tetap bawain bekel soalnya takut makanannya basi atau bau. Daripada nggak makan, mending bawain bekel, ujarnya.

Ikuti Whatsapp Channel Republika",Teguh Firmansyah,https://republika.co.id/berita//t32vh4377/curhat-murid-di-depok-soal-makanan-mbg-porsi-kurang-konsisten-rasa-hambar-seperti-di-rs,2026-02-02 20:19:06
republika,2025-09-24 11:56:05,"Jumlah Korban Keracunan Usai Santap MBG di Bandung Barat Bertambah Jadi 411, Ini Gejalanya","REPUBLIKA.CO.ID, BANDUNG BARAT -- Jumlah korban keracunan massal usai mengkonsumsi menu Makan Bergizi Gratis (MBG) di wilayah Cipongkor, Kabupaten Bandung Barat (KBB), Jawa Barat masih terus bertambah. Hingga Rabu (2492025) pagi, tercatat sudah ada 411 siswa yang tumbang.

Kepala Puskesmas Cipongkor, Yuyun Sarihotimah, menjelaskan korban keracunan masih terus berdatangan ke posko kesehatan di GOR Kecamatan Cipongkor meski jumlahnya tak sebanyak hari pertama.

""Kami telah mendirikan beberapa posko pelayanan untuk menampung dan menangani para korban. Korban masih terus berdatangan meski tak sebanyak kemarin. Sampai saat ini belum ada laporan kematian,"" ujar Yuyun saat dikonfirmasi.

Adapun ratusan korban ditangani di sejumlah Posko Kesehatan di antaranya Posko Puskesmas Cipongkor sebanyak 93 orang, semua telah dinyatakan sembuh dan telah dipulangkan. RSUD Cililin sebanyak 35 orang, terdiri dari 16 pasien masi menjalani rawat inap dan 19 pasien rawat jalan yang sudah pulang. Posko GOR Kecamatan sebanyak 255 orang, dengan 15 pasien masih dalam perawatan dan 240 pasien berobat jalan.

Kemudian di RSIA Anugrah sebanyak 22 orang, terdiri dari 10 pasien masih menjalani rawat inap dan 12 pasien rawat jalan yang telah pulang. Terakhir di Klinik Permata Hati sebanyak 6 orang, semuanya masih menjalani rawat inap.

Ikuti Whatsapp Channel Republika",Arie Lukihardianti,https://republika.co.id/berita//t32tph512/jumlah-korban-keracunan-usai-santap-mbg-di-bandung-barat-bertambah-jadi-411-ini-gejalanya,2026-02-02 20:19:07
republika,2025-09-24 07:17:16,FSGI Usul Anggaran MBG tak Terserap Dialihkan untuk Pendidikan,"REPUBLIKA.CO.ID, JAKARTA -- Federasi Serikat Guru Indonesia (FSGI) mencatat kasus Makan Bergizi Gratis (MBG) bermasalah terjadi di 14 provinsi dengan beragam persoalan. FSGI mendorong dana program MBG dialihkan untuk program pendidikan.

FSGI mengamati besarnya anggaran MBG yang dikelola Badan Gizi Nasional (BGN) ternyata belum terserap optimal. FSGI menemukan sampai dengan September 2025 anggaran MBG yang terserap baru Rp15,7 triliun dari pagu anggaran yang mencapai Rp 71 triliun atau sekitar 22 persen.

""Bahkan anggaran Rp 6 triliun untuk membangun 1.542 SPPG belum terserap sama sekali,"" kata Ketua Umum FSGI Fahmi Hatib kepada Republika, Selasa (2392025).

Menkeu Yudhi Purbaya Sadewa mengancam akan mengambil alih anggaran yang tidak terserap tersebut. Jika sampai dengan Oktober 2025 hitungan penyerapan anggaran MBG masih rendah maka akan dialihkan dan disebarkan ke tempat lain atau untuk membayar hutang dan mengurangi defisit APBN.

""Sehubungan dengan pernyataan Menkeu tersebut, FSGI mendorong agar anggaran MBG yang tidak terserap tersebut dialihkan ke pendidikan,"" ujar Fahmi.

FSGI mencontohkan pengalihan itu bisa untuk peningkatan kualitas guru melalui berbagai pelatihan. Pada tahun 2025 ini, pelatihan Pembelajaran Mendalam untuk Kepala Sekolah Sasaran dan Guru Sasaran sepenuhnya ditanggung oleh sekolah masing-masing baik melalui BOS Kinerja maupun BOS Reguler dengan jumlah siswa lebih dari 400.

""Bagi sekolah tertentu, anggaran sebesar 2 juta 4 juta per orang dirasa memberatkan,"" ujar Fahmi.

Selain itu, FSGI menyebut pada tahun ini, biaya-biaya koordinasi kegiatan antara Kementerian dengan sekolah tidak dibiayai sepenuhnya oleh Kementerian lagi. Sekolah diminta untuk melakukan sharing pembiayaan. Padahal FSGI menyinggung tidak mudah bagi sekolah untuk mengeluarkan pembiayaan tertentu melalui BOS yang RKAS-nya sudah disiapkan jauh-jauh hari.

""Apalagi kegiatan koordinasi dengan Kementerian tidak berkaitan langsung dengan proses belajar mengajar di kelas maka rawan disalahgunakan,"" ujar Fahmi.

FSGI juga mendorong anggaran MBG yang tidak terserap tahun 2025 dapat dialihkan untuk anggaran pendidikan khususnya untuk guru. Anggaran yang dialihkan ini dapat meningkatkan kualitas dan kesejahteraan guru khususnya tunjangan bagi guru honorer dan tunjangan profesi guru bagi guru-guru yang sudah memperoleh sertifikat pendidik.

""Anggaran ini juga bisa digunakan untuk meningkatkan kompetensi guru melalui pelatihan-pelatihan. Tidak hanya untuk pelatihan pembelajaran mendalam tetapi juga untuk pelatihan-pelatihan bagi guru mata pelajaran yang jumlahnya,"" ujar Fahmi.

Ikuti Whatsapp Channel Republika",Andri Saubani,https://republika.co.id/berita//t32gss409/fsgi-usul-anggaran-mbg-tak-terserap-dialihkan-untuk-pendidikan,2026-02-02 20:19:07
