article_id,judul,waktu_terbit,editor,konten,url,panjang_konten,author,thumbnail,kategori,created_at,search_page,search_date
748ce7e1c18235c4,Guru Besar UMJ: Libur Sekolah tak Boleh Jadi Alasan Terhentinya MBG,2025-12-24 14:53:00,Fernan Rahadi,"REPUBLIKA.CO.ID, JAKARTA -- Guru Besar Bidang Ilmu Politik dan Humaniora Universitas Muhammadiyah Jakarta (UMJ), Prof Sri Yunanto menegaskan bahwa libur sekolah tidak boleh menjadi alasan terhentinya Program Makan Bergizi Gratis (MBG). Menurutnya, pemenuhan gizi merupakan kebutuhan dasar yang harus tetap berjalan dalam kondisi apa pun, termasuk saat peserta didik tidak menjalani aktivitas belajar mengajar.

Sri Yunanto mengatakan, MBG tidak dapat dipahami semata sebagai program pendukung kegiatan sekolah, melainkan sebagai bagian dari tanggung jawab negara dalam menjamin kesehatan dan kualitas sumber daya manusia (SDM) sejak dini.

Libur sekolah itu urusan kalender pendidikan. Tapi kebutuhan gizi anak tidak pernah libur. Dalam kondisi apa pun, makan adalah kebutuhan dasar. Jadi tidak tepat kalau MBG ikut diliburkan, kata Prof. Sri Yunanto di Jakarta, Rabu (24122025).

Menurut Sri Yunanto, pemenuhan gizi sejatinya tidak hanya dibutuhkan oleh anak sekolah. Ibu hamil, balita, hingga lansia juga merupakan kelompok yang sangat membutuhkan intervensi gizi.

Stunting harus dicegah sejak dalam kandungan. Bantuan tunai tidak selalu efektif karena belum tentu digunakan untuk pemenuhan gizi. Intervensi langsung melalui makanan bergizi jauh lebih tepat, katanya.

Terkait muncul tudingan bahwa program MBG saat libur sekolah upaya menghabiskan anggaran, Prof Sri Yunanto menilai pandangan semacam ini menunjukkan masih sempitnya cara memaknai intervensi gizi sebagai kebijakan jangka panjang.

Menurutnya, bagi ibu menyusui dan balita, libur sekolah tidak pernah berarti libur kebutuhan. Gizi tetap harus terpenuhi setiap hari. Ibu menyusui membutuhkan asupan nutrisi yang cukup agar kualitas dan kuantitas ASI terjaga. Balita membutuhkan makanan bergizi seimbang untuk mendukung pertumbuhan fisik, perkembangan otak, serta pembentukan sistem imun.

Kekosongan intervensi pada fase ini bukan hanya berdampak sesaat, tetapi bisa menimbulkan konsekuensi jangka panjang berupa stunting, gangguan kognitif, hingga kerentanan penyakit, terangnya.

Ia menambahkan, kebutuhan nutrisi tidak mengenal waktu libur. Meski sekolah libur, kebutuhan makan tetap ada dan bersifat rutin.

Dalam kondisi apa pun, makanan adalah kebutuhan dasar. Seperti saat pandemi Covid-19, kebutuhan pangan tidak bisa berhenti. Jadi libur sekolah bukan berarti MBG ikut libur, tegasnya.

Dalam konteks inilah kebijakan MBG saat libur sekolah menemukan relevansinya. Negara hadir bukan untuk memaksa anak-anak kembali ke sekolah, melainkan memastikan bahwa kelompok paling rentan tetap terlindungi.

Lebih lanjut Prof Sri Yunanto mengatakan, tujuan utama Presiden Prabowo Subianto menggulirkan MBG adalah meningkatkan kualitas SDM Indonesia melalui pemenuhan gizi. Dampaknya tidak hanya pada kesehatan jangka pendek, tetapi juga pada penurunan stunting, peningkatan kecerdasan, dan kesiapan generasi muda menghadapi bonus demografi 2035 hingga Indonesia Emas 2045.

Dari sisi visi, ini sudah sangat jelas. Negara sedang menanam investasi jangka panjang. Kalau anak-anak diberi makan bergizi secara konsisten selama 10 tahun, mereka akan menjadi motor pembangunan ekonomi. Sepuluh tahun berikutnya, Indonesia masuk fase emas dengan SDM yang lebih berkualitas, ujarnya.

Ia menambahkan, proyeksi usia produktif Indonesia menunjukkan bahwa saat ini adalah waktu yang krusial untuk memastikan kualitas generasi mendatang.

Selain aspek gizi, Prof Sri Yunanto menilai penghentian MBG saat libur sekolah juga berpotensi mengganggu roda ekonomi daerah. Pasalnya, program ini melibatkan ribuan dapur MBG, UMKM, serta rantai pasok pangan lokal.

Kalau MBG berhenti saat libur, maka aktivitas ekonomi di dapur, UMKM, dan rantai pasok ikut berhenti. Padahal anggaran sekitar Rp 70 triliun per tahun itu seharusnya menjadi pemicu perputaran ekonomi daerah, jelasnya.

Ia menambahkan, keberadaan dapur MBG telah membuka lapangan kerja di berbagai daerah. Namun, aspek kesejahteraan tenaga kerja juga perlu mendapat perhatian.

Tenaga kerja dapur MBG harus tetap dilihat, apakah honornya sesuai UMR daerah. Jangan sampai saat libur, mereka juga kehilangan pendapatan, katanya.

Setelah hampir satu tahun berjalan, Prof. Sri Yunanto mendorong pemerintah untuk memperkuat evaluasi dampak MBG terhadap status gizi anak.

Yang perlu diukur bukan hanya jumlah paket yang dibagikan, tapi apakah ada peningkatan kondisi fisik anak, penurunan potensi stunting, peningkatan daya tahan tubuh dan kecerdasan, terutama di daerah minus dan terpencil, ujarnya.

Menurutnya, MBG harus dinilai dari dampak riil terhadap kesehatan masyarakat, bukan semata dari sisi administrasi.

Prof. Sri Yunanto juga menyoroti pentingnya menjaga kesinambungan rantai pasok MBG. Ia mengingatkan agar distribusi bahan pangan tidak dikuasai tengkulak dan manfaat ekonomi benar-benar dirasakan petani, peternak, dan nelayan.

Koperasi desa harus diperkuat. Jangan hanya simpan pinjam, tapi masuk ke bisnis dan rantai pasok MBG. Ini penting agar manfaat ekonomi tetap merata, termasuk saat sekolah libur, ujarnya.

Ia menilai penggunaan produk lokal seperti ikan dari daerah pesisir juga harus terus didorong agar industri lokal tetap bergerak.

Dari sisi ideologis, Prof. Sri Yunanto menilai MBG merupakan instrumen negara untuk mewujudkan pemerataan dan keadilan sosial. Karena itu, daerah tertinggal, terdepan, dan terluar (3T) harus menjadi prioritas, termasuk saat masa libur sekolah.

Jangan sampai MBG hanya dinikmati di kota yang akses pangannya sudah baik. Daerah 3T justru harus didahulukan. Ini soal keadilan dan kehadiran negara, pungkasnya.

Ikuti Whatsapp Channel Republika",https://republika.co.id/berita//t7rf9x291/guru-besar-umj-libur-sekolah-tak-boleh-jadi-alasan-terhentinya-mbg,5614,Fernan Rahadi,https:///static.republika.co.iduploadsimageskanal_slide051363000-1765868449-830-556.jpg,Nasional Rejogja,2026-02-02 18:37:52,3,
b56976385c16e236,Desakan Anggaran MBG Saat Libur Sekolah Dialihkan ke Sumatera dan Respons Menkeu Purbaya,2025-12-25 17:08:59,Andri Saubani,"REPUBLIKA.CO.ID, JAKARTA -- Tetap berjalannya program pemberian makan bergizi gratis (MBG) pada masa liburan sekolah dikritisi oleh sebagian ahli ekonomi. Ekonom Center of Economic and Law Studies (Celios) Nailul Huda misalnya, mempertanyakan manfaat kebijakan MBG saat anak sekolah libur pada akhir tahun ini.

""Anggaran ketika MBG ini masih berjalan, akan membuat uang pajak masyarakat tidak digunakan dengan baik dan benar,"" ujar Huda dalam keterangan tertulis di Jakarta, Selasa (23122025).

Temukan lebih banyak Perlengkapan sekolah Buku Analisis Politik Terkini Jadwal shalat

Temukan lebih banyak Perlengkapan sekolah Buku Analisis Politik Terkini Jadwal shalat

Temukan lebih banyak Perlengkapan sekolah Buku Analisis Politik Terkini Jadwal shalat

Huda menyampaikan data per Desember 2025 terdapat 17.555 Satuan Pelayanan Pemenuhan Gizi (SPPG) dengan masing-masing SPPG menyediakan 3.000 porsi setiap hari. Huda menyebut ada 526,65 juta porsi yang disediakan di liburan.

""Dengan harga rata-rata Rp15 ribu per porsi, ada Rp7,9 triliun uang rakyat yang digunakan. Apakah tidak berat bagi negara untuk menunda dan mengalihkan bagi masyarakat di Aceh, Sumatera Barat, dan Sumatera Utara yang tengah kesusahan,"" ucap Huda.

Huda mendorong alokasi anggaran MBG saat libur sekolah dialihkan untuk membantu penanganan bencana. Huda menyebut keputusan pemerintah melanjutkan program MBG saat libur sekolah merupakan hal yang tidak wajar.

""Jika memang berat bagi pemerintah memberhentikan sementara program MBG ini, maka ada sesuatu di luar akal sehat pemerintah yang bermain. Dengan potensi laba per dapur mencapai 13,33 persen (Rp2.000 dari Rp15 ribu), akan ada Rp1 triliun masuk ke kantong pengusaha SPPG. Tahu siapa yang punya SPPG? Ya kroni pemerintah,"" lanjut Huda.

Wali murid membagikan paket Makan Bergizi Gratis (MBG) kepada siswa di SDN Pabuaran Tumpeng 2, Kota Tangerang, Banten, Rabu (24122025). Penyaluran paket MBG berupa roti, buah-buahan, susu, keju dan telur yang dilakukan setiap seminggu sekali tersebut guna memastikan pemenuhan gizi peserta didik tetap terjaga selama masa libur sekolah. - (ANTARA FOTOPutra M. Akbar)

Wali murid membagikan paket Makan Bergizi Gratis (MBG) kepada siswa di SDN Pabuaran Tumpeng 2, Kota Tangerang, Banten, Rabu (24122025). Penyaluran paket MBG berupa roti, buah-buahan, susu, keju dan telur yang dilakukan setiap seminggu sekali tersebut guna memastikan pemenuhan gizi peserta didik tetap terjaga selama masa libur sekolah. - (ANTARA FOTOPutra M. Akbar)

Wali murid membagikan paket Makan Bergizi Gratis (MBG) kepada siswa di SDN Pabuaran Tumpeng 2, Kota Tangerang, Banten, Rabu (24122025). Penyaluran paket MBG berupa roti, buah-buahan, susu, keju dan telur yang dilakukan setiap seminggu sekali tersebut guna memastikan pemenuhan gizi peserta didik tetap terjaga selama masa libur sekolah. - (ANTARA FOTOPutra M. Akbar)

Huda menyampaikan langkah ""merapel MBG beberapa hari dalam satu paket dengan makanan dalam kemasan, mulai dari biskuit, makanan ringan, susu dalam kemasan, hingga roti pun tidak menguntungkan pelaku usaha kecil. Huda menyebut produk-produk tersebut justru dimiliki konglomerat.

""Uang Rp7,9 triliun akan masuk lebih banyak ke konglomerat, tidak ke pedagang sayur di pasar, tidak ke petani sayur di daerah. Yang menikmati adalah orang besar yang duduk dalam kursi mewahnya di rumah yang megah,"" sambung Huda.

Huda mengatakan salah satu tujuan program MBG ini adalah mengubah pola makan anak yang mendapatkan program di rumah. Ketika program MBG, anak-anak mendapatkan berbagai macam jenis makanan, mulai dari sayur, protein, karbohidrat, vitamin, dan sebagainya.

""Pak Presiden, saya tahu program ini program prioritas Anda, tapi ada wilayah yang lebih membutuhkan dana ini sekarang ketimbang dompet konglomerat yang sudah penuh. Jadikan libur sekolah ini untuk mengevaluasi MBG, bukan dijadikan waktu untuk balik modal lebih cepat pemilik SPPG,"" kata Huda.

Usulan pengalihan anggaran MBG untuk mempercepat penanganan bencana banjir dan longsor yang melanda wilayah Sumatera juga datang dari kalangan anggota DPR RI. Wakil Ketua Komisi IX DPR Charles Honoris menilai pendistribusian MBG di masa libur sekolah berisiko tidak efektif.

""Dananya lebih mendesak untuk dialokasikan pada pemulihan gizi pengungsi serta perbaikan fasilitas kesehatan di daerah terdampak bencana.""

Ikuti Whatsapp Channel Republika",https://republika.co.id/berita//t7tliz409/desakan-anggaran-mbg-saat-libur-sekolah-dialihkan-ke-sumatera-dan-respons-menkeu-purbaya,4385,Andri Saubani,https:///static.republika.co.iduploadsimageskanal_slide023728200-1766583785-830-556.jpg,News Analysis,2026-02-02 18:37:52,3,
4c0f6a5f33031386,Lumbung Mataram Siap Pasok Bahan Dapur MBG di Yogyakarta,2025-12-24 13:42:28,Dwi Murdaningsih,"REPUBLIKA.CO.ID, YOGYAKARTA - Badan Gizi Nasional (BGN) mengapresiasi langkah Pemerintah Provinsi Daerah Istimewa Yogyakarta (DIY) yang telah menyiapkan program Lumbung Mataram di desa-desa, sebagai pemasok bahan baku pangan untuk Satuan Pelayanan Pemenuhan Gizi (SPPG) di Yogyakarta. Program Lumbung Mataram ini sejalan pasal 38 Peraturan Presiden nomor 115 tahun 2025, tentang Tata Kelola Penyelenggaraan Program Makan Bergizi Gratis.

Alhamdulillah . Luar biasa. Ternyata Ngarso Dalem telah menyiapkan Program Lumbung Mataram, yang akan dibangun secara integrated , untuk peternakan dan pertanian. Lumbung Mataram ini nanti Insya Allah akan memasok dapur-dapur MBG,"" kata Wakil Kepala BGN bidang Komunikasi Publik dan Investigasi Nanik Sudaryati Deyang usai bertemu Sri Sultan Hamengkubuwono X, di Komplek Kantor Gubernur DIY, Selasa, (23122025).

Dalam pertemuan dua jam itu, Sri Sultan Hamengkubuwono X banyak menjelaskan tentang program Lumbung Mataram. Program ini adalah program pemberdayaan masyarakat desa di seluruh wilayah Provinsi DIY. Setiap desa menyediakan lahan kas desa 1 hingga 1,25 hektar untuk Lumbung Mataram yang akan diusahkan oleh warga yang tidak punya sawah.

Lumbung Mataram ini sudah kami siapkan sejak dua tahun yang lalu, untuk membantu warga masyarakat yang kurang beruntung,"" kata Sri Sultan.

Sri Sultan berharap, Lumbung Mataram akan dapat memasok seluruh kebutuhan bahan baku pangan untuk program MBG di DIY. Harapan saya ini bisa, sebagian besar, bisa supply pada kebutuhan-kebutuhan untuk makan gratis, kata Sultan.

Wakil Kepala BGN bidang Komunikasi Publik dan Investigasi Nanik Sudaryati Deyang bertemu Sri Sultan Hamengkubuwono X, di Komplek Kantor Gubernur DIY, Selasa, (23122025). - (BGN)

Nanik sempat menyoroti masalah ketersediaan bahan baku pangan untuk program MBG yang semakin meningkat karena pertambahan SPPG. Kebutuhan bahan baku pangan untuk Program MBG ini dikhawatirkan akan bisa menyebabkan inflasi dan kekurangan.

Namun, Program Lumbung Mataram bisa menjadi solusi bagi persoalan ketersediaan bahan baku pangan di DIY karena menerapkan pertanian terintegrasi. Program Lumbung Mataram diharapkan bisa memasok bahan baku pangan untuk dapur MBG di Provinsi DIY.

Diharapkan dengan adanya Lumbung Mataram ini, tidak ada lagi yang membeli dari luar daerah. Sehingga kemandirian ekonomi dan juga pemberdayaan masyarakat akan terjadi,"" kata Nanik, yang juga menjabat sebagai Ketua Pelaksana Harian Tim Koordinasi antar Kementerian dan Lembaga untuk pengelolaan program MBG.

Jika berhasil, lahan Lumbung Mataram bisa diperluas lagi. Dengan konsep ini, diharapkan penghasilan masyarakat desa akan dapat bertambah.

Program Lumbung Mataram, kata Nanik, sesuai dengan Peraturan Presiden (Perpres) Nomor 115 Tahun 2025 tentang Tata Kelola Penyelenggaraan Program MBG. Sebab dalam pasal 38 ditekankan bahwa penyelenggaraan Program MBG memprioritaskan penggunaan produk dalam negeri dan pelibatan usaha mikro, usaha kecil, perseroan perorangan, koperasi, koperasi desakelurahan merah putih, dan Badan Usaha Milik Desa (BUM-Des).

Sambil berkeliling ke berbagai daerah, Nanik berjanji akan mensosialisasikan Program Lumbung Pangan yang digagas Sri Sultan. Saya berterima kasih. Saya akan sampaikan bahwa DIY sudah mempelopori, di mana desa memanfaatka lahan idle , atau bengkok kalau perlu, untuk ditanami warga masyarakat yang tidak punya sawah, untuk dimanfaatkan sebagai lahan pertanian dan peternakan, ujarnya.

Ikuti Whatsapp Channel Republika",https://republika.co.id/berita//t7rhas368/lumbung-mataram-siap-pasok-bahan-dapur-mbg-di-yogyakarta,3493,Dwi Murdaningsih,https:///static.republika.co.iduploadsimageskanal_slidewakil-kepala-bgn-bidang-komunikasi-publik-dan-investigasi-nanik_251224134058-425.jpg,Nasional News,2026-02-02 18:37:56,3,
a70f6ffe155533e0,"Anggaran Program MBG Capai Rp 335 Triliun, Netty Presetyani Berharap Bisa Turunkan Stunting",2025-12-23 21:40:55,Arie Lukihardianti,"REPUBLIKA.CO.ID, BANDUNG--Program Makan Bergizi Gratis (MBG) masih terus bergulir pada 2026 nanti. Menurut Anggota Komisi IX DPR RI Netty Prasetyani alokasi anggaran MBG ini sangat besar. Yakni, nilainya mencapai Rp 335 triliun. Karena, harapannya tak ada anak yang pergi ke sekolah tanpa sarapan.

""Kami berharap, program MBG bisa menurunkan angka stunting. Kan ada 12 provinsi dengan stunting yang tinggi. Tahun 2026, ada 82 juta anak yang mendapatkan MBG, diharapkan sudah terpenuhi,"" ujar Netty di Kota Bandung, Senin malam (22122025).

Netty mengatakan, agar pelaksanaan program MBG bisa berjalan lancar memang masih memerlukan pembenahan. Terutama, dalam aspek tata kelola, kualitas gizi, hingga pengawasan. Agar, pelaksanaannya pada 2026 benar-benar mencapai tujuan awal.

Netty mengibaratkan MBG seperti pesanan katering dalam skala besar yang dijalankan secara serentak. Sehingga, memicu berbagai persoalan di lapangan.

Masyarakat menganalogikan MBG seperti pesanan katering. Tapi ini langsung besar dan serempak. Satu SPPG awalnya melayani sampai 4.000 penerima, lalu turun jadi 3.500, sekarang 3.000 ditambah 500 untuk ibu hamil, balita, dan menyusui. Keserempakan inilah yang memunculkan banyak persoalan, katanya.

Terkait kualitas gizi, menurut Netty, indikator utama MBG seharusnya terletak pada nilai gizinya. Di banyak tempat, makanan bergizi itu hanya judul di atas kertas. Pada praktiknya masih banyak ditemukan makanan ultra-proses atau pabrikan, katanya.

Menurutnya, kebijakan lanjutan seperti kewajiban Sertifikat Laik Higiene Sanitasi (SLHS), sertifikasi juru masak, serta pembatasan akses dapur pada jam tertentu merupakan langkah positif. Namun, standar SLHS perlu diseragamkan agar tidak menimbulkan kebingungan di lapangan.

Netty pun menilai, tantangan MBG juga berkaitan dengan kebiasaan makan masyarakat yang belum sepenuhnya selaras dengan prinsip gizi seimbang. Ia menyebut literasi gizi masih rendah, sehingga tidak jarang muncul permintaan menu makanan cepat saji seperti nugget atau burger.

Ini menunjukkan masih ada disparitas antara idealisme menghadirkan makanan bergizi gratis dengan kebiasaan makan masyarakat, katanya.

Ikuti Whatsapp Channel Republika",https://republika.co.id/berita//t7q8s7512/anggaran-program-mbg-capai-rp-335-triliun-netty-presetyani-berharap-bisa-turunkan-stunting,2196,Arie Lukihardianti,https:///static.republika.co.iduploadsimageskanal_slideanggota-komisi-ix-dpr-ri-netty-prasetiyani_201010131633-827.jpg,News Rejabar,2026-02-02 18:37:56,3,
3000331acd117ccb,"Pasokan Bahan Baku MBG dari Usaha Rakyat, Ibu-Ibu Bertani dan Berternak bisa Jadi Mitra",2025-12-23 21:03:18,Karta Raharja Ucu,"REPUBLIKA.CO.ID,SEMARAN G -- Menteri Koordinator (Menko) Bidang Pangan, Zulkifli Hasan atau akrab disapa Zulhas, mengatakan, pada 2026, penerima manfaat program Makan Bergizi Gratis (MBG) akan meningkat hingga lebih dari 82,9 juta orang. Dia menyebut, pasokan untuk MBG nantinya akan difokuskan dari usaha-usaha rakyat.

Zulhas mengungkapkan, saat ini jumlah Satuan Pelayanan Pemenuhan Gizi (SPPG) yang sudah berdiri lebih dari 18 ribu unit. Mereka telah melayani 50 juta penerima manfaat. ""Maret (2026) nanti seluruhnya 82,9 juta penerima manfaat,"" ujarnya saat mengunjungi SPPG Jatibarang 2, Kota Semarang, Jawa Tengah, Jumat (19122025).

Dia mengatakan, nantinya bahan baku untuk MBG akan diutamakan dari usaha rakyat dan koperasi. ""MBG itu nanti bahan bakunya di tata kelolanya sudah kami atur agar menimbulkan, sesuai arahan Presiden, untuk memberikan dampak ekonomi kerakyatan,"" ucapnya.

Karena itu, SPPG akan bermitra dengan koperasi dan badan usaha milik desa untuk penyediaan bahan baku MBG. ""Nanti mitranya harus koperasi desa, koperasi kelurahan, badan usaha milik desa, atau usaha-usaha rakyat di sekitar, sehingga ekonomi sekitar bisa tumbuh,"" kata Zulhas.

""Ibu-ibu bisa tanam sayur, bisa tanam buah, bisa pelihara tambak, bisa pelihara ayam, dan seterusnya, sehingga ekonomi rakyat bisa berkembang dengan baik,"" tambah Zulhas.

Dia menerangkan, kunjungannya ke SPPG Jatibarang 2 di Kota Semarang adalah untuk memeriksa kegiatan pengolahan MBG di tempat tersebut. ""Kami memastikan sudah ada SLHS (sertifikat laik higiene sanitasi) di sini, memenuhi standar gizi, dan yang paling penting keamanan pangan ya,"" ujarnya.

Menurut Zulhas, target pendirian SPPG, khususnya di Pulau Jawa, sudah hampir tercapai. ""Fokus kita sekarang daerah tertinggal,"" ucapnya.

Ikuti Whatsapp Channel Republika",https://republika.co.id/berita//t7q71i282/pasokan-bahan-baku-mbg-dari-usaha-rakyat-ibu-ibu-bertani-dan-berternak-bisa-jadi-mitra,1803,Karta Raharja Ucu,https:///static.republika.co.iduploadsimageskanal_slide006506800-1765902866-830-556.jpg,Jateng,2026-02-02 18:37:58,3,
2e501bdf07acf42d,"MBG Jalan di Libur Sekolah, Celios Soroti Potensi Pemborosan Anggaran",2025-12-23 14:03:02,Gita Amanda,"REPUBLIKA.CO.ID, JAKARTA -- Ekonom Center of Economic and Law Studies (Celios) Nailul Huda mengkritisi program Makan Bergizi Gratis (MBG) yang tetap berjalan saat libur kegiatan belajar mengajar. Huda mempertanyakan manfaat kebijakan tersebut.

Anggaran ketika MBG ini masih berjalan akan membuat uang pajak masyarakat tidak digunakan dengan baik dan benar, ujar Huda dalam keterangan tertulis di Jakarta, Selasa (23122025).

Temukan lebih banyak Software keuangan

Temukan lebih banyak Software keuangan

Huda menyampaikan, per Desember 2025 terdapat 17.555 Satuan Pelayanan Pemenuhan Gizi (SPPG), dengan masing-masing SPPG menyediakan 3.000 porsi setiap hari. Ia menyebut terdapat 526,65 juta porsi yang disediakan selama masa libur sekolah.

Dengan harga rata-rata Rp 15 ribu per porsi, ada Rp 7,9 triliun uang rakyat yang digunakan. Apakah tidak berat bagi negara untuk menunda dan mengalihkan bagi masyarakat di Aceh, Sumatera Barat, dan Sumatera Utara yang tengah kesusahan, ucap Huda.

Huda mendorong agar alokasi anggaran MBG saat libur sekolah dialihkan untuk membantu penanganan bencana. Ia menilai keputusan pemerintah melanjutkan program MBG saat libur sekolah sebagai hal yang tidak wajar.

Jika memang berat bagi pemerintah memberhentikan sementara program MBG ini, maka ada sesuatu di luar akal sehat pemerintah yang bermain. Dengan potensi laba per dapur mencapai 13,33 persen atau sekitar Rp 2.000 dari Rp 15 ribu, akan ada Rp 1 triliun masuk ke kantong pengusaha SPPG, lanjut Huda.

Ia juga menyoroti langkah merapel MBG dalam beberapa hari menjadi satu paket makanan kemasan, mulai dari biskuit, snack ringan, susu kemasan, hingga roti. Menurut Huda, kebijakan tersebut tidak menguntungkan pelaku usaha kecil karena produk-produk tersebut justru dimiliki konglomerat.

Uang Rp 7,9 triliun akan masuk lebih banyak ke konglomerat, bukan ke pedagang sayur di pasar, bukan ke petani sayur di daerah. Yang menikmati adalah orang besar yang duduk di kursi mewah di rumah yang megah, sambungnya.

Huda mengatakan salah satu tujuan program MBG adalah mengubah pola makan anak penerima manfaat di rumah. Dalam pelaksanaan MBG, anak-anak mendapatkan berbagai jenis makanan, mulai dari sayuran, protein, karbohidrat, vitamin, dan lainnya.

Pak Presiden, saya tahu program ini program prioritas Anda, tapi ada wilayah yang lebih membutuhkan dana ini sekarang ketimbang dompet konglomerat yang sudah penuh. Jadikan libur sekolah ini untuk mengevaluasi MBG, bukan dijadikan waktu untuk balik modal lebih cepat bagi pemilik SPPG, kata Huda.

Ikuti Whatsapp Channel Republika",https://republika.co.id/berita//t7pnl2423/mbg-jalan-di-libur-sekolah-celios-soroti-potensi-pemborosan-anggaran,2578,Gita Amanda,https:///static.republika.co.iduploadsimageskanal_slide080721100-1765884522-830-556.jpg,Finansial,2026-02-02 18:37:59,3,
b76be254f540fe50,BGN Tegaskan Siswa tak Dipaksa Ambil MBG Saat Libur Sekolah,2025-12-23 13:28:21,Friska Yolandha,"REPUBLIKA.CO.ID, JAKARTA -- Wakil Kepala Badan Gizi Nasional (BGN) Nanik Sudaryati Deyang menegaskan pihaknya tidak memaksa siswa untuk mengambil Makan Bergizi Gratis (MBG) saat libur sekolah. Ia juga menepis anggapan bahwa pemberian MBG selama liburan dipaksakan untuk menghabiskan anggaran.

Jadi, anak-anak tidak dipaksa untuk datang ke sekolah. Silakan saja kalau MBG itu diambil ibunya, ayahnya, atau saudaranya. Kalau misalnya sekolah tidak mau menerima, wali murid juga tidak mau, maka juga tidak apa-apa dan tidak dipaksa. Jadi, tidak ada yang memaksa anak-anak libur ke sekolah untuk mengambil MBG. Mohon jangan dipelintir, kata Nanik saat dikonfirmasi di Jakarta, Selasa.

BGN menyadari bahwa perbaikan gizi siswa memang memerlukan konsistensi. Namun, BGN juga memahami bahwa anak-anak sekolah sedang memasuki masa liburan. Oleh karena itu, Satuan Pelayanan Pemenuhan Gizi (SPPG) menawarkan kepada sekolah-sekolah penerima manfaat untuk mengajukan permohonan apabila tetap ingin menerima MBG.

Hidangan MBG akan diantarkan SPPG sesuai dengan permintaan sekolah, dalam bentuk makanan kering, ujar dia.

Nanik juga meluruskan tudingan sejumlah kalangan yang menyebut pemberian MBG saat liburan dilakukan untuk menghabiskan anggaran.

Justru sebaliknya, kami menghemat anggaran. Bayangkan, anggaran MBG tahun 2025 sebesar Rp 71 triliun dengan target 6 juta penerima manfaat yang terdiri atas anak sekolah serta ibu hamil, ibu menyusui, dan balita (3B). Namun, ternyata kami bisa memberi manfaat kepada 50 juta anak Indonesia dan kelompok 3B, paparnya.

Menurut dia, penghematan dapat dilakukan karena semula terdapat banyak dapur yang harus dibangun BGN. Namun, sejumlah yayasan atau mitra bersedia membangun dapur MBG yang disebut sebagai Dapur Mandiri.

Akhirnya, biaya yang dikeluarkan BGN hanya untuk program MBG sebesar Rp 15 ribu per porsi makanan; gaji karyawan BGN, termasuk kepala SPPG, ahli gizi, dan akuntan yang saat ini hampir 100 ribu orang dan tersebar dari Sabang sampai Merauke; serta biaya operasional. Data yang saya sampaikan ini bisa dicek ke Kementerian Keuangan, ucap Nanik.

Ikuti Whatsapp Channel Republika",https://republika.co.id/berita//t7plz9370/bgn-tegaskan-siswa-tak-dipaksa-ambil-mbg-saat-libur-sekolah,2138,Friska Yolandha,https:///static.republika.co.iduploadsimageskanal_slide039348800-1765868447-830-556.jpg,Nasional News,2026-02-02 18:38:00,3,
