article_id,judul,waktu_terbit,editor,konten,url,panjang_konten,author,thumbnail,kategori,created_at,search_page,search_date
eff898c87744ae60,"Tingkat Kemiskinan di Indonesia Masih Tinggi, Bisakah MBG Berperan Menekannya?",2026-01-13 20:11:45,Friska Yolandha,"REPUBLIKA.CO.ID,JAKARTA Jumlah penduduk miskin di Indonesia masih tinggi yakni hampir 24 juta orang, menurut data terbaru Badan Pusat Statistik (BPS). Pemerintah berupaya untuk menekan tingkat kemiskinan, diantaranya lewat program prioritas Makan Bergizi Gratis (MBG). Seberapa besar peran MBG berpotensi menurunkan tingkat kemiskinan di Indonesia?

Data historikal BPS menunjukkan tingkat kemiskinan di Indonesia cenderung mengalami tren penurunan dalam beberapa tahun terakhir pascapandemi Covid-19. Setelah sempat mencapai puncaknya di level 10,14 persen pada 2021, tingkat kemiskinan berangsur menurun di bawah 9 persen pada 2024 dan 2025. Kendati demikian, jumlah penduduk miskin terbilang masih sangat tinggi.

Berdasarkan hasil Survei Sosial Ekonomi Nasional (Susenas) Maret 2025, tingkat kemiskinan di Indonesia tercatat sebesar 8,47 persen menjadi 23,85 juta orang, lebih rendah dibandingkan data per September 2024 sebesar 8,57 persen atau 24,06 juta orang.

Tren jumlah penduduk miskin di wilayah perkotaan dan pedesaan pada Maret 2025 mengalami perbedaan. Di perkotaan, tingkat kemiskinannya 6,73 persen, dengan jumlah penduduk miskin sebanyak 11,27 juta orang pada Maret 2025, atau naik 0,22 juta dari 11,05 juta orang pada September 2024. Sedangkan tingkat kemiskinan di pedesaan yakni 11,03 persen, dengan jumlah penduduk miskin pada Maret 2025 tercatat 12,58 juta orang, turun 0,43 juta orang dari 13,01 juta pada September 2024.

Sementara itu, tingkat kemiskinan ekstrem di Indonesia pada Maret 2025 tercatat sebesar 0,85 persen atau 2,38 juta orang. Angka tersebut lebih rendah dibandingkan periode yang sama tahun sebelumnya yang mencatatkan tingkat kemiskinan ekstrim sebesar 1,26 persen atau sekitar 3,56 juta orang.

BPS mencatat, garis kemiskinan di Indonesia pada Maret 2025 sebesar Rp 609.160 per kapita per bulan, naik 2,34 persen dibandingkan posisi September 2024. Garis kemiskinan nasional Rp 609.160 per kapita per bulan setara dengan sekira Rp 20.305 per hari, artinya seseorang dikategorikan miskin jika pengeluarannya di bawah angka tersebut per harinya.

Seiring dengan masih tingginya tingkat kemiskinan di Indonesia, pemerintah berharap program MBG selain memperbaiki gizi anak-anak usia sekolah- ditargetkan juga bisa menekan angka kemiskinan ekstrem melalui penyediaan makanan sehat dan bergizi secara merata.

Kepala Pusat Makroekonomi dan Keuangan Institute for Development of Economics and Finance (Indef) M. Rizal Taufikurrahman berpendapat, program MBG sebaiknya diposisikan secara proporsional dalam agenda penanggulangan kemiskinan ekstrem.

Ikuti Whatsapp Channel Republika",https://republika.co.id/berita//t8t0nl370/tingkat-kemiskinan-di-indonesia-masih-tinggi-bisakah-mbg-berperan-menekannya,2620,Friska Yolandha,https:///static.republika.co.iduploadsimageskanal_slide052799100-1768212785-830-556.jpg,Finansial,2026-02-02 18:37:16,2,
000e29a5abcb44e7,803 Siswa TK Hingga SMK di Grobogan Keracunan MBG,2026-01-13 17:10:11,Karta Raharja Ucu,"REPUBLIKA.CO.ID, GROBOGAN -- Sebanyak 803 siswa dari berbagai sekolah di Kabupaten Grobogan, Jawa Tengah (Jateng), diduga mengalami keracunan Makan Bergizi Gratis (MBG). Dari total terduga korban, 115 di antaranya harus menjalani perawatan medis.

Kepala Dinas Kesehatan Grobogan, Djatmiko, mengungkapkan, ratusan siswa di Grobogan mengalami gejala keracunan setelah mengonsumsi MBG yang dibagikan pada Jumat (912026). Menu MBG terdiri dari nasi kuning, telur dadar, tempe orek, dan abon. MBG tersebut diolah dan disajikan oleh Satuan Pelayanan Pemenuhan Gizi (SPPG) Grobogan Gubug Kwaron 1.

""Pas sore mulai terasa mual, muntah, dan berlanjut hingga Sabtu (1012026),"" ujar Djatmiko ketika dihubungi Republika, Selasa (1312026).

Dia menambahkan, para siswa yang mengalami gejala keracunan berasal dari setidaknya 11 sekolah, mulai dari tingkat TK, SD, SMP, dan SMK. Mereka tersebar di beberapa desa, seperti Desa Trisari, Ngroto, dan Penadaran.

Sekolah yang siswanya terdampak antara lain SMP Pondok Pesantren Miftahul Huda Ngroto, SMK Pondok Pesantren Miftahul Huda Ngroto, SDN 1 Trisari, SDN 1 Penadaran, dan TK Ngroto. Menurut Djatmiko, siswa dengan gejala keracunan terbanyak berasal dari SMP dan SMK Pondok Pesantren Miftahul Huda Ngroto.

""Totalnya (siswa yang mengalami gejala keracunan) 803. Yang sudah diobati dan sembuh 688. Dari 803 dan 688 itu, ada 115 yang harus dirawat inap. Sudah dilakukan pengobatan, sudah sembuh 61, tinggal 54 (yang dirawat),"" kata Djatmiko.

Dia mengungkapkan, ke-54 siswa tersebut dirawat di rumah sakit dan beberapa puskesmas. Menurut Djatmiko, gejala mual, sakit perurt, dan buang air besar yang mereka alami sudah mulai mereda. ""Semoga hari ini sudah bisa sembuh semuanya,"" ujarnya.

Djatmiko mengatakan, pihaknya telah menguji sampel MBG yang diduga menjadi penyebab gejala keracunan. Dia menyebut, proses uji lab memakan waktu antara tujuh hingga sepuluh hari.

Ikuti Whatsapp Channel Republika",https://republika.co.id/berita//t8ss8z282/803-siswa-tk-hingga-smk-di-grobogan-keracunan-mbg,1939,Karta Raharja Ucu,https:///static.republika.co.iduploadsimageskanal_slideilustrasi-anak-sekolah-keracunan_251001121356-759.jpg,Jateng,2026-02-02 18:37:19,2,
37776ef70fee48d2,SPPG Penyalur MBG yang Diduga Picu Keracunan 803 Siswa di Grobogan Dibekukan,2026-01-13 14:54:13,Mas Alamil Huda,"REPUBLIKA.CO.ID, GROBOGAN -- Sekretaris Tim Satgas Percepatan MBG Provinsi Jawa Tengah (Jateng), Hanung Triyono, mengungkapkan, kegiatan operasional SPPG Grobogan Gubug Kwaron 1 telah dibekukan sementara. Hal itu menyusul adanya kasus dugaan keracunan MBG yang dialami lebih dari 803 siswa di Kabupaten Grobogan.

""SPPG yang terjadi KLB (kejadian luar biasa) telah diberhentikan operasional sementara sampai dengan batas waktu yang belum ditentukan,"" kata Hanung ketika dikonfirmasi soal kasus dugaan keracunan MBG di Grobogan, Selasa (1312026).

Temukan lebih banyak Ebook Panduan Investasi Syariah Kolom opini Langganan Podcast Berita

Temukan lebih banyak Ebook Panduan Investasi Syariah Kolom opini Langganan Podcast Berita

Temukan lebih banyak Ebook Panduan Investasi Syariah Kolom opini Langganan Podcast Berita

Ebook Panduan Investasi Syariah

Ebook Panduan Investasi Syariah

Dia menambahkan, Badan Gizi Nasional (BGN) juga telah menerjunkan tim untuk menginspeksi kepatuhan SPPG Grobogan Gubug Kwaron 1. Selain itu, tim BGN turut menjenguk para siswa yang diduga mengalami keracunan setelah mengonsumsi MBG. ""Segala bentuk pengobatan pasien akan ditanggung oleh BGN,"" ujar Hanung.

Sementara itu Sekretaris Daerah Provinsi Jateng, Sumarno, mengungkapkan, Dinas Kesehatan Jateng tengah memeriksa menu MBG yang diduga menjadi pemicu dugaan keracunan ratusan siswa di Grobogan. ""Masalah higienis dan sebagainya, ini sedang diasesmen oleh teman-teman Dinas Kesehatan,"" ujarnya.

Dia menambahkan, terkait penindakan terhadap SPPG yang mengolah dan menyajikan MBG penyebab dugaan kasus keracunan, hal itu menjadi wewenang BGN. ""Tadi pagi saya minta dari Dinas Kesehatan, ternyata dari BGN juga ada di Dinas Kesehatan sedang membahas masalah ini,"" ucap Sumarno.

Sebanyak 803 siswa dari berbagai sekolah di Kabupaten Grobogan, Jawa Jateng, diduga mengalami keracunan MBG. Dari total terduga korban, 115 di antaranya harus menjalani perawatan medis.

Tips menghindari keracunan MBG. - (Dok. Republika)

Tips menghindari keracunan MBG. - (Dok. Republika)

Ikuti Whatsapp Channel Republika",https://republika.co.id/berita//t8slyd487/sppg-penyalur-mbg-yang-diduga-picu-keracunan-803-siswa-di-grobogan-dibekukan,2090,Mas Alamil Huda,https:///static.republika.co.iduploadsimageskanal_slide065942900-1761745792-830-556.jpg,Nasional News,2026-02-02 18:37:19,2,
454b4465c3a5201f,Sebanyak 803 Siswa di Grobogan Diduga Alami Keracunan MBG,2026-01-13 14:38:37,Muhammad Hafil,"REPUBLIKA.CO.ID,GROBOGAN -- Sebanyak 803 siswa dari berbagai sekolah di Kabupaten Grobogan, Jawa Tengah (Jateng), diduga mengalami keracunan Makan Bergizi Gratis (MBG). Dari total terduga korban, 115 di antaranya harus menjalani perawatan medis.

Kepala Dinas Kesehatan Grobogan, Djatmiko, mengungkapkan, ratusan siswa di Grobogan mengalami gejala keracunan setelah mengonsumsi MBG yang dibagikan pada Jumat (912026). Menu MBG terdiri dari nasi kuning, telur dadar, tempe orek, dan abon. MBG tersebut diolah dan disajikan oleh Satuan Pelayanan Pemenuhan Gizi (SPPG) Grobogan Gubug Kwaron 1.

""Pas sore mulai terasa mual, muntah, dan berlanjut hingga Sabtu (1012026),"" ujar Djatmiko ketika dihubungi Republika , Selasa (1312026).

Dia menambahkan, para siswa yang mengalami gejala keracunan berasal dari setidaknya 11 sekolah, mulai dari tingkat TK, SD, SMP, dan SMK. Mereka tersebar di beberapa desa, seperti Desa Trisari, Ngroto, dan Penadaran.

Sekolah yang siswanya terdampak antara lain SMP Pondok Pesantren Miftahul Huda Ngroto, SMK Pondok Pesantren Miftahul Huda Ngroto, SDN 1 Trisari, SDN 1 Penadaran, dan TK Ngroto. Menurut Djatmiko, siswa dengan gejala keracunan terbanyak berasal dari SMP dan SMK Pondok Pesantren Miftahul Huda Ngroto.

""Totalnya (siswa yang mengalami gejala keracunan) 803. Yang sudah diobati dan sembuh 688. Dari 803 dan 688 itu, ada 115 yang harus dirawat inap. Sudah dilakukan pengobatan, sudah sembuh 61, tinggal 54 (yang dirawat),"" kata Djatmiko.

Dia mengungkapkan, ke-54 siswa tersebut dirawat di rumah sakit dan beberapa puskesmas. Menurut Djatmiko, gejala mual, sakit perurt, dan buang air besar yang mereka alami sudah mulai mereda. ""Semoga hari ini sudah bisa sembuh semuanya,"" ujarnya.

Djatmiko mengatakan, pihaknya telah menguji sampel MBG yang diduga menjadi penyebab gejala keracunan. Dia menyebut, proses uji lab memakan waktu antara tujuh hingga sepuluh hari.

Ikuti Whatsapp Channel Republika",https://republika.co.id/berita//t8sl8d430/sebanyak-803-siswa-di-grobogan-diduga-alami-keracunan-mbg,1939,Muhammad Hafil,https:///static.republika.co.iduploadsimageskanal_slideilustrasi-1-tahun-pencapaian-pemerintahan-prabowo-gibran-makan-bergizi_251019125123-304.jpg,Pendidikan,2026-02-02 18:37:22,2,
25e6e6934c4785cc,Anggaran MBG Rp 335 Triliun Diproyeksikan Serap 3 Juta Tenaga Kerja,2026-01-13 12:52:03,Friska Yolandha,"REPUBLIKA.CO.ID, JAKARTA - Pemerintah menyiapkan anggaran Rp335 triliun untuk program Makan Bergizi Gratis (MBG) yang diproyeksikan menyerap 3 juta tenaga kerja dan mendorong pertumbuhan ekonomi nasional mendekati 6 persen. Menteri Koordinator Bidang Perekonomian Airlangga Hartato mengatakan, program MBG memiliki dampak ekonomi besar karena aliran dananya langsung masuk ke tingkat akar rumput. Dari total anggaran Rp335 triliun, nilai belanja per kuartal dapat mencapai hampir Rp80 triliun.

Bayangkan dari Rp335 triliun ini per kuartalnya bisa hampir Rp80 triliun. Nah, stimulus yang dilontorkan pemerintah di tahun lalu itu yang di kuartal pertama mendekati sekitar Rp37 triliun, kata Airlangga saat memberi sambutan dalam Food and Security Summit di Menara Kadin Jakarta, Selasa (1312026).

Temukan lebih banyak Software keuangan

Temukan lebih banyak Software keuangan

Ia menjelaskan, program MBG diperkirakan mampu menyerap sekitar 3 juta tenaga kerja. Dengan perhitungan umum bahwa setiap 1 persen pertumbuhan ekonomi setara dengan penyerapan 400 ribu tenaga kerja, MBG dinilai signifikan dalam mengerek laju ekonomi nasional.

Dan ini untuk MBG ini diperkirakan akan mempekerjakan 3 juta orang. Dan rule of thumb 1 persen pertumbuhan ekonomi itu 400 ribu orang, ujar Airlangga.

Menurutnya, meski target pertumbuhan ekonomi dalam APBN berada di kisaran 5,4 persen, pemerintah optimistis capaian dapat didorong lebih tinggi melalui program berbasis konsumsi dan pangan.

Walaupun di APBN 5,4, tetapi internally kita mau dorong ke 6 persen. Lima koma delapan sampai 6 persen, ucapnya.

Selain MBG, pemerintah juga menyiapkan anggaran ketahanan pangan sebesar Rp164,4 triliun serta dukungan UMKM senilai Rp181,8 triliun, terutama untuk menggerakkan ekonomi perdesaan. Dana tersebut dikaitkan dengan target pembentukan 80 ribu koperasi Merah Putih di berbagai daerah.

Ikuti Whatsapp Channel Republika",https://republika.co.id/berita//t8sgar370/anggaran-mbg-rp-335-triliun-diproyeksikan-serap-3-juta-tenaga-kerja,1908,Friska Yolandha,https:///static.republika.co.iduploadsimageskanal_slide021245800-1765902862-830-556.jpg,Finansial,2026-02-02 18:37:22,2,
ec0a376ec02f277b,"Cicak Ditemukan di Dalam Bakwan MBG di Gunungkidul, Sempat Dikunyah Lalu Dimuntahkan",2026-01-13 09:02:13,Karta Raharja Ucu,"REPUBLIKA.CO.ID, YOGYAKARTA -- Program Makan Bergizi Gratis (MBG) di Kabupaten Gunungkidul, Daerah Istimewa Yogyakarta kembali menjadi sorotan setelah beredar luas di media sosial temuan seekor cicak di dalam lauk bakwan. Peristiwa tersebut terjadi pada menu MBG yang dibagikan kepada siswa TK ABA 1 Grogol, Kapanewon Paliyan.

Akun Instagram fokusgunungkidul memposting sebuah unggahan dengan informasi temuan cicak itu pertama kali beredar di grup komunikasi wali murid sebelum akhirnya menyebar ke media sosial dan menjadi viral. Dalam postingan itu, orang tua murid melaporkan kejadian tersebut dengan narasi 'Buk, tadi di MBG menunya kan ada bakwan, terus punya wildan itu dibawa pulang yg makan ibuknyaa. Ya ampun buk didalam bakwan ada cicaknya.'

Unggahan tersebut langsung memicu beragam reaksi warganet yang mempertanyakan keamanan pangan dalam program MBG. ""Lihat cicak hidup saja rasanya sudah mual, lah ini di bakwan loh, Ibu nya udah terlanjur gigit belum?,"" komentar salah satu warganet dilihat Republika , Senin (1212026).

""Bakwan??? Masa dikasi makan tepung?? Ada gizinya?,"" tulis warganet lainnya.

Cicak yang diduga ada di dalam menu MBG yang dibagikan kepada siswa TK ABA 1 Grogol, Kapanewon Paliyan, Gunungkidul. - (Dok : Instagram fokusgunungkidul.)

Cicak yang diduga ada di dalam menu MBG yang dibagikan kepada siswa TK ABA 1 Grogol, Kapanewon Paliyan, Gunungkidul. - (Dok : Instagram fokusgunungkidul.)

Menanggapi kejadian ini, Kepala SPPG Mulusan 2, Muhammad Toriq Agus Firmansyah, buka suara. Ia membenarkan adanya laporan tersebut dan pihaknya langsung berkomunikasi dengan kepala sekolah.

""Kami sudah berkomunikasi dengan kepala sekolah dan melakukan penyesuaian, kami mengikuti prosedur yang berjalan sesuai SOP dan aturan bisnis yang berlaku. Kami juga akan melakukan perbaikan, termasuk dari pihak yayasan,"" ujarnya.

Ia mengaku hingga kini belum diketahui secara pasti bagaimana cicak tersebut bisa masuk ke dalam makanan. ""Saat produksi berlangsung pukul 01.00 dini hari, saya melakukan monitoring langsung di dapur STTD. Namun, asal muasal kejadian tersebut belum diketahui secara pasti,"" kata dia.

Peristiwa ini juga mendapat perhatian dari Kodim 0730Gunungkidul. Komandan Kodim 0730Gunungkidul, Letkol Inf Alfian Yudha Praniawan, membenarkan kejadian tersebut dan memastikan tidak ada korban.

""Kejadiannya di TK ABA 1 Grogol. Anak membawa makanan ke rumah, lalu dimakan orang tuanya. Sebelum habis dimakan, ibunya merasa aneh dan langsung meludahkannya,"" kata Letkol Alfian.

""Setelah dicek, ternyata ada binatang di dalam makanan. Belum sampai tertelan,"" ujarnya.

Ia menegaskan pihak orang tua penerima manfaat hanya ingin memastikan kejadian serupa tidak kembali terjadi. Karena itu, laporan tersebut disampaikan melalui jalur sekolah untuk perbaikan ke depan.

Kodim Gunungkidul juga telah memfasilitasi rapat penyelesaian yang melibatkan berbagai pihak. Pertemuan dihadiri oleh Babinsa, Bhabinkamtibmas, perwakilan SPPG, pihak yayasan, kepala sekolah, guru, orang tua penerima manfaat, serta perwakilan kelurahan.

""Semua pihak hadir dan masalah sudah diselesaikan,"" ujarnya.

Ke depan, Letkol Alfian memastikan akan memperketat pengawasan terhadap proses produksi MBG, mulai dari sortir bahan, kebersihan dapur, hingga pengecekan akhir sebelum distribusi, agar kejadian serupa tak terulang kembali. ""Kami menekankan agar pemilik SPPG dan yayasan lebih ketat dalam mensortir dan mengawasi makanan. Jika ada komplain, mereka harus bergerak cepat, datang ke lokasi, menanyakan masalah, dan menyelesaikannya secara transparan,"" ucap dia.

Ikuti Whatsapp Channel Republika",https://republika.co.id/berita//t8s5np282/cicak-ditemukan-di-dalam-bakwan-mbg-di-gunungkidul-sempat-dikunyah-lalu-dimuntahkan,3615,Karta Raharja Ucu,https:///static.republika.co.iduploadsimageskanal_slide041323200-1666873547-830-556.jpg,Kabar Jogja,2026-02-02 18:37:24,2,
190bf1448ad46c6d,"Senyum, Makanan Bergizi, dan Impian di Sekolah Rakyat Banjarbaru",2026-01-12 13:01:00,Erdy Nasrul,"REPUBLIKA.CO.ID, JAKARTA -- Senin pagi di Banjarbaru, Kalimantan Selatan, matahari bersinar lembut menyinari halaman Sekolah Rakyat Terpadu 9. Suara riuh rendah anak-anak berseragam rapi bercampur dengan harapan baru. Mereka bukan sedang menyambut hari biasa, melainkan menanti kedatangan seorang tamu istimewa: Presiden Republik Indonesia, Prabowo Subianto.

Kunjungan ini bukan sekadar agenda seremonial. Di sela peresmian 166 Sekolah Rakyat yang tersebar di seluruh Indonesia, Presiden memilih untuk menyelami langsung denyut nadi program andalannya: Makan Bergizi Gratis (MBG) dan pendidikan bagi anak-anak dari keluarga prasejahtera.

Memasuki aula besar sekolah, Presiden disambut pemandangan yang menghangatkan hati. Puluhan siswa duduk rapi di meja-meja panjang, berhadap-hadapan. Di hadapan setiap anak, tersaji sebuah nampan berisi makanan lengkap dengan lauk bergizi, segelas susu kemasan, dan air mineral. Inilah wajah konkret dari program MBG yang kini bukan lagi sekadar wacana.

Dengan langkah tenang, Presiden berkeliling. Matanya menyapu setiap meja, menatap wajah-wajah mungil yang mulai menyantap makanan dengan lahap. Sesekali, ia berhenti, menyapa, dan bertanya. Suasana cair dan hangat. Seorang anak perempuan dengan dua kuncir rambut tersenyum malu ketika Presiden membungkuk dan berbicara lembut kepadanya. Momen sederhana itu menangkap esensi program ini: bukan sekadar pemenuhan gizi, tetapi perhatian dan pengakuan bahwa masa depan mereka penting.

Usai meninjau MBG, Presiden berbincang serius dengan Menteri Sosial, Saifullah Yusuf. Percakapan itu menyiratkan bahwa program ini dipantau ketat, karena ia adalah ujung tombak strategi yang lebih besar.

Sekolah Rakyat sendiri adalah gagasan Presiden Prabowo untuk menjawab kesenjangan yang dalam. Ini adalah ruang kelas bagi anak-anak dari keluarga miskin dan miskin ekstrem yang kerap terlempar dari sistem pendidikan formal. Sebelum menyaksikan pertunjukan seni dan senam siswa, Presiden meninjau ruang kelas dan fasilitas sekolah. Ia melihat langsung bagaimana teknologi digital diintegrasikan untuk mengejar ketertinggalan pembelajaran.

Kunjungan itu pun berakhir dengan kesan personal. Presiden menyempatkan diri menandatangani buku dan berfoto bersama siswa serta orang tua yang hadir. Dikelilingi oleh para menteri, Panglima TNI, Kapolri, dan pejabat tinggi negara, momen ini seperti simbol komitmen kolektif pemerintah. Mereka semua hadir bukan hanya sebagai protokol, tetapi sebagai bagian dari sebuah misi nasional.

Peluncuran Sekolah Rakyat pada 12 Januari 2026 ini adalah penanda dimulainya perjalanan panjang. Dari 166 titik rintisan yang tersebar dari Sumatera hingga Papua, lebih dari 15.000 siswa sudah mulai belajar. Angka itu ditargetkan akan membesar seiring dengan dibukanya 500 titik Sekolah Rakyat pada 2029.

Di Banjarbaru hari itu, di balik hidangan bergizi yang dinikmati anak-anak, terselip sebuah cerita yang lebih besar. Ini adalah cerita tentang upaya memutus mata rantai kemiskinan dengan dua senjata utama: pendidikan berkualitas dan kecukupan gizi. Setiap suap nasi yang disantap, setiap pelajaran yang diterima di ruang kelas Sekolah Rakyat, adalah sebuah investasi. Bukan hanya untuk masa depan anak-anak itu sendiri, tetapi untuk masa depan Indonesia yang lebih seimbang dan berkeadilan.

Presiden mungkin telah meninggalkan Banjarbaru, namun semangat yang ditinggalkannya terus hidup. Hidup dalam semangat belajar puluhan anak di aula itu, dan dalam harapan baru yang kini menyala di 166 titik lainnya di seantero Nusantara.

Ikuti Whatsapp Channel Republika",https://republika.co.id/berita//t8qjh5451/senyum-makanan-bergizi-dan-impian-di-sekolah-rakyat-banjarbaru,3574,Erdy Nasrul,https:///static.republika.co.iduploadsimageskanal_slide037936900-1767871057-830-556.jpg,Nasional News,2026-02-02 18:37:26,2,
482813a0d965825c,"Perekonomian Meningkat, Relawan Dapur Minta Program MBG Terus Berlanjut",2026-01-11 09:59:33,Dwi Murdaningsih,"REPUBLIKA.CO.ID, SEMARANG - Relawan di Satuan Pelayanan Pemenuhan Gizi (SPPG) Semarang Tengah Gabahan dan SPPG Semarang Tengah Brumbungan sangat senang bisa bekerja di dapur Makan Bergizi Gratis (MBG). Mereka merasakan manfaat dan sangat terbantu secara ekonomi setelah bekerja di SPPG. Para relawan meminta Program MBG terus berlanjut.

Sugiyono, Ketua Rukun Warga (RW) sekaligus relawan SPPG Semarang Tengah Gabahan, mengaku sudah terinfo sejak awal ketika dapur MBG itu mulai dibangun. Sejak SPPG mulai beroperasi, hampir semua warganya bekerja di kedua dapur itu.

Dengan adanya dapur MBG, warga saya yang awalnya pengangguran, sekarang jadi punya pekerjaan, ujarnya, Sabtu (1012026).

Banyak ibu rumah tangga di wilayah RW-nya ikut bekerja di dapur MBG. Sebagai relawan dapur MBG, mereka bekerja sebagai pencuci ompreng, petugas penyiapan bahan makanan sebelum diolah, tukang masak, bagian pemorsian, hingga petugas pengantar makanan hingga sopir.

Warga saya antusias, setiap RT pasti ada yang bekerja di dapur sini, kata Sugiyono.

Ia pun bekerja sebagai relawan di dapur SPPG, di bagian keamanan. Sugiyono bekerja sebagai security dengan dua shift, pagi dan siang, dengan jam kerja 12 jam. Ia mengaku pendapatannya tidak selalu sama dalam satu periode, tapi kadang diberi tambahan.

Pendapatan setiap 2 minggu kadang Rp 1.500.000, kadang Rp 1.600.000, kadang Rp 1.700.000, tergantung hari liburnya, kata Sugiyono.

Sementara Irfan, relawan SPPG Semarang Tengah Brumbungan telah bekerja di SPPG itu sejak 29 September 2025. Sebelumnya ia bekerja dengan motornya, menjelajahi jalanan kota Semarang, sebagai ojek online .

Sebagai pengemudi ojek online , pendapatannya tak pasti. Karena itu ia kemudian bergabung menjadi relawan dapur MBG. Saya lebih senang bekerja di dapur, ujarnya.

Di SPPG itu, Irfan bekerja sebagai relawan di bagian cleaning service. Sejak bekerja di dapur MBG ia mengaku mendapatkan penghasilan yang jelas dan pasti. Kalau bekerja di dapur, saya mendapatkan pendapatan pasti Rp110.000 per hari, ujarnya.

Baik Sugiyono maupun Irfan mengaku banyak sukanya saat bekerja di dapur MBG. Kita enjoy bekerja di sini, kata Sugiyono. Sementara menurut Irfan, ia senang bekerja di dapur karena banyak mendapat rekan baru. Selain itu juga ada acara olahraga bareng, mini soccer, bersama kawan-kawan, ujarnya.

Karena itu keduanya merasa bersyukur. Alhamdulillah dengan adanya MBG, ekonomi masyarakat meningkat. Biasanya kekurangan, sekarang jadi terpenuhi kebutuhannya, kata Sugiyono. Dampak positif lainnya, jika masak berlebih, makanan kemudian dibagi-bagi ke warga sekitar dalam acara Jumat berkah. Saya berharap, MBG terus berlanjut, kata Irfan.

Ikuti Whatsapp Channel Republika",https://republika.co.id/berita//t8oiz9368/perekonomian-meningkat-relawan-dapur-minta-program-mbg-terus-berlanjut,2701,Dwi Murdaningsih,https:///static.republika.co.iduploadsimageskanal_slide012606600-1765902897-830-556.jpg,Nasional News,2026-02-02 18:37:26,2,
