article_id,judul,waktu_terbit,editor,konten,url,panjang_konten,author,thumbnail,kategori,created_at,search_page,search_date
d5e9c935aa03f34e,BGN tak Paksa Sekolah yang Menolak MBG,2026-01-25 08:30:24,Dwi Murdaningsih,"REPUBLIKA.CO.ID, BANYUWANGI - Wakil Kepala Badan Gizi Nasional (BGN) bidang Komunikasi Publik dan Investigasi, Nanik Sudaryati Deyang memastikan tidak boleh ada pemaksaan bagi sekolah mana pun untuk menerima program Makan Bergizi Gratis (MBG). Kepala Satuan Pelayanan Pemenuhan Gizi (SPPG) tidak boleh memaksa sekolah agar para siswanya menjadi penerima manfaat MBG.

Para Kepala SPPG tidak boleh memaksa. Kalau ada sekolah yang tidak mau menerima MBG, karena misalnya para siswa sekolah itu anak-anak orang yang mampu, ya nggak papa, kata Nanik dalam acara Koordinasi dan Evaluasi bersama Forkompimda, Kasatpel, Yayasan, Mitra, Korwil, dan seluruh Kepala SPPG se Kabupaten Banyuwangi di Kota Banyuwangi, Jawa Timur, Sabtu (2412026).

Temukan lebih banyak Berita bisnis Berita TNI Kolom opini

Temukan lebih banyak Berita bisnis Berita TNI Kolom opini

Temukan lebih banyak Berita bisnis Berita TNI Kolom opini

Nanik menjelaskan hal itu saat seorang Kepala SPPG dari salah satu Kecamatan di Kabupaten Banyuwangi yang mengeluhkan kesulitannya dalam memperbanyak jumlah penerima manfaat MBG di Kecamatannya. Penyebabnya, beberapa sekolah elit dengan jumlah siswa ribuan, menolak menerima MBG.

Sekolah itu tetap tidak mau menerima, walaupun sudah meminta bantuan Danramil maupun Kapolsek, ujarnya.

Wakil Kepala Badan Gizi Nasional (BGN) bidang Komunikasi Publik dan Investigasi, Nanik Sudaryati Deyang dalam acara Koordinasi dan Evaluasi bersama Forkompimda, Kasatpel, Yayasan, Mitra, Korwil, dan seluruh Kepala SPPG se Kabupaten Banyuwangi di Kota Banyuwangi, Jawa Timur, Sabtu (2412026). - (BGN)

Wakil Kepala Badan Gizi Nasional (BGN) bidang Komunikasi Publik dan Investigasi, Nanik Sudaryati Deyang dalam acara Koordinasi dan Evaluasi bersama Forkompimda, Kasatpel, Yayasan, Mitra, Korwil, dan seluruh Kepala SPPG se Kabupaten Banyuwangi di Kota Banyuwangi, Jawa Timur, Sabtu (2412026). - (BGN)

Prinsipnya, kata Nanik, pemerintah memang ingin memberikan MBG kepada seluruh anak Indonesia, agar tidak ada seorang pun anak Indonesia yang tidak mendapatkan gizi yang baik. Tapi, penerimaan MBG sifatnya suka rela.

Tidak boleh ada pemaksaan apalagi intimidasi dari SPPG atau dari instansi mana pun, bahwa seolah-olah sekolah yang tidak mau menerima MBG berarti tidak menyukseskan program pemerintah. Karena itu, jika sekolah-sekolah elit sudah mampu mencukupi kebutuhan gizi bagi para siswanya, dan memutuskan untuk tidak menerima MBG, maka hal itu tidak menjadi masalah.

Pokoknya, Ka SPPG kami, dari BGN tidak ada unsur pemaksaan sedikit pun, kata Ketua Harian Tim Koordinasi Pelaksana Program MBG yang melibatkan 17 Kementerian dan Lembaga itu.

Nanik menyarankan agar para Kepala SPPG berkeliling di wilayah cakupannya untuk mencari penerima manfaat lainnya yang lebih membutuhkan. Misalnya ke pesantren-pesantren kecil, anak-anak putus sekolah, anak-anak jalanan yang masih usia sekolah, ibu hamil, ibu menyusui, dan balita.

Masih banyak yang belum menerima MBG, sementara mereka sangat membutuhkan, kata Nanik.

Ikuti Whatsapp Channel Republika",https://republika.co.id/berita//t9ec6o368/bgn-tak-paksa%c2%a0sekolah-yang-menolak-mbg,3053,Dwi Murdaningsih,https:///static.republika.co.iduploadsimageskanal_slidewakil-kepala-badan-gizi-nasional-bgn-bidang-komunikasi-publik_260125082739-228.jpg,Nasional News,2026-02-02 18:36:54,1,
d3b436583632fb69,"Dukung MBG, Susu Ultra Lakukan Investasi Baru Hingga Rp1,1 T ",2026-01-25 08:15:32,Hasanul Rizqa,"REPUBLIKA.CO.ID, JAKARTA -- Kementerian Perindustrian (Kemenperin) RI mengapresiasi PT Ultrajaya Milk Industry Trading Company Tbk. Perusahaan tersebut diketahui melakukan investasi baru senilai Rp1,14 triliun untuk memenuhi pasokan susu UHT dalam program Makan Bergizi Gratis (MBG).

Menteri Perindustrian (Menperin) Agus Gumiwang mengatakan, industri pengolahan susu berperan strategis dalam menjamin ketersediaan pangan bergizi bagi masyarakat. Itu pun berlaku dalam mendukung implementasi MBG secara berkelanjutan.

Industri pengolahan susu nasional harus mampu menjawab kebutuhan program MBG, baik dari sisi kapasitas produksi, kualitas produk, maupun keberlanjutan pasokan bahan baku,"" ujar Menperin dalam keterangan pada Ahad (2512026).

Sebagai bentuk kesiapan, PT Ultrajaya telah mengoperasikan pabrik baru di Kawasan Industri MM 2100, Cibitung, Kabupaten Bekasi, Jawa Barat, sejak 8 Desember 2025. Fasilitas ini diketahui memiliki tiga lini produksi susu UHT dengan kemasan 125 ml dan 200 ml yang dirancang khusus untuk Program MBG.

Penambahan lini produksi lanjutan direncanakan mulai Maret 2026. Dari sisi teknologi, Menperin mengapresiasi pabrik Ultrajaya yang telah mengadopsi sistem industri 4.0 guna meningkatkan efisiensi dan menjaga kualitas produk.

Penerapan teknologi industri 4.0 terbukti dapat meningkatkan efisiensi, menghemat energi, meningkatkan produktivitas dan daya saing, serta menjaga kualitas produk, ujar Pelaksana Tugas Direktur Jenderal Industri Agro Putu Juli Ardik.

Untuk menjamin ketersediaan bahan baku dari sisi hulu, PT Ultrajaya saat ini mengelola dua peternakan sapi perah di Bandung (Jawa Barat) dan Sumatra Utara dengan total populasi sekitar tujuh ribu ekor sapi.

Ke depan, perusahaan juga berencana menambah investasi untuk 4.000 ekor sapi perah guna memperkuat pasokan susu segar dalam negeri.

Sebelumnya, Kemenperin telah menjalankan program digitalisasi di Tempat Penampungan Susu (TPS) untuk menjaga kualitas, kandungan protein, dan kesegaran susu segar.

Melalui penguatan investasi, penerapan teknologi digital, serta sinergi dengan peternak dan koperasi susu, Kemenperin optimistis industri pengolahan susu nasional mampu mendukung ketahanan pangan, meningkatkan nilai tambah dalam negeri, dan menyukseskan Program Makan Bergizi Gratis secara berkelanjutan.

Ikuti Whatsapp Channel Republika",https://republika.co.id/berita//t9ebhw458/dukung-mbg-susu-ultra-lakukan-investasi-baru-hingga-rp11-t,2349,Hasanul Rizqa,https:///static.republika.co.iduploadsimageskanal_slide031067500-1760086662-830-556.jpg,Bisnis,2026-02-02 18:36:54,1,
610832dcf7e7d8fd,"Viral Video MBG tak Sesuai Standar, BGN Beri Klarifikasi",2026-01-21 15:06:21,Friska Yolandha,"REPUBLIKA.CO.ID, JAKARTA -- Badan Gizi Nasional (BGN) mengklarifikasi video yang beredar di media sosial terkait Program Makan Bergizi Gratis (MBG) yang disebut tidak sesuai standar. Video tersebut dikaitkan dengan SD Neglasari, Kecamatan Gunung Sindur, Kabupaten Bogor, Jawa Barat.

Video yang beredar menampilkan menu MBG dengan narasi porsi tidak sesuai standar sehingga memicu perhatian publik, khususnya di kalangan orang tua siswa. Namun, berdasarkan hasil klarifikasi dan investigasi BGN, terungkap bahwa makanan yang dibagikan dalam video tersebut bukan berasal dari SD Neglasari, melainkan terjadi di SDN Pengasinan 2, Kecamatan Gunung Sindur, Kabupaten Bogor.

Ketua Tim Investigasi BGN Karimah Muhammad dalam keterangan resmi di Jakarta, Rabu, menegaskan bahwa kesalahan penyebutan lokasi dalam video berpotensi menimbulkan kesalahpahaman di tengah masyarakat.

Hasil investigasi kami memastikan lokasi yang disebutkan dalam video tidak sesuai dengan fakta. Penyaluran menu MBG yang dimaksud berlangsung di SDN Pengasinan 2, bukan di SD Neglasari, ujar Karimah.

Selain kesalahan lokasi, BGN juga memastikan tampilan menu dalam video tidak merepresentasikan kondisi saat MBG dibagikan kepada siswa. Menu yang direkam diketahui telah dibawa pulang oleh penerima manfaat.

Terkait narasi yang menyebutkan menu MBG tidak lengkap, Karimah memastikan lauk utama berupa ayam telah dikonsumsi terlebih dahulu oleh anak penerima manfaat sebelum video direkam.

Ayam dalam menu MBG tersebut telah dikonsumsi oleh anak penerima manfaat sebelum video direkam. Hal ini bahkan terdengar jelas dalam rekaman suara pada video. Oleh karena itu, narasi yang hanya menyebutkan buah dan lalapan tidak menggambarkan menu MBG secara utuh, tuturnya.

Ikuti Whatsapp Channel Republika",https://republika.co.id/berita//t97ful370/viral-video-mbg-tak-sesuai-standar-bgn-beri-klarifikasi,1772,Friska Yolandha,https:///static.republika.co.iduploadsimageskanal_slide078191600-1729936038-830-556.jpg,Nasional News,2026-02-02 18:36:57,1,
f80498f975d4b833,Dari Ladang ke Dapur: Mak Comblang Project BGN Pangkas Rantai Pasok Pangan,2026-01-21 20:55:58,Ferry kisihandi,"REPUBLIKA.CO.ID, CIANJUR -- Badan Gizi Nasional (BGN) memulai langkah strategis dalam memperkuat Program Makan Bergizi Gratis (MBG) melalui Mak Comblang Project, sebuah inisiatif yang bertujuan mempertemukan langsung petani dengan dapur MBG.

Program ini dirancang untuk menjawab persoalan klasik dalam rantai pasok pangan, yakni ketimpangan antara kapasitas produksi petani dan kebutuhan riil dapur MBG, khususnya di wilayah Jakarta dan Bogor.

Langkah awal Mak Comblang Project ditandai dengan pertemuan koordinasi bersama para petani dan Gapoktan di wilayah Cipanas, Kabupaten Cianjur, pada Senin (1912026). Pertemuan ini menjadi forum awal pemetaan rantai pasok untuk melihat kondisi lapangan secara apa adanya, baik dari sisi produksi maupun kebutuhan.

Jubir BGN, Dian Fatwa, menjelaskan, selama ini petani dan dapur MBG berjalan di jalur yang terpisah.

Di satu sisi, petani di Cipanas mengalami over supply. Namun di sisi lain, dapur MBG di Jakarta dan Bogor justru kesulitan mendapatkan bahan baku dengan harga yang stabil. Mak Comblang Project hadir untuk menyambungkan dua sisi ini secara langsung, ujarnya dalam keterangan, Rabu (2112026).

Dalam pemetaan awal, BGN menemukan adanya kesenjangan volume yang cukup signifikan. Pada komoditas jagung, misalnya, kapasitas produksi petani Cipanas berada di kisaran 30 ton per bulan, sementara kebutuhan dapur MBG di Jakarta sekitar 240 ton per bulan. Kesenjangan ini menunjukkan perlunya perencanaan produksi yang lebih selaras dengan kebutuhan.

Selain kesenjangan volume, pertemuan tersebut juga mengungkap disparitas harga yang selama ini terjadi di lapangan.

Dian mencontohkan komoditas wortel, di mana dapur MBG kerap membeli dengan harga Rp 15 ribu Rp25 ribu per kilogram, sementara petani hanya menerima Rp 1.500-Rp 3.000 per kilogram di tingkat kebun.

Disparitas ini bukan disebabkan satu pihak, tetapi akibat rantai pasok yang panjang dan tidak terhubung secara langsung, jelasnya.

Melalui Mak Comblang Project, BGN mulai memetakan komoditas, volume produksi, serta kebutuhan dapur secara terbuka. Hasil pemetaan ini akan menjadi dasar penyusunan kalender tanam dan kalender panen, sehingga petani dapat memanen secara bertahap dan berkelanjutan.

Pola ini diharapkan memberi kepastian pasar dan harga yang layak bagi petani, sekaligus memastikan pasokan bahan baku yang stabil bagi dapur MBG.

Ke depan, penyusunan menu MBG juga akan diselaraskan dengan ketersediaan produksi petani lokal, dengan melibatkan peran ahli gizi agar kualitas dan kecukupan gizi tetap terjaga.

Dengan mempertemukan langsung petani dan dapur, Mak Comblang Project diharapkan mampu menciptakan kolaborasi yang saling menguntungkan serta memperkuat ketahanan pangan berbasis masyarakat.

Ikuti Whatsapp Channel Republika",https://republika.co.id/berita//t97w1a472/dari-ladang-ke-dapur-mak-comblang-project-bgn-pangkas-rantai-pasok-pangan,2766,Ferry kisihandi,https:///static.republika.co.iduploadsimageskanal_slidebgn-memangkas-rantai-pasok-melalui-mak-comblang-project-langkah_260121205421-318.JPG,Nasional News,2026-02-02 18:36:57,1,
21494e22eb703506,"Puluhan Ribu Pegawai BGN Diangkat Jadi PPPK, FSGI: Melukai Hati Guru yang Berjuang Bertahun-tahun",2026-01-21 14:56:55,Andri Saubani,"REPUBLIKA.CO.ID, JAKARTA -- Sebanyak 32 ribu pegawai Badan Gizi Nasional (BGN) bakal diangkat menjadi pegawai pemerintah dengan perjanjian kerja (PPPK) pada Februari 2026. Mayoritas dari mereka bertugas sebagai kepala satuan pelayanan pemenuhan gizi (SPPG) atau dapur makan bergizi gratis (MBG).

Dewan Pakar Federasi Serikat Guru Indonesia (FSGI), Retno Listyarti, mengatakan pengangkatan para pegawai BGN menjadi PPPK sangat berpotensi menciptakan ketidakadilan bagi para guru honorer. Pasalnya, para pegawai BGN itu baru bekerja dalam waktu singkat, tapi sudah mendapatkan kesempatan diangkat menjadi PPPK.

Temukan lebih banyak Jadwal shalat Donasi Melalui Rumah Zakat Berita pendidikan Pelatihan Keuangan Syariah Webinar Tata Kelola Perusahaan Koran digital Pakaian Muslimah Modern Buku Sejarah Islam Konten digital Berita bisnis

Temukan lebih banyak Jadwal shalat Donasi Melalui Rumah Zakat Berita pendidikan Pelatihan Keuangan Syariah Webinar Tata Kelola Perusahaan Koran digital Pakaian Muslimah Modern Buku Sejarah Islam Konten digital Berita bisnis

""Jadi mereka belum genap, bahkan satu tahun ya, jadi kurang dari satu tahun, tapi mereka secara otomatis sudah bisa mengikuti CAT dan dipastikan mereka lolos gitu ya. Sementara untuk teman-teman guru, nggak gitu,"" kata dia saat dihubungi Republika , Rabu (2112026).

Ia mengungkapkan, selama ini banyak para guru yang harus menanti puluhan tahun untuk bisa menjadi PPPK. Pasalnya, tidak ada kepastian bagi guru yang mengikuti seleksi bisa lolos PPPK. Untuk mengikuti seleksi, para guru juga waktu setidaknya dua tahun mengajar.

""Sementara aturan ini ditabrak gitu oleh keputusan presiden gitu ya, yang terkait dengan pengangkatan pegawai SPPG ini untuk menjadi PPPK,"" kata Retno.

Ia menilai, pengangkatan pegawai BGN menjadi PPPK adalah sebuah privilese yang tidak didapatkan para guru. Sementara nasib guru honorer yang upahnya jauh di bawah upah minimum tidak mendapatkan kesempatan yang sama.

""Kalau dari sisi apa guru, tentu saja ini melukai rasa keadilan teman-teman guru. Karena teman-teman guru itu untuk berjuang menjadi PPPK sangat tidak mudah, butuh waktu bertahun-tahun,"" kata dia.

Cuan dari Dapur MBG - (Republika)

Cuan dari Dapur MBG - (Republika)

Ikuti Whatsapp Channel Republika",https://republika.co.id/berita//t97fev409/puluhan-ribu-pegawai-bgn-diangkat-jadi-pppk-fsgi-melukai-hati-guru-yang-berjuang-bertahun-tahun,2260,Andri Saubani,https:///static.republika.co.iduploadsimageskanal_slide0.91186400-1543139546-830-556.jpeg,Nasional News,2026-02-02 18:37:01,1,
2628fa6edeb968f0,"Anggaran MBG Rp 335 Triliun, Purbaya Perkirakan Hanya Terserap Rp 200 Triliun",2026-01-20 18:32:02,Erik Purnama Putra,"REPUBLIKA.CO.ID, JAKARTA -- Menteri Keuangan (Menkeu) Purbaya Yudhi Sadewa mengatakan bakal menyisir anggaran program Makan Bergizi Gratis (MBG) pada pekan depan. Purbaya mengatakan, anggaran MBG tahun ini tetap dialokasikan sebesar Rp 335 triliun.

Namun, ia akan mengevaluasi rencana anggaran untuk memastikan dana terserap optimal. ""Minggu depan akan saya lihat line per line anggaran mereka. Nanti kami lihat mana yang double counting ,"" ujar Purbaya di Jakarta, Selasa (2012026).

Temukan lebih banyak Berita bisnis Berita TNI Buku Sejarah Islam Berita internasional Langganan Majalah Islam Digest Konten digital Lulusan IT Layanan Verifikasi Berita Konsultasi Hukum Siber Berita pendidikan

Temukan lebih banyak Berita bisnis Berita TNI Buku Sejarah Islam Berita internasional Langganan Majalah Islam Digest Konten digital Lulusan IT Layanan Verifikasi Berita Konsultasi Hukum Siber Berita pendidikan

Dia mencontohkan, rencana anggaran MBG tahun 2025, untuk pembelian kendaraan bermotor roda dua untuk mendukung implementasi program. Namun, masih ada kendaraan yang belum terdistribusi hingga akhir tahun anggaran. ""Lumayan kan bisa saya coret (pos anggaran). Tapi saya akan lihat, masih ada atau nggak (anggaran) itu,"" kata Purbaya.

Melihat realisasi tahun lalu, Purbaya memperkirakan, penyerapan anggaran program MBG tahun ini juga tidak terpakai penuh. Dia memproyeksikan penyerapan setidaknya hanya Rp 200 triliun. Dengan begitu, ada sekitar Rp 135 triliun berpotensi menganggur.

""Kalau kami hitung, paling Rp 200 triliun juga cukup mungkin. Tapi nanti kami lihat. Kami akan lihat yang inefisien saja. Tapi program itu program bagus, kami akan dukung supaya jalannya maksimal,"" ujar Purbaya.

Berdasarkan perhitungan sementara Kementerian Keuangan, program MBG menyerap anggaran sebesar Rp 51,5 triliun per 31 Desember 2025. Angka itu setara 72,5 persen dari pagu Rp 71 triliun pada APBN 2025.

Nilai manfaat yang langsung diterima oleh masyarakat sebesar Rp 43,3 triliun. Anggaran itu disalurkan untuk penyediaan makanan bergizi bagi siswa, balita, ibu hamilmenyusui, serta guru dan tenaga kependidikan di Indonesia.

Ikuti Whatsapp Channel Republika",https://republika.co.id/berita//t95upe484/anggaran-mbg-rp-335-triliun-purbaya-perkirakan-hanya-terserap-rp-200-triliun,2164,Erik Purnama Putra,https:///static.republika.co.iduploadsimageskanal_slide_250908173241-407.png,Nasional News,2026-02-02 18:37:01,1,
d314a5bb5ca0654b,Dapur SPPG di Tulungagung Diperiksa Polisi Imbas Kasus Keracunan MBG di SMKN 3 Boyolangu,2026-01-20 20:36:05,Edwin Dwi Putranto,"REPUBLIKA.CO.ID, TULUNGAGUNG -- Petugas memeriksa sampel bahan baku makanan dan higienitas dapur Satuan Pelayanan Pemenuhan Gizi (SPPG) di Desa Moyoketen, Tulungagung, Jawa Timur, Selasa (2012026).

Pemeriksaan dilakukan menyusul dugaan keracunan makanan program Makan Bergizi Gratis (MBG) yang menyebabkan ratusan pelajar SMK Negeri 3 Boyolangu mengalami diare.

Ikuti Whatsapp Channel Republika

general_URL_gpt_producer-20250818-17:55

arrow_forward_ios Baca selengkapnya CANCEL NEXT VIDEO Pause Play buffered 00:00 00:02 01:22 Unmute Mute Play

arrow_forward_ios Baca selengkapnya

Pause Play buffered 00:00 00:02 01:22 Unmute Mute Play

Pause Play buffered 00:00 00:02 01:22 Unmute Mute Play

Pause Play buffered 00:00 00:02 01:22 Unmute Mute",https://republika.co.id/berita//t960g5375/dapur-sppg-di-tulungagung-diperiksa-polisi-imbas-kasus-keracunan-mbg-di-smkn-3-boyolangu,747,Edwin Dwi Putranto,https:///static.republika.co.iduploadsimageskanal_slide040468000-1768915847-830-556.jpg,Visual,2026-02-02 18:37:03,1,
2b3bc8e4a9402ce6,BGN Dorong Kopdes Merah Putih Jadi Pemasok Program MBG,2026-01-20 16:22:40,Satria K Yudha,"REPUBLIKA.CO.ID, JAKARTA Kepala Badan Gizi Nasional Dadan Hindayana berharap semakin banyak Koperasi Desa Merah Putih berperan sebagai pemasok bahan baku pangan Program Makan Bergizi Gratis pada 2026. Penguatan pemasok berbasis desa dinilai penting untuk menjaga kesinambungan pasokan dan dampak ekonomi lokal.

Diharapkan tahun ini kontribusi Koperasi Desa Merah Putih akan terus meningkat, kata Kepala BGN Dadan Hindayana di Jakarta, Selasa (2012026).

Diharapkan tahun ini kontribusi Koperasi Desa Merah Putih akan terus meningkat, kata Kepala BGN Dadan Hindayana di Jakarta, Selasa (2012026).

BGN mencatat hingga 20 Januari 2026 terdapat 61.857 pemasok bahan baku pangan MBG. Jumlah tersebut terdiri dari 7.098 koperasi, 806 BUMDes, 82 BUMDesma, 26.899 UMKM, 26.773 pemasok lain, serta 199 Koperasi Desa Merah Putih.

BGN mencatat hingga 20 Januari 2026 terdapat 61.857 pemasok bahan baku pangan MBG. Jumlah tersebut terdiri dari 7.098 koperasi, 806 BUMDes, 82 BUMDesma, 26.899 UMKM, 26.773 pemasok lain, serta 199 Koperasi Desa Merah Putih.

Sementara itu, penerima manfaat Program MBG tercatat mencapai 59,86 juta orang. Penerima meliputi balita, PAUD, Raudhatul Athfal, peserta didik sekolah, pesantren, hingga tenaga pendidik. Dari segi penerima manfaat makan bergizi ada sekitar 59,86 juta orang, kata Dadan.

Sementara itu, penerima manfaat Program MBG tercatat mencapai 59,86 juta orang. Penerima meliputi balita, PAUD, Raudhatul Athfal, peserta didik sekolah, pesantren, hingga tenaga pendidik. Dari segi penerima manfaat makan bergizi ada sekitar 59,86 juta orang, kata Dadan.

BGN menilai perluasan cakupan penerima manfaat dari pondok pesantren dan sekolah keagamaan masih memiliki ruang besar. Untuk itu, peningkatan jumlah Satuan Pelayanan Pemenuhan Gizi menjadi fokus pada awal 2026.

BGN menilai perluasan cakupan penerima manfaat dari pondok pesantren dan sekolah keagamaan masih memiliki ruang besar. Untuk itu, peningkatan jumlah Satuan Pelayanan Pemenuhan Gizi menjadi fokus pada awal 2026.

Kami masih harus meningkatkan cakupan pondok pesantren dan sekolah keagamaan lain. SPPG perlu dibangun sejak awal tahun karena pesantren baru mencakup sekitar 534.000 penerima manfaat, kata Dadan.

Kami masih harus meningkatkan cakupan pondok pesantren dan sekolah keagamaan lain. SPPG perlu dibangun sejak awal tahun karena pesantren baru mencakup sekitar 534.000 penerima manfaat, kata Dadan.

Ia menyebut pendataan lapangan masih terus dilakukan karena tidak seluruh pesantren tercatat di Kementerian Agama. Pembaruan data rutin dipandang penting untuk memperluas jangkauan program.

Ia menyebut pendataan lapangan masih terus dilakukan karena tidak seluruh pesantren tercatat di Kementerian Agama. Pembaruan data rutin dipandang penting untuk memperluas jangkauan program.

Per hari ini, BGN mencatat 21.102 SPPG telah menjangkau 59,86 juta penerima manfaat dengan kebutuhan dana operasional harian mencapai Rp855 miliar.

Per hari ini, BGN mencatat 21.102 SPPG telah menjangkau 59,86 juta penerima manfaat dengan kebutuhan dana operasional harian mencapai Rp855 miliar.

Dari total anggaran MBG, sekitar 70 persen dialokasikan untuk pembelian bahan baku pangan, 20 persen untuk operasional termasuk relawan, dan 10 persen untuk insentif mitra.

Dari total anggaran MBG, sekitar 70 persen dialokasikan untuk pembelian bahan baku pangan, 20 persen untuk operasional termasuk relawan, dan 10 persen untuk insentif mitra.

Program Makan Bergizi Gratis mulai berjalan pada 6 Januari 2025 dengan 190 SPPG di 26 provinsi dan terus diperluas seiring peningkatan kapasitas layanan.

Program Makan Bergizi Gratis mulai berjalan pada 6 Januari 2025 dengan 190 SPPG di 26 provinsi dan terus diperluas seiring peningkatan kapasitas layanan.

Ikuti Whatsapp Channel Republika",https://republika.co.id/berita//t95ops416/bgn-dorong-kopdes-merah-putih-jadi-pemasok-program-mbg,3782,Satria K Yudha,https:///static.republika.co.iduploadsimageskanal_slide023484500-1768404928-830-556.jpg,Bisnis,2026-02-02 18:37:04,1,
bbbbe57f70652b91,"BGN: Sepanjang 2025 Ada 19.188 SPPG Layani 55,1 Juta Penerima MBG",2026-01-20 14:29:51,Friska Yolandha,"REPUBLIKA.CO.ID, JAKARTA -- Kepala Badan Gizi Nasional (BGN) Dadan Hindayana menyampaikan bahwa sepanjang 2025 jumlah Satuan Pelayanan Pemenuhan Gizi (SPPG) mencapai 19.188 unit. Penerima manfaat Program Makan Bergizi Gratis (MBG) pada 2025 mencapai sebanyak 55,1 juta orang.

Pada tanggal 31 Desember 2025, kita tutup dengan jumlah SPPG 19.188 dan melayani 55,1 juta penerima manfaat, kata Dadan Hindayana dalam Rapat Dengar Pendapat (RDP) BGN dengan Komisi IX DPR RI di Jakarta, Selasa.

Ia mengatakan capaian tersebut terwujud berkat dana bantuan pemerintah yang terserap untuk Program MBG sebesar Rp 55,2 triliun, melebihi target awal sebesar Rp 52,2 triliun.

Dana bantuan pemerintah yang terserap untuk makan bergizi Rp 55,2 triliun melebihi target yang seharusnya Rp 52,2 triliun karena Badan Gizi Nasional mendapatkan tambahan anggaran dari Kementerian Keuangan. Total porsi yang kami olah selama satu tahun kurang lebih 3,7 miliar porsi, kata Dadan Hindayana.

Ia menambahkan, per 19 Januari 2026 tercatat telah berdiri 21.102 SPPG yang menjangkau 58,3 juta penerima manfaat Program MBG dengan dana operasional harian mencapai Rp 855 miliar.

Realisasi anggaran sampai hari ini sudah mendekati Rp 18 triliun. Per 16 Januari 2026 tercatat Rp 17,398 triliun, dan per pagi ini sudah mendekati Rp 18 triliun, ujarnya.

Dari total anggaran Program MBG, lanjutnya, sebanyak 70 persen digunakan untuk pembelian bahan baku pangan, 20 persen untuk membiayai operasional termasuk menggaji relawan, dan 10 persen dialokasikan sebagai insentif bagi seluruh mitra yang bergabung dalam Program MBG.

Program MBG mulai dilaksanakan pada 6 Januari 2025 dengan diawali pendirian 190 SPPG di 26 provinsi di Indonesia.

Ikuti Whatsapp Channel Republika",https://republika.co.id/berita//t95jhr370/bgn-sepanjang-2025-ada-19-188-sppg-layani-551-juta-penerima-mbg,1742,Friska Yolandha,https:///static.republika.co.iduploadsimageskanal_slide061201100-1768436317-830-556.jpg,Nasional News,2026-02-02 18:37:05,1,
