article_id,judul,waktu_terbit,editor,konten,url,panjang_konten,author,thumbnail,kategori,created_at,search_page,search_date
1f0edc79e39f3a11,Wamenkop Ajak Koperasi Pesantren Masuk Rantai Pasok MBG,2026-01-31 08:15:21,Gita Amanda,"REPUBLIKA.CO.ID, JAKARTA -- Wakil Menteri Koperasi (Wamenkop) Farida Farichah melakukan kunjungan kerja di Sumatra Utara dengan mengunjungi Koperasi Sekunder Bisnis Pesantren (KSBP) Pondok Pesantren Al-Kautsar Al-Akbar, Medan. Farida mengapresiasi Pondok Pesantren Al-Kautsar Al-Akbar dapat berperan sebagai penyerap produk-produk hasil bumi dan olahan dari warga dan bahkan pesantren di sekitarnya.

Sejumlah produk yang menjadi unggulan Pondok Pesantren Al-Kautsar Al-Akbar antara lain beras, bawang merah, minyak goreng, hingga air minum dalam kemasan.

Saya sangat senang karena produk yang dijual disini merupakan hasil menanam sendiri dan bisa memberdayakan pesantren, ujar dia dalam keterangan tertulis di Jakarta, Jumat (3012026).

Farida menyampaikan Koperasi Pondok Pesantren (Koppontren) Al-Kautsar Al-Akbar juga menyuplai kebutuhan dalam ekosistem program prioritas Makan Bergizi Gratis (MBG). Koperasi ini menyuplai kebutuhan dapur Satuan Pelayanan Pemenuhan Gizi (SPPG) Al-Kautsar Al-Akbar, yang melayani sebanyak 3.650 penerima manfaat.

Selain itu, ia juga mendorong agar Koperasi Pondok Pesantren Al-Kautsar Al-Akbar untuk menjadi pusat distribusi atau distribution center (DC) bagi produk-produk milik pondok pesantren di sekitar Kota Medan. Farida pun menyarankan agar pengurus Koperasi Pondok Pesantren Al-Kautsar Al-Akbar dapat belajar dari koperasi pondok pesantren yang telah memainkan peran sebagai pusat distributor.

Dia juga meminta agar produk-produk yang dijual oleh Koperasi Pondok Pesantren Al-Kautsar Al-Akbar, dapat turut dijual di Koperasi Desa (Kopdes) Merah Putih.

Produk-produk koperasi pesantren bisa disuplai ke seluruh Kopdes Merah Putih. Minimal ada di seluruh desa di Sumatra Utara, sebelum menyebar ke seluruh Indonesia, kata Farida.

Ikuti Whatsapp Channel Republika",https://republika.co.id/berita//t9pfhl423/wamenkop-ajak-koperasi-pesantren-masuk-rantai-pasok-mbg,1811,Gita Amanda,https:///static.republika.co.iduploadsimageskanal_slide032873500-1768309298-830-556.jpg,Bisnis,2026-02-02 18:36:33,1,
edbe9294daf2b1e5,6 Rekomendasi Fahira Idris Terkait MBG Saat Ramadan,2026-01-31 09:29:25,Dwi Murdaningsih,"REPUBLIKA.CO.ID, JAKARTA - Anggota DPD RI Dapil DKI Jakarta Fahira Idris menyampaikan enam rekomendasi strategis agar pelaksanaan Program Makan Bergizi Gratis (MBG) selama bulan Ramadan tetap berjalan optimal, aman, dan berdampak nyata bagi pemenuhan gizi anak, balita, serta ibu hamil. Rekomendasi ini disampaikan merespons berbagai penyesuaian pelaksanaan MBG di bulan puasa yang memerlukan tata kelola lebih cermat dan konsisten.

Menurutnya, Ramadan merupakan fase penting yang menguji kesiapan sistem MBG. Perubahan waktu makan, penyesuaian menu, serta jeda antara distribusi dan konsumsi makanan menghadirkan tantangan tersendiri, terutama terkait kualitas gizi dan keamanan pangan. Karena itu,

Program MBG saat Ramadan harus tetap diposisikan sebagai program pemenuhan gizi, bukan sekadar distribusi makanan tahan lama. Kualitas gizi harus menjadi prioritas, meskipun ada penyesuaian menu dan waktu konsumsi, ujar Fahira Idris di Komplek Parlemen, Senayan, Jakarta, Jumat (3012026).

Senator Jakarta ini menegaskan, setidaknya ada enam rekomendasi yang patut mendapat perhatian oleh Badan Gizi Nasional (BGN), Satuan Pelayanan Pemenuhan Gizi (SPPG) atau Dapur MGB dan para pemangku kepentingan terkait lainnya.

Pertama, menegaskan kembali MBG Ramadan sebagai kebijakan gizi yang berorientasi pada kualitas. Menu yang diberikan harus tetap mengandung protein berkualitas, mikronutrien penting, serta membatasi gula, garam, dan pangan ultra-olahan, meskipun dikemas dalam bentuk makanan kering atau dibawa pulang.

Kedua, Fahira menekankan strategisnya peran SPPG sebagai garda terdepan pelaksanaan MBG Ramadan. Menurutnya, di tangan SPPG-lah kualitas menu, keamanan pangan, dan kepatuhan terhadap standar benar-benar diuji.

SPPG adalah ujung tombak MBG. Saat Ramadan, peran mereka menjadi semakin krusial agar menghilangkan semua potensi risiko. Karena itu, penguatan pengawasan, kapasitas SDM, serta disiplin sanitasi di SPPG harus menjadi perhatian utama, kata Fahira Idris yang juga aktivis perlindungan anak ini.

Rekomendasi ketiga, kata Fahira, menjadikan petunjuk teknis (juknis) nasional sebagai acuan tunggal. Juknis harus dipahami dan dijalankan secara konsisten oleh seluruh daerah agar tidak terjadi perbedaan kualitas pelaksanaan MBG, khususnya selama Ramadan.

Keempat, pentingnya memastikan standar menu MBG yang setara di seluruh wilayah. Ia menegaskan setiap anak Indonesia berhak mendapatkan kualitas MBG yang sama baiknya, tanpa dibedakan oleh lokasi geografis, baik di kota besar, daerah 3T, maupun lingkungan pesantren.

Fleksibilitas lokal boleh ada, tetapi standar gizi dan keamanan pangan harus tetap sama. Keseteraan mutu antar wilayah harus dijaga, ungkapnya.

Rekomendasi kelima, Fahira menekankan bahwa keamanan pangan harus menjadi prioritas utama. Jeda waktu antara distribusi dan konsumsi makanan menuntut penerapan pengawasan yang lebih ketat, mulai dari label batas waktu konsumsi, sistem manajemen persediaan pangan untuk memastikan keamanan dan kesegaran makanan, hingga audit rutin dapur SPPG.

Keenam, Fahira mendorong agar MBG Ramadan tidak boleh diperlakukan sekadar sebagai penyesuaian teknis, melainkan harus tetap dijaga sebagai kebijakan gizi yang utuh.MBG Ramadan dimanfaatkan sebagai momentum edukasi dan evaluasi. Selain sebagai sarana literasi gizi bagi siswa dan keluarga, akhir Ramadan perlu dijadikan titik evaluasi nasional untuk menilai kinerja SPPG, kepatuhan juknis, kesetaraan standar menu, serta efektivitas pengawasan keamanan pangan.

Semoga Ramadan ini menjadi momentum refleksi bersama. Dari sini kita bisa memastikan MBG berkembang sebagai kebijakan kesehatan publik jangka panjang yang benar-benar melindungi dan menyehatkan generasi masa depan, kata Fahira.

Ikuti Whatsapp Channel Republika",https://republika.co.id/berita//t9pix1368/6-rekomendasi-fahira-idris-terkait-mbg-saat-ramadan,3763,Dwi Murdaningsih,https:///static.republika.co.iduploadsimageskanal_slide012606600-1765902897-830-556.jpg,Nasional News,2026-02-02 18:36:34,1,
858e6cfa3363840a,"Rp1 Kembali 5 Kali Lipat, Presiden Prabowo Sebut MBG Bikin Amerika Penasaran",2026-02-02 16:45:13,Erdy Nasrul,"REPUBLIKA.CO.ID, JAKARTA -- Presiden Prabowo Subianto menyatakan bahwa program Makan Bergizi Gratis (MBG) kini menjadi sorotan dunia, bahkan mulai dipelajari oleh pakar internasional termasuk dari Gedung Putih, Amerika Serikat. Program ini dinilai bukan sekadar bantuan pangan, melainkan investasi sosial dan ekonomi strategis yang mampu mengubah arah perputaran uang agar lebih banyak beredar di desa ketimbang tersedot ke kota atau ke luar negeri.

Dalam Rakornas Pemerintah Pusat dan Daerah 2026 di Sentul, Bogor, Senin (222026), Kepala Negara menegaskan bahwa MBG adalah pilar penting menuju swasembada pangan yang memperkuat ketahanan nasional dari akar rumput. Prabowo menjelaskan Rp1 yang dikeluarkan untuk MBG akan kembali lima kali lipat. Pernyataan Presiden Prabowo mengenai nilai imbal balik (return) lima kali lipat dari program Makan Bergizi Gratis (MBG) merujuk pada konsep investasi manusia yang berdampak jangka panjang terhadap ekonomi nasional.

Secara teori, setiap rupiah yang dikeluarkan pemerintah tidak hilang sebagai konsumsi semata, melainkan bertransformasi menjadi peningkatan kualitas kesehatan dan kecerdasan anak bangsa. Hal ini sejalan dengan kajian dari Rockefeller Institute of Government yang menempatkan program pemenuhan gizi sebagai investasi terbaik karena mampu menekan beban biaya kesehatan negara di masa depan serta menciptakan tenaga kerja yang lebih produktif dan berdaya saing tinggi.

Dalam jangka pendek, efek pengganda (multiplier effect) ini terlihat dari perputaran ekonomi lokal di sekitar dapur Satuan Pelayanan Pemenuhan Gizi (SPPG). Uang negara dialirkan langsung ke desa-desa untuk membeli hasil panen petani, ternak dari peternak, dan melibatkan UMKM lokal sebagai pemasok.

Dengan menciptakan jutaan lapangan kerja baru dan menghidupkan rantai pasok pangan di tingkat akar rumput, setiap satu rupiah yang diinvestasikan memicu aktivitas ekonomi yang luas, sehingga mencegah penumpukan modal hanya di kota besar atau mengalir ke luar negeri.

Hingga saat ini, MBG telah menjangkau sekitar 60 juta penerima manfaat dalam satu tahun, melampaui keraguan berbagai pihak yang memprediksi kegagalan teknis berskala besar. Presiden mengungkapkan bahwa statistik keberhasilan program mencapai 99,99 persen, sebuah capaian yang menurutnya membuktikan efektivitas sistem distribusi gizi nasional. Secara ekonomi, program ini telah menggerakkan 22.275 dapur Satuan Pelayanan Pemenuhan Gizi (SPPG) yang menyerap bahan pangan dari petani dan peternak lokal. Jika target 82 juta penerima tercapai pada Desember 2026, MBG diproyeksikan mampu menciptakan hingga 5 juta lapangan kerja baru di tingkat desa.

Rockefeller Institute of Government merupakan lembaga penelitian kebijakan publik yang berbasis di New York, Amerika Serikat, dan berafiliasi dengan State University of New York (SUNY). Berfokus pada analisis berbasis data untuk membantu pemerintah dalam mengambil keputusan yang efektif, institut ini dikenal luas karena keahliannya dalam mengkaji kebijakan fiskal, kesehatan, dan pendidikan.

Dalam konteks global, penilaian lembaga ini terhadap MBG sebagai ""investasi terbaik"" memperkuat kredibilitas program tersebut di mata komunitas internasional karena dianggap mampu memberikan imbal hasil ekonomi yang berlipat ganda bagi pembangunan sebuah negara.

Badan Gizi Nasional (BGN) Regional Papua Barat terus mengoptimalkan pemanfaatan komoditas pangan lokal dalam pelaksanaan program Makan Bergizi Gratis (MBG). Langkah ini diambil sebagai upaya strategis untuk memperkuat ekonomi kerakyatan serta memberdayakan petani dan pedagang asli Papua.

Ikuti Whatsapp Channel Republika",https://republika.co.id/berita//t9tsfd451/rp1-kembali-5-kali-lipat-presiden-prabowo-sebut-mbg-bikin-amerika-penasaran,3628,Erdy Nasrul,https:///static.republika.co.iduploadsimageskanal_slide031828400-1769145445-830-556.jpg,Nasional News,2026-02-02 18:36:34,1,
4a3eba0afbb59235,Ratusan Siswa di Muaro Jambi Dirawat Usai Mengonsumsi Makanan MBG,2026-01-31 23:30:00,Edwin Dwi Putranto,"REPUBLIKA.CO.ID, MUARO JAMBI -- Pelajar yang mengalami gejala keracunan makanan berbaring usai mendapatkan penanganan medis di RSUD Ahmad Ripin, Sengeti, Muaro Jambi, Jambi, Jumat (3012026) malam.

Sedikitnya 110 pelajar tingkat kanak-kanak hingga menengah atas di Kecamatan Sekernan, Muaro Jambi itu mengalami gejala keracunan makanan yang diduga akibat makan Makan Bergizi Gratis (MBG) di sekolah mereka.

Ikuti Whatsapp Channel Republika

general_URL_gpt_producer-20250820-17:35

arrow_forward_ios Baca selengkapnya CANCEL NEXT VIDEO Pause Play buffered 00:00 00:00 01:15 Unmute Mute Play

arrow_forward_ios Baca selengkapnya

Pause Play buffered 00:00 00:00 01:15 Unmute Mute Play

Pause Play buffered 00:00 00:00 01:15 Unmute Mute Play

Pause Play buffered 00:00 00:00 01:15 Unmute Mute",https://republika.co.id/berita//t9qjok375/ratusan-siswa-di-muaro-jambi-dirawat-usai-mengonsumsi-makanan-mbg,791,Edwin Dwi Putranto,https:///static.republika.co.iduploadsimageskanal_slide067039300-1769873882-830-556.jpg,Visual,2026-02-02 18:36:34,1,
fd94aac7ac6a2a82,Zulhas: Indonesia Harus Swasembada Protein Agar MBG tak Bergantung Impor,2026-02-01 19:25:14,Karta Raharja Ucu,"REPUBLIKA.CO.ID, SEMARANG -- Menteri Koordinator Bidang Pangan, Zulkifli Hasan (Zulhas), menargetkan swasembada produk protein tahun ini. Hal itu guna menyokong program Makan Bergizi Gratis (MBG) yang penerima manfaatnya diprediksi bakal melampaui 90 juta orang.

Zulhas menyebut, swasembada protein dibutuhkan agar Indonesia tak perlu melakukan impor. Zulhas menerangkan, penerima manfaat MBG tahun ini akan mencapai 82,9 juta orang, terdiri dari pelajar, ibu hamil, balita, dan lansia.

""Perintah Presiden begitu, tidak boleh ada anak-anak Indonesia yang makannya tidak bergizi,"" kata Zulhas saat meresmikan Koperasi Kelurahan Merah Putih (KKMP) Sampangan di Kota Semarang, Jawa Tengah, Jumat (3012026).

Dia menambahkan, penerima manfaat MBG bisa melampaui 90 juta orang. ""Saudara-saudara bayangkan, 90 juta lebih kalau butuh ikan satu potong, satu hari kita butuh 90 juta potong ikan,"" ujarnya.

Hal itu berlaku jika MBG menggunakan lauk protein lainnya. ""Kalau perlu telur satu, maka satu hari perlu 90 juta butir telur. Kalau kita enggak swasembada pangan, bagaimana? Impor kita yang gede itu bisa tambah-tambah,"" kata Zulhas.

Dalam pidatonya sebelumnya, Zulhas memang sempat menyinggung bahwa Indonesia masih harus mengimpor jutaan ton gandum, kedelai, termasuk gula. Namun dia menyebut, tahun lalu Indonesia sudah berhasil swasembada beras dengan surplus produksi mencapai 4 juta ton.

""Oleh karena itu harus swasembada. Tahun lalu kita berhasil swasembada karbohidrat. Tahun ini kita harus berhasil swasembada pangan protein: ikan, telur, ayam,"" ucap Zulhas.

Dia mengatakan, salah satu cara pemerintah mengejar produksi produk protein adalah dengan membangun 2.000 Kampung Nelayan Merah Putih. ""Bioflok akan dibangun di tiap desa satu. Kemudian tambak-tambak besar di Jawa akan dibangun 20 ribu hektare untuk ngejar agar ikan kita bisa melimpah,"" ujarnya.

Menurut Zulhas, program-program prioritas Presiden saling terkait. Dia menyebut, Presiden telah meneken aturan bahwa bahan baku pembuatan MBG harus disuplai oleh Koperasi Merah Putih atau UMKM dan badan usaha milik desa (BumDes).

""Karena saya sebagai ketua tim, di aturan sudah saya buat, Presiden sudah teken, suplai SPPG harus dari koperasi, UMKM, BumDes, dan usaha rakyat lainnya. Tidak bisa nanti perusahaan besar, konglomerat, menyuplai SPPG, enggak bisa,"" ucap Zulhas.

Ikuti Whatsapp Channel Republika",https://republika.co.id/berita//t9s562282/zulhas-indonesia-harus-swasembada-protein-agar-mbg-tak-bergantung-impor,2377,Karta Raharja Ucu,https:///static.republika.co.iduploadsimageskanal_slidementeri-koordinator-menko-bidang-pangan-zulkifli-hasan-meninjau-dan_260130211641-989.jpeg,Jateng,2026-02-02 18:36:36,1,
98563bcc02079796,"117 Siswa di Kudus Diduga Keracunan MBG, Wagub Jateng: Nanti Kita Cek dan Evaluasi",2026-01-30 16:23:54,Karta Raharja Ucu,"REPUBLIKA.CO.ID, SEMARANG -- Wakil Gubernur Jawa Tengah (Jateng) Taj Yasin mengatakan, Pemprov Jateng akan memeriksa pelaksanaan program Makan Bergizi Gratis (MBG) di SMAN 2 Kudus, termasuk satuan pelayanan pemenuhan gizi (SPPG) yang menjadi penyuplai makanan. Hal itu merespons adanya 117 siswa di sekolah tersebut yang diduga mengalami keracunan MBG.

""Nanti kita akan cek ya. Biasanya itu kita langsung cek, bagaimana mereka ada penanganan, nanti kita lihat, kita evaluasi MBG-nya, sehingga nanti bisa kita tentukan permasalahannya di mana,"" kata Yasin di Kota Semarang saat dimintai tanggapannya soal kasus dugaan keracunan MBG di SMAN 2 Kudus.

Temukan lebih banyak pendidikan Pendidikan Kesehatan

Temukan lebih banyak pendidikan Pendidikan Kesehatan

Temukan lebih banyak pendidikan Pendidikan Kesehatan

Dia menambahkan, Pemprov Jateng juga akan memeriksa SPPG yang menjadi penyuplai MBG ke SMAN 2 Kudus. "" Kayak biasanya kan, diinvestigasi bagaimana izin-izinnya dan kelanjutannya bagaimana ada tahapan-tahapannya,"" ujar Yasin.

Plt Kepala Dinas Kesehatan (Dinkes) Kabupaten Kudus, Mustiko Wibowo, mengungkapkan, terdapat 117 siswa SMAN 2 Kudus yang mengalami gejala keracunan setelah mengonsumsi MBG. ""Ya, 117 siswa. Sebagian besar rawat jalan. Ada sebagian yang dirawat inap,"" ujarnya.

Dia menambahkan, siswa yang menjalani rawat inap di rumah sakit berjumlah 46 orang. Mustiko mengeklaim, meski dirawat, kondisi para siswa cukup stabil.

Menurut Mustiko, tim dari Dinkes Kudus telah mendatangi dan melakukan pemeriksaan awal terhadap SPPG yang menyuplai MBG ke SMAN 2 Kudus, yakni SPPG Purwosari. Dinkes Kudus juga mengambil sampel bahan makanan untuk diuji di laboratorium.

Namun Mustiko tak mengungkap apa saja sampel yang diambil oleh timnya. Sementara itu Sekretaris Tim Satgas Percepatan MBG Provinsi Jateng, Hanung Triyono, mengungkapkan, kegiatan operasional SPPG Purwosari di Kabupaten Demak telah dihentikan sementara. Hal tersebut merespons kasus dugaan keracunan puluhan siswa di SMAN 2 Kudus.

Ikuti Whatsapp Channel Republika",https://republika.co.id/berita//t9o7fu282/117-siswa-di-kudus-diduga-keracunan-mbg-wagub-jateng-nanti-kita-cek-dan-evaluasi,2052,Karta Raharja Ucu,https:///static.republika.co.iduploadsimageskanal_slide089531100-1769686475-830-556.jpg,Jateng,2026-02-02 18:36:40,1,
ba993a9f0212af64,Zulhas Sebut RI Harus Swasembada Protein agar MBG Tak Bergantung Impor,2026-01-30 21:59:56,Ahmad Fikri Noor,"REPUBLIKA.CO.ID, SEMARANG Menteri Koordinator Bidang Pangan Zulkifli Hasan (Zulhas) menargetkan swasembada produk protein pada tahun ini. Hal itu guna menyokong program Makan Bergizi Gratis (MBG) yang jumlah penerima manfaatnya diprediksi melampaui 90 juta orang. Zulhas menyebut swasembada protein dibutuhkan agar Indonesia tidak perlu bergantung pada impor.

Zulhas menerangkan penerima manfaat MBG tahun ini akan mencapai 82,9 juta orang, terdiri dari pelajar, ibu hamil, balita, dan lansia.

""Perintah Presiden begitu, tidak boleh ada anak-anak Indonesia yang makannya tidak bergizi,"" kata Zulhas saat meresmikan Koperasi Kelurahan Merah Putih (KKMP) Sampangan di Kota Semarang, Jawa Tengah, Jumat (3012026).

Ia menambahkan penerima manfaat MBG berpotensi melampaui 90 juta orang.

""Saudara-saudara bayangkan, 90 juta lebih kalau butuh ikan satu potong, satu hari kita butuh 90 juta potong ikan,"" ujarnya.

Hal itu juga berlaku jika MBG menggunakan lauk protein lainnya.

""Kalau perlu telur satu, maka satu hari perlu 90 juta butir telur. Kalau kita enggak swasembada pangan, bagaimana? Impor kita yang gede itu bisa tambah-tambah,"" kata Zulhas.

Dalam pidatonya sebelumnya, Zulhas sempat menyinggung bahwa Indonesia masih harus mengimpor jutaan ton gandum, kedelai, termasuk gula. Namun, ia menyebut pada tahun lalu Indonesia telah berhasil swasembada beras dengan surplus produksi mencapai 4 juta ton.

""Oleh karena itu harus swasembada. Tahun lalu kita berhasil swasembada karbohidrat. Tahun ini kita harus berhasil swasembada pangan protein: ikan, telur, ayam,"" ucap Zulhas.

Ia mengatakan salah satu cara pemerintah mengejar produksi protein adalah dengan membangun 2.000 Kampung Nelayan Merah Putih.

""Bioflok akan dibangun di tiap desa satu. Kemudian tambak-tambak besar di Jawa akan dibangun 20 ribu hektare untuk ngejar agar ikan kita bisa melimpah,"" ujarnya.

Menurut Zulhas, program-program prioritas Presiden saling terkait. Ia menyebut Presiden telah meneken aturan bahwa bahan baku pembuatan MBG harus disuplai oleh Koperasi Merah Putih, UMKM, dan badan usaha milik desa (BumDes).

""Karena saya sebagai ketua tim, di aturan sudah saya buat, Presiden sudah teken, suplai SPPG harus dari koperasi, UMKM, BumDes, dan usaha rakyat lainnya. Tidak bisa nanti perusahaan besar, konglomerat, menyuplai SPPG, enggak bisa,"" ucap Zulhas.

Ikuti Whatsapp Channel Republika",https://republika.co.id/berita//t9omzw490/zulhas-sebut-ri-harus-swasembada-protein-agar-mbg-tak-bergantung-impor,2379,Ahmad Fikri Noor,https:///static.republika.co.iduploadsimageskanal_slidementeri-koordinator-bidang-pangan-indonesia-zulkifli-hasan-memberikan-sambutan_251016162741-575.jpg,Pertanian,2026-02-02 18:36:40,1,
7debcbcf5c9c6343,MBG dan Penciptaan Lapangan Kerja Sama Pentingnya,2026-01-30 11:51:43,Hasanul Rizqa,"Apa betul Makan Bergizi Gratis (MBG) lebih mendesak daripada penciptaan lapangan kerja, seperti yang disampaikan oleh Menteri Perencanaan Pembangunan Nasional (PPN)Kepala Badan Perencanaan Pembangunan Nasional (Bappenas) Rachmat Pambudy baru-baru ini?

Saya rasa, pernyataan Menteri tersebut ada benarnya, tetapi itu untuk anak-anak dari keluarga miskin dan tidak untuk anak-anak dari keluarga kaya.

Jumlah orang miskin di negeri ini, menurut data Badan Pusat Statistik (BPS) pada Maret 2025, mencapai 23,85 juta jiwa. Ini setara kira-kira 8,47 persen dari total penduduk Indonesai. Jumlah anak di Indonesia yang perlu diberi makan bergizi, menurut pemerintah, untuk tahun 2026 adalah sekitar 82,9 juta anak.

Jika 10 persen dari anak-anak tersebut yang benar-benar mendesak diberi MBG lantaran kefakiran dan kemiskinan orang tuanya, itu berarti yang perlu diberi MBG ""hanya"" sebanyak 8,3 juta anak. Adapun yang 90 persennya termasuk kategori tidak-mendesak, atau bahkan tidak memerlukan MBG sama sekali. Sebab, orang tua mereka sudah mampu menyediakan makanan bergizi bagi buah hatinya di rumah. Malahan, boleh jadi sajian di rumah mereka itu jauh lebih bergizi daripada yang bisa diberikan oleh pemerintah.

Total anggaran yang diperlukan sebesar Rp335 triliun untuk 82,9 juta anak pada tahun 2026. Hal itu berarti, dana yang benar-benar diperlukan untuk mendukung program MBG bagi anak-anak dari keluarga miskin ""hanya"" sekitar Rp33,5 triliun.

Sisanya, sekitar Rp301,5 triliun bisa dipergunakan untuk pemberdayaan dan penciptaan lapangan kerja, terutama bagi warga negara Indonesia yang tergolong kategori miskin.

Menteri Perencanaan Pembangunan Nasional (PPN)Kepala Badan Perencanaan Pembangunan Nasional (Bappenas) Rachmat Pambudy. - (RepublikaThoudy Badai)

Menteri Perencanaan Pembangunan Nasional (PPN)Kepala Badan Perencanaan Pembangunan Nasional (Bappenas) Rachmat Pambudy. - (RepublikaThoudy Badai)

Jika diandaikan modal yang diperlukan untuk pemberdayaan dan penciptaan lapangan kerja bagi masing-masing orang miskin tersebut sekitar Rp20 juta, maka lapangan kerja baru yang bisa terbentuk sekitar 15.075.000 pelaku usaha.

Jika penduduk miskin di Tanah Air sekitar 23,85 juta jiwa (menurut data BPS Maret 2025), maka dalam masa dua tahun dengan menggunakan dana yang semula diperuntukkan untuk MBG, pemerintah sudah bisa melakukan dua hal krusial.

Pertama, pemerintah akan bisa memberikan MBG kepada anak-anak yang memang benar-benar membutuhkannya.

Kedua, pemerintah dapat mengentaskan kemiskinan di negeri ini dengan memberdayakan dan menciptakan lapangan kerja baru bagi sekitar 15 juta orang per tahun.

Kalau ini bisa dilakukan, pada tahun kedua tentu kemiskinan di negeri ini dapat lebih dientaskan. Pada tahun ketiga dan atau berikutnya, pemerintah tidak lagi perlu memberikan MBG kepada para siswa. Sebab, orang tua mereka sudah pada bekerja dan hasil dari usaha memampukan mereka untuk menyediakan dan atau membayar makanan bergizi bagi buah hatinya di rumah.

) Dr H Anwar Abbas MM MAg atau yang akrab disapa Buya Anwar Abbas merupakan Wakil Ketua Umum Majelis Ulama Indonesia (MUI) Pusat. Dosen tetap Prodi Perbankan Syariah FEB UIN Syarif Hidayatullah ini juga adalah Ketua Pimpinan Pusat Muhammadiyah Bidang UMKM, Pemberdayaan Masyarakat, dan Lingkungan Hidup.

Ikuti Whatsapp Channel Republika",https://republika.co.id/berita//t9nuu7458/mbg-dan-penciptaan-lapangan-kerja-sama-pentingnya,3326,Hasanul Rizqa,https:///static.republika.co.iduploadsimageskanal_slide024517200-1765868422-830-556.jpg,Kalam,2026-02-02 18:36:41,1,
